[
  {
    "tittel": "47/1,24 TILLATELSE TIL TILTAK - TEKNISK ANLEGG MED LEKEPLASS, VEG, VANN OG AVLØP",
    "dato": "29.12.2006",
    "dato_iso": "2006-12-29",
    "dokumentID": "2006/20627",
    "dokumenttype": "Saksframlegg",
    "avsender_mottaker": "",
    "journal_link": "https://www.strand.kommune.no/tjenester/politikk-innsyn-og-medvirkning/postliste-dokumenter-og-vedtak/sok-i-post-dokumenter-og-saker/#/details/a-6965376f__8677__47ea__a757__23e14c179149-2006002828!48ZczT/d-6965376f__8677__47ea__a757__23e14c179149-2006020627!HDAV2k",
    "filer": [
      {
        "tekst": "47/1,24 TILLATELSE TIL TILTAK - TEKNISK ANLEGG MED LEKEPLASS, VEG, VANN OG AVLØP (pdf, 293KB)",
        "url": "https://www.strand.kommune.no/api/presentation/v2/nye-innsyn/filer/v-6965376f__8677__47ea__a757__23e14c179149-22820_1_A!d-2006020627!pl26Pn?pid=29"
      }
    ],
    "status": "Publisert"
  },
  {
    "tittel": "45/98 TILLATELSE TIL TILTAK - BOLIG OG GARASJE",
    "dato": "27.12.2006",
    "dato_iso": "2006-12-27",
    "dokumentID": "2006/20070",
    "dokumenttype": "Saksframlegg",
    "avsender_mottaker": "",
    "journal_link": "https://www.strand.kommune.no/tjenester/politikk-innsyn-og-medvirkning/postliste-dokumenter-og-vedtak/sok-i-post-dokumenter-og-saker/#/details/a-6965376f__8677__47ea__a757__23e14c179149-2006002551!R8R5EF/d-6965376f__8677__47ea__a757__23e14c179149-2006020070!ls2Chl",
    "filer": [
      {
        "tekst": "45/98 TILLATELSE TIL TILTAK - BOLIG OG GARASJE (pdf, 278KB)",
        "url": "https://www.strand.kommune.no/api/presentation/v2/nye-innsyn/filer/v-6965376f__8677__47ea__a757__23e14c179149-22189_1_A!d-2006020070!KEkdHY?pid=29"
      }
    ],
    "status": "Publisert"
  },
  {
    "tittel": "44/1 M.FL. TILLATELSE TIL TILTAK - SIKRINGSTILTAK I TUÅNA",
    "dato": "22.12.2006",
    "dato_iso": "2006-12-22",
    "dokumentID": "2006/20507",
    "dokumenttype": "Saksframlegg",
    "avsender_mottaker": "",
    "journal_link": "https://www.strand.kommune.no/tjenester/politikk-innsyn-og-medvirkning/postliste-dokumenter-og-vedtak/sok-i-post-dokumenter-og-saker/#/details/a-6965376f__8677__47ea__a757__23e14c179149-2006002806!wJQ9OV/d-6965376f__8677__47ea__a757__23e14c179149-2006020507!pwPRmB",
    "filer": [
      {
        "tekst": "44/1 M.FL. TILLATELSE TIL TILTAK - SIKRINGSTILTAK I TUÅNA (pdf, 98KB)",
        "url": "https://www.strand.kommune.no/api/presentation/v2/nye-innsyn/filer/v-6965376f__8677__47ea__a757__23e14c179149-22662_1_A!d-2006020507!33shyH?pid=29"
      }
    ],
    "status": "Publisert"
  },
  {
    "tittel": "49/11- IGANGSETTING TRINN 2 - SILOANLEGG",
    "dato": "21.12.2006",
    "dato_iso": "2006-12-21",
    "dokumentID": "2006/20402",
    "dokumenttype": "Saksframlegg",
    "avsender_mottaker": "",
    "journal_link": "https://www.strand.kommune.no/tjenester/politikk-innsyn-og-medvirkning/postliste-dokumenter-og-vedtak/sok-i-post-dokumenter-og-saker/#/details/a-6965376f__8677__47ea__a757__23e14c179149-2006002136!89H1if/d-6965376f__8677__47ea__a757__23e14c179149-2006020402!dfvkfx",
    "filer": [
      {
        "tekst": "49/11- IGANGSETTING TRINN 2 - SILOANLEGG (pdf, 98KB)",
        "url": "https://www.strand.kommune.no/api/presentation/v2/nye-innsyn/filer/v-6965376f__8677__47ea__a757__23e14c179149-22556_1_A!d-2006020402!ctySxv?pid=29"
      }
    ],
    "status": "Publisert"
  },
  {
    "tittel": "49/553,30,73,438,151,442,124,439 TILLATELSE TIL TILTAK - MONTASJE AV PREFAB. BETONG OPP TIL TERRENG, OLDEIDEGÅRDEN",
    "dato": "21.12.2006",
    "dato_iso": "2006-12-21",
    "dokumentID": "2006/20456",
    "dokumenttype": "Saksframlegg",
    "avsender_mottaker": "",
    "journal_link": "https://www.strand.kommune.no/tjenester/politikk-innsyn-og-medvirkning/postliste-dokumenter-og-vedtak/sok-i-post-dokumenter-og-saker/#/details/a-6965376f__8677__47ea__a757__23e14c179149-2006002207!sb4fOr/d-6965376f__8677__47ea__a757__23e14c179149-2006020456!flhauK",
    "filer": [
      {
        "tekst": "49/553,30,73,438,151,442,124,439 TILLATELSE TIL TILTAK - MONTASJE AV PREFAB. BETONG OPP TIL TERRENG, OLDEIDEGÅRDEN (pdf, 296KB)",
        "url": "https://www.strand.kommune.no/api/presentation/v2/nye-innsyn/filer/v-6965376f__8677__47ea__a757__23e14c179149-22598_1_A!d-2006020456!Bz7cUW?pid=29"
      }
    ],
    "status": "Publisert"
  },
  {
    "tittel": "4/4 TILLATELSE TIL TILTAK - NYBYGG",
    "dato": "20.12.2006",
    "dato_iso": "2006-12-20",
    "dokumentID": "2006/20374",
    "dokumenttype": "Saksframlegg",
    "avsender_mottaker": "",
    "journal_link": "https://www.strand.kommune.no/tjenester/politikk-innsyn-og-medvirkning/postliste-dokumenter-og-vedtak/sok-i-post-dokumenter-og-saker/#/details/a-6965376f__8677__47ea__a757__23e14c179149-2006002830!2tH0DB/d-6965376f__8677__47ea__a757__23e14c179149-2006020374!6i5v45",
    "filer": [
      {
        "tekst": "4/4 TILLATELSE TIL TILTAK - NYBYGG (pdf, 96KB)",
        "url": "https://www.strand.kommune.no/api/presentation/v2/nye-innsyn/filer/v-6965376f__8677__47ea__a757__23e14c179149-22523_1_A!d-2006020374!k8ewwa?pid=29"
      }
    ],
    "status": "Publisert"
  },
  {
    "tittel": "SØKNAD OM DISPENSASJON FRA BYGGELINJE FOR OPPFØRING AV GARASJE PÅ GNR 53/65 HAGAVEGEN",
    "dato": "18.12.2006",
    "dato_iso": "2006-12-18",
    "dokumentID": "2006/19559",
    "dokumenttype": "Saksframlegg",
    "avsender_mottaker": "",
    "journal_link": "https://www.strand.kommune.no/tjenester/politikk-innsyn-og-medvirkning/postliste-dokumenter-og-vedtak/sok-i-post-dokumenter-og-saker/#/details/a-6965376f__8677__47ea__a757__23e14c179149-2006002247!5Q6vNn/d-6965376f__8677__47ea__a757__23e14c179149-2006019559!rPtKLY",
    "filer": [
      {
        "tekst": "SØKNAD OM DISPENSASJON FRA BYGGELINJE FOR OPPFØRING AV GARASJE PÅ GNR 53/65 HAGAVEGEN (pdf, 285KB)",
        "url": "https://www.strand.kommune.no/api/presentation/v2/nye-innsyn/filer/v-6965376f__8677__47ea__a757__23e14c179149-21613_1_A!d-2006019559!4zBKvF?pid=29"
      },
      {
        "tekst": "Situasjonskart - Reguleringsplan.pdf (pdf, 1010KB)",
        "url": "https://www.strand.kommune.no/api/presentation/v2/nye-innsyn/filer/v-6965376f__8677__47ea__a757__23e14c179149-21636_1_A!d-2006019559!4U4hcI?pid=29"
      }
    ],
    "status": "Publisert"
  },
  {
    "tittel": "KLAGE PÅ AVSLAG OM DISPENSASJON TIL BYGGING AV NAUST PÅ GNR 43/10 NEDRE BARKVED",
    "dato": "18.12.2006",
    "dato_iso": "2006-12-18",
    "dokumentID": "2006/19366",
    "dokumenttype": "Saksframlegg",
    "avsender_mottaker": "",
    "journal_link": "https://www.strand.kommune.no/tjenester/politikk-innsyn-og-medvirkning/postliste-dokumenter-og-vedtak/sok-i-post-dokumenter-og-saker/#/details/a-6965376f__8677__47ea__a757__23e14c179149-2006002081!BK0rXw/d-6965376f__8677__47ea__a757__23e14c179149-2006019366!iFY47h",
    "filer": [
      {
        "tekst": "KLAGE PÅ AVSLAG OM DISPENSASJON TIL BYGGING AV NAUST PÅ GNR 43/10 NEDRE BARKVED (pdf, 171KB)",
        "url": "https://www.strand.kommune.no/api/presentation/v2/nye-innsyn/filer/v-6965376f__8677__47ea__a757__23e14c179149-21399_1_A!d-2006019366!I6njKs?pid=29"
      },
      {
        "tekst": "KLAGE OVER VEDTAK I FORVALTNINGSUTVALGET 26.10.06 - SØKNAD OM DISPENSASJON FRA (pdf, 199KB)",
        "url": "https://www.strand.kommune.no/api/presentation/v2/nye-innsyn/filer/v-6965376f__8677__47ea__a757__23e14c179149-19209_1_A!d-2006019366!eSiAxn?pid=29"
      },
      {
        "tekst": "Oversiktskart.pdf (pdf, 247KB)",
        "url": "https://www.strand.kommune.no/api/presentation/v2/nye-innsyn/filer/v-6965376f__8677__47ea__a757__23e14c179149-17338_1_A!d-2006019366!B1leXE?pid=29"
      },
      {
        "tekst": "Reguleringsplan.pdf (pdf, 581KB)",
        "url": "https://www.strand.kommune.no/api/presentation/v2/nye-innsyn/filer/v-6965376f__8677__47ea__a757__23e14c179149-17336_1_A!d-2006019366!yDpCvM?pid=29"
      },
      {
        "tekst": "Søknad om dispensasjon.pdf (pdf, 1,1MB)",
        "url": "https://www.strand.kommune.no/api/presentation/v2/nye-innsyn/filer/v-6965376f__8677__47ea__a757__23e14c179149-17341_1_A!d-2006019366!LnX4Pg?pid=29"
      },
      {
        "tekst": "Søknad om dispensasjon.pdf (pdf, 94KB)",
        "url": "https://www.strand.kommune.no/api/presentation/v2/nye-innsyn/filer/v-6965376f__8677__47ea__a757__23e14c179149-17340_1_A!d-2006019366!dSoxTf?pid=29"
      },
      {
        "tekst": "SØKNAD OM DISPENSASJON FRA REGULERINGSPLAN FOR BYGGING AV NAUST PÅ GNR 43/10 NEDRE BARKVED (pdf, 134KB)",
        "url": "https://www.strand.kommune.no/api/presentation/v2/nye-innsyn/filer/v-6965376f__8677__47ea__a757__23e14c179149-17322_1_A!d-2006019366!IJyF5J?pid=29"
      }
    ],
    "status": "Publisert"
  },
  {
    "tittel": "23/6 SKOGSVEG HEGGHEIM",
    "dato": "18.12.2006",
    "dato_iso": "2006-12-18",
    "dokumentID": "2006/20241",
    "dokumenttype": "Saksframlegg",
    "avsender_mottaker": "",
    "journal_link": "https://www.strand.kommune.no/tjenester/politikk-innsyn-og-medvirkning/postliste-dokumenter-og-vedtak/sok-i-post-dokumenter-og-saker/#/details/a-6965376f__8677__47ea__a757__23e14c179149-2006002859!XjSgpS/d-6965376f__8677__47ea__a757__23e14c179149-2006020241!8Tmofz",
    "filer": [
      {
        "tekst": "23/6 SKOGSVEG HEGGHEIM (pdf, 366KB)",
        "url": "https://www.strand.kommune.no/api/presentation/v2/nye-innsyn/filer/v-6965376f__8677__47ea__a757__23e14c179149-22379_1_A!d-2006020241!Xfb9DL?pid=29"
      }
    ],
    "status": "Publisert"
  },
  {
    "tittel": "53/325 TILLATELSE TIL TILTAK -GARASJE",
    "dato": "18.12.2006",
    "dato_iso": "2006-12-18",
    "dokumentID": "2006/20209",
    "dokumenttype": "Saksframlegg",
    "avsender_mottaker": "",
    "journal_link": "https://www.strand.kommune.no/tjenester/politikk-innsyn-og-medvirkning/postliste-dokumenter-og-vedtak/sok-i-post-dokumenter-og-saker/#/details/a-6965376f__8677__47ea__a757__23e14c179149-2006001136!qknu9a/d-6965376f__8677__47ea__a757__23e14c179149-2006020209!Bx6gz8",
    "filer": [
      {
        "tekst": "53/325 TILLATELSE TIL TILTAK -GARASJE (pdf, 290KB)",
        "url": "https://www.strand.kommune.no/api/presentation/v2/nye-innsyn/filer/v-6965376f__8677__47ea__a757__23e14c179149-22356_1_A!d-2006020209!PfAzEa?pid=29"
      }
    ],
    "status": "Publisert"
  },
  {
    "tittel": "KLAGE PÅ VEDTAK OM AVSLAG PÅ DISPENSASJON FRA BYGGELINJE TIL GARASJE PÅ 44/156 OG 384 FJELLTUNVEGEN",
    "dato": "18.12.2006",
    "dato_iso": "2006-12-18",
    "dokumentID": "2006/19401",
    "dokumenttype": "Saksframlegg",
    "avsender_mottaker": "",
    "journal_link": "https://www.strand.kommune.no/tjenester/politikk-innsyn-og-medvirkning/postliste-dokumenter-og-vedtak/sok-i-post-dokumenter-og-saker/#/details/a-6965376f__8677__47ea__a757__23e14c179149-2006002385!Wuli1Z/d-6965376f__8677__47ea__a757__23e14c179149-2006019401!5L7AwN",
    "filer": [
      {
        "tekst": "KLAGE PÅ VEDTAK OM AVSLAG PÅ DISPENSASJON FRA BYGGELINJE TIL GARASJE PÅ 44/156 OG 384 FJELLTUNVEGEN (pdf, 130KB)",
        "url": "https://www.strand.kommune.no/api/presentation/v2/nye-innsyn/filer/v-6965376f__8677__47ea__a757__23e14c179149-21447_1_A!d-2006019401!Y82IiQ?pid=29"
      },
      {
        "tekst": "KLAGE PÅ VEDTAK - FORVALTNINGSUTVALGET SAK 128/06 - MØTE 26.10.06 (pdf, 269KB)",
        "url": "https://www.strand.kommune.no/api/presentation/v2/nye-innsyn/filer/v-6965376f__8677__47ea__a757__23e14c179149-20665_1_A!d-2006019401!wi9Frj?pid=29"
      },
      {
        "tekst": "Søknad om disp.pdf (pdf, 1,2MB)",
        "url": "https://www.strand.kommune.no/api/presentation/v2/nye-innsyn/filer/v-6965376f__8677__47ea__a757__23e14c179149-17366_1_A!d-2006019401!mmoTEG?pid=29"
      },
      {
        "tekst": "Reg.plan og oversiktskart.pdf (pdf, 1,2MB)",
        "url": "https://www.strand.kommune.no/api/presentation/v2/nye-innsyn/filer/v-6965376f__8677__47ea__a757__23e14c179149-17367_1_A!d-2006019401!NMOg2Q?pid=29"
      },
      {
        "tekst": "SØKNAD OM DISPENSASJON FRA BYGGELINJE FOR OPPFØRING AV GARASJE PÅ 44/156 OG 384, FJELLTUNVEIEN (pdf, 136KB)",
        "url": "https://www.strand.kommune.no/api/presentation/v2/nye-innsyn/filer/v-6965376f__8677__47ea__a757__23e14c179149-17356_1_A!d-2006019401!fh3VZ1?pid=29"
      }
    ],
    "status": "Publisert"
  },
  {
    "tittel": "7/2 TILLATELSE TIL TILTAK - TERRENGARBEIDER OG FYLLING I SJØ",
    "dato": "15.12.2006",
    "dato_iso": "2006-12-15",
    "dokumentID": "2006/19782",
    "dokumenttype": "Saksframlegg",
    "avsender_mottaker": "",
    "journal_link": "https://www.strand.kommune.no/tjenester/politikk-innsyn-og-medvirkning/postliste-dokumenter-og-vedtak/sok-i-post-dokumenter-og-saker/#/details/a-6965376f__8677__47ea__a757__23e14c179149-2006002557!qM8BFX/d-6965376f__8677__47ea__a757__23e14c179149-2006019782!P4ndOR",
    "filer": [
      {
        "tekst": "7/2 TILLATELSE TIL TILTAK - TERRENGARBEIDER OG FYLLING I SJØ (pdf, 293KB)",
        "url": "https://www.strand.kommune.no/api/presentation/v2/nye-innsyn/filer/v-6965376f__8677__47ea__a757__23e14c179149-21849_1_A!d-2006019782!YvBx6J?pid=29"
      }
    ],
    "status": "Publisert"
  },
  {
    "tittel": "MØTEBOK KOM 13.12.2006",
    "dato": "15.12.2006",
    "dato_iso": "2006-12-15",
    "dokumentID": "2006/20130",
    "dokumenttype": "Møtebok",
    "avsender_mottaker": "",
    "journal_link": "https://www.strand.kommune.no/tjenester/politikk-innsyn-og-medvirkning/postliste-dokumenter-og-vedtak/sok-i-post-dokumenter-og-saker/#/details/a-6965376f__8677__47ea__a757__23e14c179149-2006000396!m3mvDd/d-6965376f__8677__47ea__a757__23e14c179149-2006020130!zJ5RGL",
    "filer": [],
    "status": "Må bes om innsyn"
  },
  {
    "tittel": "61/26 UTSLIPPSTILLATELSE - BOLIG",
    "dato": "14.12.2006",
    "dato_iso": "2006-12-14",
    "dokumentID": "2006/20016",
    "dokumenttype": "Saksframlegg",
    "avsender_mottaker": "",
    "journal_link": "https://www.strand.kommune.no/tjenester/politikk-innsyn-og-medvirkning/postliste-dokumenter-og-vedtak/sok-i-post-dokumenter-og-saker/#/details/a-6965376f__8677__47ea__a757__23e14c179149-2006001864!QqIfP3/d-6965376f__8677__47ea__a757__23e14c179149-2006020016!7uhXlk",
    "filer": [
      {
        "tekst": "61/26 UTSLIPPSTILLATELSE - FRITIDSBOLIG (pdf, 334KB)",
        "url": "https://www.strand.kommune.no/api/presentation/v2/nye-innsyn/filer/v-6965376f__8677__47ea__a757__23e14c179149-22139_1_A!d-2006020016!RP7hx5?pid=29"
      }
    ],
    "status": "Publisert"
  },
  {
    "tittel": "Møtebok KLA 12.12.2006",
    "dato": "13.12.2006",
    "dato_iso": "2006-12-13",
    "dokumentID": "2006/20003",
    "dokumenttype": "Møtebok",
    "avsender_mottaker": "",
    "journal_link": "https://www.strand.kommune.no/tjenester/politikk-innsyn-og-medvirkning/postliste-dokumenter-og-vedtak/sok-i-post-dokumenter-og-saker/#/details/a-6965376f__8677__47ea__a757__23e14c179149-2006002764!oiiaLt/d-6965376f__8677__47ea__a757__23e14c179149-2006020003!b3JGmq",
    "filer": [],
    "status": "Må bes om innsyn"
  },
  {
    "tittel": "KOM 13.12.2006",
    "dato": "12.12.2006",
    "dato_iso": "2006-12-12",
    "dokumentID": "2006/19939",
    "dokumenttype": "Møteprotokoll",
    "avsender_mottaker": "",
    "journal_link": "https://www.strand.kommune.no/tjenester/politikk-innsyn-og-medvirkning/postliste-dokumenter-og-vedtak/sok-i-post-dokumenter-og-saker/#/details/a-6965376f__8677__47ea__a757__23e14c179149-2006000396!m3mvDd/d-6965376f__8677__47ea__a757__23e14c179149-2006019939!LMywbL",
    "filer": [],
    "status": "Må bes om innsyn"
  },
  {
    "tittel": "Møtebok ADM 12.12.2006",
    "dato": "11.12.2006",
    "dato_iso": "2006-12-11",
    "dokumentID": "2006/19914",
    "dokumenttype": "Møtebok",
    "avsender_mottaker": "",
    "journal_link": "https://www.strand.kommune.no/tjenester/politikk-innsyn-og-medvirkning/postliste-dokumenter-og-vedtak/sok-i-post-dokumenter-og-saker/#/details/a-6965376f__8677__47ea__a757__23e14c179149-2006002798!fOV3uB/d-6965376f__8677__47ea__a757__23e14c179149-2006019914!Xmf7Gr",
    "filer": [],
    "status": "Må bes om innsyn"
  },
  {
    "tittel": "DELING AV GRUNNEIENDOM, GN 13/12",
    "dato": "08.12.2006",
    "dato_iso": "2006-12-08",
    "dokumentID": "2006/19757",
    "dokumenttype": "Saksframlegg",
    "avsender_mottaker": "",
    "journal_link": "https://www.strand.kommune.no/tjenester/politikk-innsyn-og-medvirkning/postliste-dokumenter-og-vedtak/sok-i-post-dokumenter-og-saker/#/details/a-6965376f__8677__47ea__a757__23e14c179149-2006000492!yv34Cr/d-6965376f__8677__47ea__a757__23e14c179149-2006019757!3qhjxh",
    "filer": [
      {
        "tekst": "DELING AV GRUNNEIENDOM, GN 13/12 (pdf, 84KB)",
        "url": "https://www.strand.kommune.no/api/presentation/v2/nye-innsyn/filer/v-6965376f__8677__47ea__a757__23e14c179149-21820_1_A!d-2006019757!yAFgBN?pid=29"
      }
    ],
    "status": "Publisert"
  },
  {
    "tittel": "MØTEBOK FVA 07.12.2006",
    "dato": "08.12.2006",
    "dato_iso": "2006-12-08",
    "dokumentID": "2006/19804",
    "dokumenttype": "Møtebok",
    "avsender_mottaker": "",
    "journal_link": "https://www.strand.kommune.no/tjenester/politikk-innsyn-og-medvirkning/postliste-dokumenter-og-vedtak/sok-i-post-dokumenter-og-saker/#/details/a-6965376f__8677__47ea__a757__23e14c179149-2006000405!yKJVz6/d-6965376f__8677__47ea__a757__23e14c179149-2006019804!krBScR",
    "filer": [
      {
        "tekst": "Møtebok FVA 07.12.2006 (pdf, 1,3MB)",
        "url": "https://www.strand.kommune.no/api/presentation/v2/nye-innsyn/filer/v-6965376f__8677__47ea__a757__23e14c179149-21884_1_A!d-2006019804!g8EhN2?pid=29"
      }
    ],
    "status": "Publisert"
  },
  {
    "tittel": "FVA 07.12.2006",
    "dato": "07.12.2006",
    "dato_iso": "2006-12-07",
    "dokumentID": "2006/19677",
    "dokumenttype": "Møteprotokoll",
    "avsender_mottaker": "",
    "journal_link": "https://www.strand.kommune.no/tjenester/politikk-innsyn-og-medvirkning/postliste-dokumenter-og-vedtak/sok-i-post-dokumenter-og-saker/#/details/a-6965376f__8677__47ea__a757__23e14c179149-2006000405!yKJVz6/d-6965376f__8677__47ea__a757__23e14c179149-2006019677!ss4193",
    "filer": [
      {
        "tekst": "FVA 07.12.2006 (pdf, 580KB)",
        "url": "https://www.strand.kommune.no/api/presentation/v2/nye-innsyn/filer/v-6965376f__8677__47ea__a757__23e14c179149-21742_1_A!d-2006019677!64LLW3?pid=29"
      }
    ],
    "status": "Publisert"
  },
  {
    "tittel": "43/4 TILLATELSE TIL TILTAK - TREBRYGGE",
    "dato": "06.12.2006",
    "dato_iso": "2006-12-06",
    "dokumentID": "2006/19612",
    "dokumenttype": "Saksframlegg",
    "avsender_mottaker": "",
    "journal_link": "https://www.strand.kommune.no/tjenester/politikk-innsyn-og-medvirkning/postliste-dokumenter-og-vedtak/sok-i-post-dokumenter-og-saker/#/details/a-6965376f__8677__47ea__a757__23e14c179149-2006002477!2rLjvz/d-6965376f__8677__47ea__a757__23e14c179149-2006019612!uuy3Tl",
    "filer": [
      {
        "tekst": "43/4 TILLATELSE TIL TILTAK - TREBRYGGE (pdf, 97KB)",
        "url": "https://www.strand.kommune.no/api/presentation/v2/nye-innsyn/filer/v-6965376f__8677__47ea__a757__23e14c179149-21673_1_A!d-2006019612!s2aGDk?pid=29"
      }
    ],
    "status": "Publisert"
  },
  {
    "tittel": "48/403 TILLATELSE TIL TILTAK - NYTT BRANNALARMANLEGG RÅDHUSGATA 2",
    "dato": "05.12.2006",
    "dato_iso": "2006-12-05",
    "dokumentID": "2006/19604",
    "dokumenttype": "Saksframlegg",
    "avsender_mottaker": "",
    "journal_link": "https://www.strand.kommune.no/tjenester/politikk-innsyn-og-medvirkning/postliste-dokumenter-og-vedtak/sok-i-post-dokumenter-og-saker/#/details/a-6965376f__8677__47ea__a757__23e14c179149-2006002644!8ULyLD/d-6965376f__8677__47ea__a757__23e14c179149-2006019604!4Zg2qm",
    "filer": [
      {
        "tekst": "48/403 TILLATELSE TIL TILTAK - NYTT BRANNALARMANLEGG RÅDHUSGATA 2 (pdf, 98KB)",
        "url": "https://www.strand.kommune.no/api/presentation/v2/nye-innsyn/filer/v-6965376f__8677__47ea__a757__23e14c179149-21662_1_A!d-2006019604!Ft4Kub?pid=29"
      }
    ],
    "status": "Publisert"
  },
  {
    "tittel": "KOM 13.12.2006",
    "dato": "04.12.2006",
    "dato_iso": "2006-12-04",
    "dokumentID": "2006/19435",
    "dokumenttype": "Sakskart",
    "avsender_mottaker": "",
    "journal_link": "https://www.strand.kommune.no/tjenester/politikk-innsyn-og-medvirkning/postliste-dokumenter-og-vedtak/sok-i-post-dokumenter-og-saker/#/details/a-6965376f__8677__47ea__a757__23e14c179149-2006000396!m3mvDd/d-6965376f__8677__47ea__a757__23e14c179149-2006019435!ipx9aR",
    "filer": [
      {
        "tekst": "KOM 13.12.2006 (pdf, 2MB)",
        "url": "https://www.strand.kommune.no/api/presentation/v2/nye-innsyn/filer/v-6965376f__8677__47ea__a757__23e14c179149-21485_1_A!d-2006019435!OOPiFA?pid=29"
      }
    ],
    "status": "Publisert"
  },
  {
    "tittel": "KLA 12.12.2006",
    "dato": "04.12.2006",
    "dato_iso": "2006-12-04",
    "dokumentID": "2006/19477",
    "dokumenttype": "Sakskart",
    "avsender_mottaker": "",
    "journal_link": "https://www.strand.kommune.no/tjenester/politikk-innsyn-og-medvirkning/postliste-dokumenter-og-vedtak/sok-i-post-dokumenter-og-saker/#/details/a-6965376f__8677__47ea__a757__23e14c179149-2006002764!oiiaLt/d-6965376f__8677__47ea__a757__23e14c179149-2006019477!51ZKyQ",
    "filer": [],
    "status": "Må bes om innsyn"
  },
  {
    "tittel": "KLA 12.12.2006",
    "dato": "04.12.2006",
    "dato_iso": "2006-12-04",
    "dokumentID": "2006/19483",
    "dokumenttype": "Møteprotokoll",
    "avsender_mottaker": "",
    "journal_link": "https://www.strand.kommune.no/tjenester/politikk-innsyn-og-medvirkning/postliste-dokumenter-og-vedtak/sok-i-post-dokumenter-og-saker/#/details/a-6965376f__8677__47ea__a757__23e14c179149-2006002764!oiiaLt/d-6965376f__8677__47ea__a757__23e14c179149-2006019483!6nLa8h",
    "filer": [],
    "status": "Må bes om innsyn"
  },
  {
    "tittel": "REGULERINGSPLAN FOR HOLMSUND-GRØTNES - ANDREGANGS BEHANDLING",
    "dato": "01.12.2006",
    "dato_iso": "2006-12-01",
    "dokumentID": "2006/138",
    "dokumenttype": "Saksframlegg",
    "avsender_mottaker": "",
    "journal_link": "https://www.strand.kommune.no/tjenester/politikk-innsyn-og-medvirkning/postliste-dokumenter-og-vedtak/sok-i-post-dokumenter-og-saker/#/details/a-6965376f__8677__47ea__a757__23e14c179149-2006000136!gDy5u4/d-6965376f__8677__47ea__a757__23e14c179149-2006000138!86Ys4Q",
    "filer": [
      {
        "tekst": "HOLMSUND-GRØTNES (pdf, 222KB)",
        "url": "https://www.strand.kommune.no/api/presentation/v2/nye-innsyn/filer/v-6965376f__8677__47ea__a757__23e14c179149-147_1_A!d-2006000138!vv8esD?pid=29"
      },
      {
        "tekst": "PLANFORSLAG FRA OFFENTLIG ETTERSYN (pdf, 362KB)",
        "url": "https://www.strand.kommune.no/api/presentation/v2/nye-innsyn/filer/v-6965376f__8677__47ea__a757__23e14c179149-152_1_A!d-2006000138!UEY9ia?pid=29"
      },
      {
        "tekst": "UTTALELSER (pdf, 922KB)",
        "url": "https://www.strand.kommune.no/api/presentation/v2/nye-innsyn/filer/v-6965376f__8677__47ea__a757__23e14c179149-153_1_A!d-2006000138!Bog3QP?pid=29"
      },
      {
        "tekst": "PLANFORSLAG FRA OFFENTLIG ETTERSYN MED RÅDMANNENS FORSLAG TIL ENDRINGER - KART OG BESTEMMELSER (pdf, 479KB)",
        "url": "https://www.strand.kommune.no/api/presentation/v2/nye-innsyn/filer/v-6965376f__8677__47ea__a757__23e14c179149-672_1_A!d-2006000138!xLPp0A?pid=29"
      },
      {
        "tekst": "planforslag uten gangbro.pdf (pdf, 864KB)",
        "url": "https://www.strand.kommune.no/api/presentation/v2/nye-innsyn/filer/v-6965376f__8677__47ea__a757__23e14c179149-21294_1_A!d-2006000138!qKSRIx?pid=29"
      },
      {
        "tekst": "REGULERINGSPLAN FOR HOLMSUND-GRØTNES - NOTAT TIL KOMMUNESTYRET. (pdf, 137KB)",
        "url": "https://www.strand.kommune.no/api/presentation/v2/nye-innsyn/filer/v-6965376f__8677__47ea__a757__23e14c179149-9151_1_A!d-2006000138!NGGmoh?pid=29"
      }
    ],
    "status": "Publisert"
  },
  {
    "tittel": "64/64 LOKAL GODKJENNING FOR ANSVARLIG SØKER - FRITIDSBOLIG - IDSE",
    "dato": "01.12.2006",
    "dato_iso": "2006-12-01",
    "dokumentID": "2006/19347",
    "dokumenttype": "Saksframlegg",
    "avsender_mottaker": "",
    "journal_link": "https://www.strand.kommune.no/tjenester/politikk-innsyn-og-medvirkning/postliste-dokumenter-og-vedtak/sok-i-post-dokumenter-og-saker/#/details/a-6965376f__8677__47ea__a757__23e14c179149-2006002579!l1WmEC/d-6965376f__8677__47ea__a757__23e14c179149-2006019347!hjW8L2",
    "filer": [
      {
        "tekst": "64/64 LOKGAL GODKJENING FOR ANSVARLIG SØKER - FRITIDSBOLIG - IDSE (pdf, 256KB)",
        "url": "https://www.strand.kommune.no/api/presentation/v2/nye-innsyn/filer/v-6965376f__8677__47ea__a757__23e14c179149-21375_1_A!d-2006019347!ahoOSH?pid=29"
      }
    ],
    "status": "Publisert"
  },
  {
    "tittel": "48/100 TILLATELSE TIL TILTAK - UNDERSTØP AV FLOMSKADET STØTTEMUR I FISKÅNÅ",
    "dato": "01.12.2006",
    "dato_iso": "2006-12-01",
    "dokumentID": "2006/19324",
    "dokumenttype": "Saksframlegg",
    "avsender_mottaker": "",
    "journal_link": "https://www.strand.kommune.no/tjenester/politikk-innsyn-og-medvirkning/postliste-dokumenter-og-vedtak/sok-i-post-dokumenter-og-saker/#/details/a-6965376f__8677__47ea__a757__23e14c179149-2006002723!PLwWrd/d-6965376f__8677__47ea__a757__23e14c179149-2006019324!60gbrr",
    "filer": [
      {
        "tekst": "48/100 TILLATELSE TIL TILTAK - UNDERSTØP AV FLOMSKADET STØTTEMUR I FISKÅNÅ (pdf, 292KB)",
        "url": "https://www.strand.kommune.no/api/presentation/v2/nye-innsyn/filer/v-6965376f__8677__47ea__a757__23e14c179149-21356_1_A!d-2006019324!9kZy5D?pid=29"
      }
    ],
    "status": "Publisert"
  },
  {
    "tittel": "31/350 TILLATELSE TIL TILTAK TILTAK - STØYSKJERM MOT RIKSVEG",
    "dato": "01.12.2006",
    "dato_iso": "2006-12-01",
    "dokumentID": "2006/19295",
    "dokumenttype": "Saksframlegg",
    "avsender_mottaker": "",
    "journal_link": "https://www.strand.kommune.no/tjenester/politikk-innsyn-og-medvirkning/postliste-dokumenter-og-vedtak/sok-i-post-dokumenter-og-saker/#/details/a-6965376f__8677__47ea__a757__23e14c179149-2006002045!fQjkdb/d-6965376f__8677__47ea__a757__23e14c179149-2006019295!Aj8ZBa",
    "filer": [
      {
        "tekst": "31/350 TILLATELSE TIL TILTAK TILTAK - STØYSKJERM MOT RIKSVEG (pdf, 293KB)",
        "url": "https://www.strand.kommune.no/api/presentation/v2/nye-innsyn/filer/v-6965376f__8677__47ea__a757__23e14c179149-21332_1_A!d-2006019295!wintpd?pid=29"
      }
    ],
    "status": "Publisert"
  },
  {
    "tittel": "Møtebok FOR 29.11.2006",
    "dato": "01.12.2006",
    "dato_iso": "2006-12-01",
    "dokumentID": "2006/19305",
    "dokumenttype": "Møtebok",
    "avsender_mottaker": "",
    "journal_link": "https://www.strand.kommune.no/tjenester/politikk-innsyn-og-medvirkning/postliste-dokumenter-og-vedtak/sok-i-post-dokumenter-og-saker/#/details/a-6965376f__8677__47ea__a757__23e14c179149-2006000389!AdetPd/d-6965376f__8677__47ea__a757__23e14c179149-2006019305!xd5fwM",
    "filer": [],
    "status": "Må bes om innsyn"
  },
  {
    "tittel": "ADM 11.12.2006",
    "dato": "01.12.2006",
    "dato_iso": "2006-12-01",
    "dokumentID": "2006/19318",
    "dokumenttype": "Sakskart",
    "avsender_mottaker": "",
    "journal_link": "https://www.strand.kommune.no/tjenester/politikk-innsyn-og-medvirkning/postliste-dokumenter-og-vedtak/sok-i-post-dokumenter-og-saker/#/details/a-6965376f__8677__47ea__a757__23e14c179149-2006002798!fOV3uB/d-6965376f__8677__47ea__a757__23e14c179149-2006019318!5AeGty",
    "filer": [],
    "status": "Må bes om innsyn"
  },
  {
    "tittel": "ADM 11.12.2006",
    "dato": "01.12.2006",
    "dato_iso": "2006-12-01",
    "dokumentID": "2006/19321",
    "dokumenttype": "Møteprotokoll",
    "avsender_mottaker": "",
    "journal_link": "https://www.strand.kommune.no/tjenester/politikk-innsyn-og-medvirkning/postliste-dokumenter-og-vedtak/sok-i-post-dokumenter-og-saker/#/details/a-6965376f__8677__47ea__a757__23e14c179149-2006002798!fOV3uB/d-6965376f__8677__47ea__a757__23e14c179149-2006019321!19HYqw",
    "filer": [],
    "status": "Må bes om innsyn"
  },
  {
    "tittel": "64/64 RAMMETILLATELSE - FRITIDSBOLIG - HENG, STIAN LARSEN",
    "dato": "01.12.2006",
    "dato_iso": "2006-12-01",
    "dokumentID": "2006/19339",
    "dokumenttype": "Saksframlegg",
    "avsender_mottaker": "",
    "journal_link": "https://www.strand.kommune.no/tjenester/politikk-innsyn-og-medvirkning/postliste-dokumenter-og-vedtak/sok-i-post-dokumenter-og-saker/#/details/a-6965376f__8677__47ea__a757__23e14c179149-2006002579!l1WmEC/d-6965376f__8677__47ea__a757__23e14c179149-2006019339!ldplxl",
    "filer": [
      {
        "tekst": "64/64 RAMMETILLATELSE - FRITIDSBOLIG - HENG, STIAN LARSEN (pdf, 273KB)",
        "url": "https://www.strand.kommune.no/api/presentation/v2/nye-innsyn/filer/v-6965376f__8677__47ea__a757__23e14c179149-21369_1_A!d-2006019339!OjNnHE?pid=29"
      }
    ],
    "status": "Publisert"
  },
  {
    "tittel": "56/1 RAMMETILLATELSE - 4 UNGDOMSHYTTER I PREIKESTOLOMRÅDET",
    "dato": "30.11.2006",
    "dato_iso": "2006-11-30",
    "dokumentID": "2006/19270",
    "dokumenttype": "Saksframlegg",
    "avsender_mottaker": "",
    "journal_link": "https://www.strand.kommune.no/tjenester/politikk-innsyn-og-medvirkning/postliste-dokumenter-og-vedtak/sok-i-post-dokumenter-og-saker/#/details/a-6965376f__8677__47ea__a757__23e14c179149-2006002298!isJb4U/d-6965376f__8677__47ea__a757__23e14c179149-2006019270!LMcd5C",
    "filer": [
      {
        "tekst": "56/1 RAMMETILLATELSE - 4 UNGDOMSHYTTER I PREIKESTOLOMRÅDET (pdf, 293KB)",
        "url": "https://www.strand.kommune.no/api/presentation/v2/nye-innsyn/filer/v-6965376f__8677__47ea__a757__23e14c179149-21295_1_A!d-2006019270!ENCHpo?pid=29"
      }
    ],
    "status": "Publisert"
  },
  {
    "tittel": "59/2 SØKNAD OM RAMMETILLATELSE - HYTTEFELT C",
    "dato": "30.11.2006",
    "dato_iso": "2006-11-30",
    "dokumentID": "2006/19231",
    "dokumenttype": "Saksframlegg",
    "avsender_mottaker": "",
    "journal_link": "https://www.strand.kommune.no/tjenester/politikk-innsyn-og-medvirkning/postliste-dokumenter-og-vedtak/sok-i-post-dokumenter-og-saker/#/details/a-6965376f__8677__47ea__a757__23e14c179149-2006002190!gyDmzp/d-6965376f__8677__47ea__a757__23e14c179149-2006019231!FhhD3j",
    "filer": [
      {
        "tekst": "59/2 SØKNAD OM TILLATELSE TIL TILTAK - HYTTEFELT C (pdf, 99KB)",
        "url": "https://www.strand.kommune.no/api/presentation/v2/nye-innsyn/filer/v-6965376f__8677__47ea__a757__23e14c179149-21266_1_A!d-2006019231!N8U43W?pid=29"
      }
    ],
    "status": "Publisert"
  },
  {
    "tittel": "44/146 RAMMETILLATELSE - OPPGRADERE BYGGET IHT. GJELDENDE LOVER OG REGLER - FJELLTUN SKOLE",
    "dato": "30.11.2006",
    "dato_iso": "2006-11-30",
    "dokumentID": "2006/19235",
    "dokumenttype": "Saksframlegg",
    "avsender_mottaker": "",
    "journal_link": "https://www.strand.kommune.no/tjenester/politikk-innsyn-og-medvirkning/postliste-dokumenter-og-vedtak/sok-i-post-dokumenter-og-saker/#/details/a-6965376f__8677__47ea__a757__23e14c179149-2006002620!3LE9hn/d-6965376f__8677__47ea__a757__23e14c179149-2006019235!reF1C3",
    "filer": [
      {
        "tekst": "44/146 RAMMETILLATELSE - OPPGRADERE BYGGET IHT. GJELDENDE LOVER OG REGLER - FJELLTUN SKOLE (pdf, 290KB)",
        "url": "https://www.strand.kommune.no/api/presentation/v2/nye-innsyn/filer/v-6965376f__8677__47ea__a757__23e14c179149-21270_1_A!d-2006019235!gs0mx0?pid=29"
      }
    ],
    "status": "Publisert"
  },
  {
    "tittel": "37/3 UTSLIPPSTILLATELSE - BOLIGHUS",
    "dato": "30.11.2006",
    "dato_iso": "2006-11-30",
    "dokumentID": "2006/18847",
    "dokumenttype": "Saksframlegg",
    "avsender_mottaker": "",
    "journal_link": "https://www.strand.kommune.no/tjenester/politikk-innsyn-og-medvirkning/postliste-dokumenter-og-vedtak/sok-i-post-dokumenter-og-saker/#/details/a-6965376f__8677__47ea__a757__23e14c179149-2006001919!UsoFJg/d-6965376f__8677__47ea__a757__23e14c179149-2006018847!mxO3Sn",
    "filer": [
      {
        "tekst": "37/3 UTSLIPPSTILLATELSE - BOLIGHUS (pdf, 284KB)",
        "url": "https://www.strand.kommune.no/api/presentation/v2/nye-innsyn/filer/v-6965376f__8677__47ea__a757__23e14c179149-20824_1_A!d-2006018847!basQVy?pid=29"
      }
    ],
    "status": "Publisert"
  },
  {
    "tittel": "DELING AV GRUNNEIENDOM, GN 13/5,6,14,67",
    "dato": "28.11.2006",
    "dato_iso": "2006-11-28",
    "dokumentID": "2006/19120",
    "dokumenttype": "Saksframlegg",
    "avsender_mottaker": "",
    "journal_link": "https://www.strand.kommune.no/tjenester/politikk-innsyn-og-medvirkning/postliste-dokumenter-og-vedtak/sok-i-post-dokumenter-og-saker/#/details/a-6965376f__8677__47ea__a757__23e14c179149-2006002519!ImxlXj/d-6965376f__8677__47ea__a757__23e14c179149-2006019120!qRDQJm",
    "filer": [
      {
        "tekst": "DELING AV GRUNNEIENDOM, GN 13/5,6,14,67 (pdf, 95KB)",
        "url": "https://www.strand.kommune.no/api/presentation/v2/nye-innsyn/filer/v-6965376f__8677__47ea__a757__23e14c179149-21146_1_A!d-2006019120!cIoTi3?pid=29"
      }
    ],
    "status": "Publisert"
  },
  {
    "tittel": "FVA 07.12.2006",
    "dato": "27.11.2006",
    "dato_iso": "2006-11-27",
    "dokumentID": "2006/18963",
    "dokumenttype": "Sakskart",
    "avsender_mottaker": "",
    "journal_link": "https://www.strand.kommune.no/tjenester/politikk-innsyn-og-medvirkning/postliste-dokumenter-og-vedtak/sok-i-post-dokumenter-og-saker/#/details/a-6965376f__8677__47ea__a757__23e14c179149-2006000405!yKJVz6/d-6965376f__8677__47ea__a757__23e14c179149-2006018963!7oJESb",
    "filer": [
      {
        "tekst": "FVA 07.12.2006 (pdf, 1,2MB)",
        "url": "https://www.strand.kommune.no/api/presentation/v2/nye-innsyn/filer/v-6965376f__8677__47ea__a757__23e14c179149-20951_1_A!d-2006018963!9r6h4m?pid=29"
      }
    ],
    "status": "Publisert"
  },
  {
    "tittel": "32/31 TILLATELSE TIL TILTAK - NYBYGG ENEBOLIG - RYFYLKEVEGEN 1755 - FJELLANGER",
    "dato": "24.11.2006",
    "dato_iso": "2006-11-24",
    "dokumentID": "2006/18911",
    "dokumenttype": "Saksframlegg",
    "avsender_mottaker": "",
    "journal_link": "https://www.strand.kommune.no/tjenester/politikk-innsyn-og-medvirkning/postliste-dokumenter-og-vedtak/sok-i-post-dokumenter-og-saker/#/details/a-6965376f__8677__47ea__a757__23e14c179149-2006002559!PiQK1J/d-6965376f__8677__47ea__a757__23e14c179149-2006018911!PNrb7o",
    "filer": [
      {
        "tekst": "32/31 TILLATELSE TIL TILTAK - NYBYGG ENEBOLIG - RYFYLKEVEGEN 1755 - FJELLANGER (pdf, 297KB)",
        "url": "https://www.strand.kommune.no/api/presentation/v2/nye-innsyn/filer/v-6965376f__8677__47ea__a757__23e14c179149-20888_1_A!d-2006018911!JvTavo?pid=29"
      }
    ],
    "status": "Publisert"
  },
  {
    "tittel": "KLAGE PÅ VEDTAK PÅ OM TILLATELSE TIL TILTAK - GARASJE - GNR. 43 BNR. 279 - BARKVED",
    "dato": "24.11.2006",
    "dato_iso": "2006-11-24",
    "dokumentID": "2006/18837",
    "dokumenttype": "Saksframlegg",
    "avsender_mottaker": "",
    "journal_link": "https://www.strand.kommune.no/tjenester/politikk-innsyn-og-medvirkning/postliste-dokumenter-og-vedtak/sok-i-post-dokumenter-og-saker/#/details/a-6965376f__8677__47ea__a757__23e14c179149-2006001498!dwXwGm/d-6965376f__8677__47ea__a757__23e14c179149-2006018837!7th8Et",
    "filer": [
      {
        "tekst": "KLAGE PÅ VEDTAK PÅ OM TILLATELSE TIL TILTAK - GARASJE - GNR. 43 BNR. 279 - BARKVED (pdf, 391KB)",
        "url": "https://www.strand.kommune.no/api/presentation/v2/nye-innsyn/filer/v-6965376f__8677__47ea__a757__23e14c179149-20788_1_A!d-2006018837!erEesr?pid=29"
      },
      {
        "tekst": "OVERSIKTSKART (pdf, 172KB)",
        "url": "https://www.strand.kommune.no/api/presentation/v2/nye-innsyn/filer/v-6965376f__8677__47ea__a757__23e14c179149-20833_1_A!d-2006018837!eoBut2?pid=29"
      },
      {
        "tekst": "KLAGE PÅ VEDTAK, DATERT 07.11.06 (pdf, 70KB)",
        "url": "https://www.strand.kommune.no/api/presentation/v2/nye-innsyn/filer/v-6965376f__8677__47ea__a757__23e14c179149-20834_1_A!d-2006018837!N1Aald?pid=29"
      },
      {
        "tekst": "ANMODNING OM Å GI OPPSETTENDE VIRKNING PÅ BYGGETILLATELSEN, DATERT 15.11.06 (pdf, 27KB)",
        "url": "https://www.strand.kommune.no/api/presentation/v2/nye-innsyn/filer/v-6965376f__8677__47ea__a757__23e14c179149-20835_1_A!d-2006018837!i7MjAx?pid=29"
      },
      {
        "tekst": "AVSLAG PÅ KRAV OM OPPSETTENDE VIRKNING PÅ BYGGETILLATELSEN, DATERT 16.11.06 (pdf, 55KB)",
        "url": "https://www.strand.kommune.no/api/presentation/v2/nye-innsyn/filer/v-6965376f__8677__47ea__a757__23e14c179149-20836_1_A!d-2006018837!0eqY84?pid=29"
      },
      {
        "tekst": "KOMMENTAR TIL KLAGEBREV, DATERT 11.07.06 (pdf, 47KB)",
        "url": "https://www.strand.kommune.no/api/presentation/v2/nye-innsyn/filer/v-6965376f__8677__47ea__a757__23e14c179149-20844_1_A!d-2006018837!tQo8E4?pid=29"
      },
      {
        "tekst": "BYGGETILLATELSE, DATERT 30.10.06 (pdf, 107KB)",
        "url": "https://www.strand.kommune.no/api/presentation/v2/nye-innsyn/filer/v-6965376f__8677__47ea__a757__23e14c179149-20837_1_A!d-2006018837!EPD5ar?pid=29"
      },
      {
        "tekst": "BEGRUNNELSEN PÅ BYGGETILLATELSE, DATERT 30.10.06 (pdf, 78KB)",
        "url": "https://www.strand.kommune.no/api/presentation/v2/nye-innsyn/filer/v-6965376f__8677__47ea__a757__23e14c179149-20838_1_A!d-2006018837!TFsdIb?pid=29"
      },
      {
        "tekst": "FASADE-, SNITT- OG PLANTEGNING PÅ GARASJE (pdf, 79KB)",
        "url": "https://www.strand.kommune.no/api/presentation/v2/nye-innsyn/filer/v-6965376f__8677__47ea__a757__23e14c179149-20841_1_A!d-2006018837!43WSbd?pid=29"
      },
      {
        "tekst": "SITUASJONSKART (pdf, 152KB)",
        "url": "https://www.strand.kommune.no/api/presentation/v2/nye-innsyn/filer/v-6965376f__8677__47ea__a757__23e14c179149-20842_1_A!d-2006018837!NflAGk?pid=29"
      },
      {
        "tekst": "NABOPROTEST, DATERT 04.09.06 (pdf, 217KB)",
        "url": "https://www.strand.kommune.no/api/presentation/v2/nye-innsyn/filer/v-6965376f__8677__47ea__a757__23e14c179149-20839_1_A!d-2006018837!llk2l7?pid=29"
      },
      {
        "tekst": "TIDLIGER BYGGETILLATELSE, DATERT 07.01.03 (pdf, 805KB)",
        "url": "https://www.strand.kommune.no/api/presentation/v2/nye-innsyn/filer/v-6965376f__8677__47ea__a757__23e14c179149-20843_1_A!d-2006018837!Ti0Mgj?pid=29"
      }
    ],
    "status": "Publisert"
  },
  {
    "tittel": "SØKNAD OM DISPENSASJON FOR ETABLERING AV ANLEGGSVEGER I LNF- OMRÅDER - GNR. 65/7 MFL - SØR-HIDLE",
    "dato": "24.11.2006",
    "dato_iso": "2006-11-24",
    "dokumentID": "2006/18495",
    "dokumenttype": "Saksframlegg",
    "avsender_mottaker": "",
    "journal_link": "https://www.strand.kommune.no/tjenester/politikk-innsyn-og-medvirkning/postliste-dokumenter-og-vedtak/sok-i-post-dokumenter-og-saker/#/details/a-6965376f__8677__47ea__a757__23e14c179149-2006002483!YZypHy/d-6965376f__8677__47ea__a757__23e14c179149-2006018495!qQNTqG",
    "filer": [
      {
        "tekst": "SØKNAD OM DISPENSASJON FOR ETABLERING AV ANLEGGSVEGER I LNF- OMRÅDER - GNR. 65/29 MFL - SØR-HIDLE (pdf, 404KB)",
        "url": "https://www.strand.kommune.no/api/presentation/v2/nye-innsyn/filer/v-6965376f__8677__47ea__a757__23e14c179149-20384_1_A!d-2006018495!E17kf1?pid=29"
      },
      {
        "tekst": "Oversiktskart.pdf (pdf, 69KB)",
        "url": "https://www.strand.kommune.no/api/presentation/v2/nye-innsyn/filer/v-6965376f__8677__47ea__a757__23e14c179149-20567_1_A!d-2006018495!F3Tjgh?pid=29"
      },
      {
        "tekst": "Søknad om dispensasjon.pdf (pdf, 98KB)",
        "url": "https://www.strand.kommune.no/api/presentation/v2/nye-innsyn/filer/v-6965376f__8677__47ea__a757__23e14c179149-20568_1_A!d-2006018495!sE77Lk?pid=29"
      },
      {
        "tekst": "Varsel om pålegg om retting.pdf (pdf, 90KB)",
        "url": "https://www.strand.kommune.no/api/presentation/v2/nye-innsyn/filer/v-6965376f__8677__47ea__a757__23e14c179149-20569_1_A!d-2006018495!qXrDzU?pid=29"
      },
      {
        "tekst": "Kartutsnitt kommuneplan.pdf (pdf, 501KB)",
        "url": "https://www.strand.kommune.no/api/presentation/v2/nye-innsyn/filer/v-6965376f__8677__47ea__a757__23e14c179149-20570_1_A!d-2006018495!gjMrd7?pid=29"
      },
      {
        "tekst": "Foto.pdf (pdf, 1,3MB)",
        "url": "https://www.strand.kommune.no/api/presentation/v2/nye-innsyn/filer/v-6965376f__8677__47ea__a757__23e14c179149-20571_1_A!d-2006018495!VfKjGH?pid=29"
      },
      {
        "tekst": "Reguleringsforslag.pdf (pdf, 556KB)",
        "url": "https://www.strand.kommune.no/api/presentation/v2/nye-innsyn/filer/v-6965376f__8677__47ea__a757__23e14c179149-20572_1_A!d-2006018495!9iI6fG?pid=29"
      }
    ],
    "status": "Publisert"
  },
  {
    "tittel": "38/8,25 SØKNAD OM DISPENSASJON FRÅ KOMMUNEPLANEN FOR FRÅDELING AV BUSTADHUS",
    "dato": "24.11.2006",
    "dato_iso": "2006-11-24",
    "dokumentID": "2006/16543",
    "dokumenttype": "Saksframlegg",
    "avsender_mottaker": "",
    "journal_link": "https://www.strand.kommune.no/tjenester/politikk-innsyn-og-medvirkning/postliste-dokumenter-og-vedtak/sok-i-post-dokumenter-og-saker/#/details/a-6965376f__8677__47ea__a757__23e14c179149-2006002526!j0T8rg/d-6965376f__8677__47ea__a757__23e14c179149-2006016543!rNASf2",
    "filer": [
      {
        "tekst": "38/8,25 SØKNAD OM DISPENSASJON FRÅ KOMMUNEPLANNEN FOR FRÅDELING AV BUSTADHUS (pdf, 156KB)",
        "url": "https://www.strand.kommune.no/api/presentation/v2/nye-innsyn/filer/v-6965376f__8677__47ea__a757__23e14c179149-18317_1_A!d-2006016543!VPqBIb?pid=29"
      },
      {
        "tekst": "SØKNAD FRÅDELING GNR 38 BNR 8 OG 25 (pdf, 79KB)",
        "url": "https://www.strand.kommune.no/api/presentation/v2/nye-innsyn/filer/v-6965376f__8677__47ea__a757__23e14c179149-18792_1_A!d-2006016543!TNpRHT?pid=29"
      },
      {
        "tekst": "KART OVER GNR 38 BNR 8 OG 25 (pdf, 359KB)",
        "url": "https://www.strand.kommune.no/api/presentation/v2/nye-innsyn/filer/v-6965376f__8677__47ea__a757__23e14c179149-18788_1_P!d-2006016543!08sNPd?pid=29"
      },
      {
        "tekst": "SITUASJONSKART VEDKOMANDE SØKNAD OM FRÅDELING PÅ GNR 38 BNR 8 OG 25 (pdf, 50KB)",
        "url": "https://www.strand.kommune.no/api/presentation/v2/nye-innsyn/filer/v-6965376f__8677__47ea__a757__23e14c179149-18793_1_A!d-2006016543!biCPE6?pid=29"
      }
    ],
    "status": "Publisert"
  },
  {
    "tittel": "REGULERINGSPLAN FOR HYTTER PÅ GNR. 65/2 SØR-HIDLE - 2. GANGS BEHANDLING",
    "dato": "24.11.2006",
    "dato_iso": "2006-11-24",
    "dokumentID": "2006/16385",
    "dokumenttype": "Saksframlegg",
    "avsender_mottaker": "",
    "journal_link": "https://www.strand.kommune.no/tjenester/politikk-innsyn-og-medvirkning/postliste-dokumenter-og-vedtak/sok-i-post-dokumenter-og-saker/#/details/a-6965376f__8677__47ea__a757__23e14c179149-2006000345!r9ITOd/d-6965376f__8677__47ea__a757__23e14c179149-2006016385!U72btk",
    "filer": [
      {
        "tekst": "REGULERINGSPLAN FOR HYTTER PÅ GNR. 65/2 SØR-HIDLE - NY 1. GANGS BEHANDLING (pdf, 197KB)",
        "url": "https://www.strand.kommune.no/api/presentation/v2/nye-innsyn/filer/v-6965376f__8677__47ea__a757__23e14c179149-18132_1_A!d-2006016385!Ymf3v5?pid=29"
      },
      {
        "tekst": "Oversiktskart.pdf (pdf, 382KB)",
        "url": "https://www.strand.kommune.no/api/presentation/v2/nye-innsyn/filer/v-6965376f__8677__47ea__a757__23e14c179149-20562_1_A!d-2006016385!GJTQxm?pid=29"
      },
      {
        "tekst": "Planforslag fra offentlig ettersyn.pdf (pdf, 1,6MB)",
        "url": "https://www.strand.kommune.no/api/presentation/v2/nye-innsyn/filer/v-6965376f__8677__47ea__a757__23e14c179149-20795_1_A!d-2006016385!hQDfKb?pid=29"
      },
      {
        "tekst": "Reguleringsbestemmelser fra offentlig ettersyn.doc (pdf, 83KB)",
        "url": "https://www.strand.kommune.no/api/presentation/v2/nye-innsyn/filer/v-6965376f__8677__47ea__a757__23e14c179149-20581_1_A!d-2006016385!5V3HBK?pid=29"
      },
      {
        "tekst": "Planforslag med endringer.pdf (pdf, 1,2MB)",
        "url": "https://www.strand.kommune.no/api/presentation/v2/nye-innsyn/filer/v-6965376f__8677__47ea__a757__23e14c179149-20796_1_A!d-2006016385!jKF8dC?pid=29"
      },
      {
        "tekst": "Uttalelse fra Fylkeskommunen kulturseksjonen.pdf (pdf, 2,4MB)",
        "url": "https://www.strand.kommune.no/api/presentation/v2/nye-innsyn/filer/v-6965376f__8677__47ea__a757__23e14c179149-20563_1_A!d-2006016385!nzj0Iz?pid=29"
      },
      {
        "tekst": "FRÅSEGN TIL PRIVAT REGULERINGSPLAN FOR GN 65/2 ODD EGIL TJØSTHEIM - HYTTER MED (pdf, 235KB)",
        "url": "https://www.strand.kommune.no/api/presentation/v2/nye-innsyn/filer/v-6965376f__8677__47ea__a757__23e14c179149-17718_1_A!d-2006016385!2IcyM8?pid=29"
      },
      {
        "tekst": "UTTALE TIL FORSLAG TIL REGULERINGSPLAN FOR HYTTER - GN 65/2 SØR-HIDLE (pdf, 41KB)",
        "url": "https://www.strand.kommune.no/api/presentation/v2/nye-innsyn/filer/v-6965376f__8677__47ea__a757__23e14c179149-17772_1_A!d-2006016385!Wm8A9l?pid=29"
      },
      {
        "tekst": "FORSLAG TIL REGULERINGSPLAN FOR HYTTER PÅ DEL AV GN 65/2 SØR-HIDLE - INNSIGELSE (pdf, 69KB)",
        "url": "https://www.strand.kommune.no/api/presentation/v2/nye-innsyn/filer/v-6965376f__8677__47ea__a757__23e14c179149-17614_1_A!d-2006016385!LXhBpk?pid=29"
      },
      {
        "tekst": "FORSLAG TIL REGULERINGSPLAN FOR HYTTER PÅ DEL AV GN 65/2, SØR-HIDLE, SJØKART NR. 16 - (pdf, 72KB)",
        "url": "https://www.strand.kommune.no/api/presentation/v2/nye-innsyn/filer/v-6965376f__8677__47ea__a757__23e14c179149-20669_1_A!d-2006016385!xQ84PQ?pid=29"
      },
      {
        "tekst": "VEDR. REGULERINGSPLAN FOR HYTTER PÅ GN 65/2 PÅ SØR-HIDLE TIL ETTERSYN (pdf, 30KB)",
        "url": "https://www.strand.kommune.no/api/presentation/v2/nye-innsyn/filer/v-6965376f__8677__47ea__a757__23e14c179149-17358_1_A!d-2006016385!idaATC?pid=29"
      },
      {
        "tekst": "TILSVAR TIL FORSLAG REGULERINGSPLAN FOR HYTTER PÅ GN 65/2 SØR-HIDLE (pdf, 330KB)",
        "url": "https://www.strand.kommune.no/api/presentation/v2/nye-innsyn/filer/v-6965376f__8677__47ea__a757__23e14c179149-17179_1_A!d-2006016385!X0n2Rq?pid=29"
      },
      {
        "tekst": "VEDR. FORESPØRSEL TIL REGULERINGSPLAN FOR HYTTEOMRÅDE GN 65/2 (pdf, 157KB)",
        "url": "https://www.strand.kommune.no/api/presentation/v2/nye-innsyn/filer/v-6965376f__8677__47ea__a757__23e14c179149-19659_1_A!d-2006016385!VvQZEf?pid=29"
      },
      {
        "tekst": "ANG. REGULERINGSPLAN FOR HYTTER PÅ GN 65/2 - SØR-HIDLE (pdf, 44KB)",
        "url": "https://www.strand.kommune.no/api/presentation/v2/nye-innsyn/filer/v-6965376f__8677__47ea__a757__23e14c179149-17093_1_A!d-2006016385!uGaB74?pid=29"
      },
      {
        "tekst": "UTTALELSE FRA LYSE ENERGI TIL REGULERINGSPLAN FOR HYTTER PÅ GN 65/2 - SØR-HIDLE (pdf, 30KB)",
        "url": "https://www.strand.kommune.no/api/presentation/v2/nye-innsyn/filer/v-6965376f__8677__47ea__a757__23e14c179149-17096_1_A!d-2006016385!H186qJ?pid=29"
      }
    ],
    "status": "Publisert"
  },
  {
    "tittel": "REGULERINGSPLAN FOR FORTAU / GANG- OG SYKKELVEG TIL SKJERSVIK BOLIGFELT - NY 2. GANGS BEHANDLING",
    "dato": "24.11.2006",
    "dato_iso": "2006-11-24",
    "dokumentID": "2006/18632",
    "dokumenttype": "Saksframlegg",
    "avsender_mottaker": "",
    "journal_link": "https://www.strand.kommune.no/tjenester/politikk-innsyn-og-medvirkning/postliste-dokumenter-og-vedtak/sok-i-post-dokumenter-og-saker/#/details/a-6965376f__8677__47ea__a757__23e14c179149-2006001711!PhNHHh/d-6965376f__8677__47ea__a757__23e14c179149-2006018632!sthw7t",
    "filer": [
      {
        "tekst": "REGULERINGSPLAN FOR FORTAU / GANG- OG SYKKELVEG TIL SKJERSVIK BOLIGFELT - NY 2 GANGS BEHANDLING (pdf, 123KB)",
        "url": "https://www.strand.kommune.no/api/presentation/v2/nye-innsyn/filer/v-6965376f__8677__47ea__a757__23e14c179149-20524_1_A!d-2006018632!tLdhc6?pid=29"
      },
      {
        "tekst": "Uttalelser..pdf (pdf, 146KB)",
        "url": "https://www.strand.kommune.no/api/presentation/v2/nye-innsyn/filer/v-6965376f__8677__47ea__a757__23e14c179149-20798_1_A!d-2006018632!hGqwOM?pid=29"
      },
      {
        "tekst": "Planforslag med endringsforslag.pdf (pdf, 767KB)",
        "url": "https://www.strand.kommune.no/api/presentation/v2/nye-innsyn/filer/v-6965376f__8677__47ea__a757__23e14c179149-20860_1_A!d-2006018632!lkItTz?pid=29"
      }
    ],
    "status": "Publisert"
  },
  {
    "tittel": "SØKNAD OM DOBBELTNAUST PÅ GNR 53/337 TUNGLAND - DISPENSASJON FRA NAUSTSTØRRELSE I REGULERINGSPLAN",
    "dato": "23.11.2006",
    "dato_iso": "2006-11-23",
    "dokumentID": "2006/18714",
    "dokumenttype": "Saksframlegg",
    "avsender_mottaker": "",
    "journal_link": "https://www.strand.kommune.no/tjenester/politikk-innsyn-og-medvirkning/postliste-dokumenter-og-vedtak/sok-i-post-dokumenter-og-saker/#/details/a-6965376f__8677__47ea__a757__23e14c179149-2006002463!4O2jTm/d-6965376f__8677__47ea__a757__23e14c179149-2006018714!lX5i5n",
    "filer": [
      {
        "tekst": "SØKNAD OM DOBBELTNAUST PÅ GNR 53/337 TUNGLAND - DISPENSASJON FRA NAUSTSTØRRELSE I REGULERINGSPLAN (pdf, 319KB)",
        "url": "https://www.strand.kommune.no/api/presentation/v2/nye-innsyn/filer/v-6965376f__8677__47ea__a757__23e14c179149-20625_1_A!d-2006018714!VLvgNN?pid=29"
      },
      {
        "tekst": "Søknad om naust - Dispensasjon.pdf (pdf, 2,5MB)",
        "url": "https://www.strand.kommune.no/api/presentation/v2/nye-innsyn/filer/v-6965376f__8677__47ea__a757__23e14c179149-20631_1_A!d-2006018714!mbJj2J?pid=29"
      }
    ],
    "status": "Publisert"
  },
  {
    "tittel": "SØKNAD OM DISPENSASJON FRA REGULERT BYGGEGRENSE MOT VEG FOR ETABLERING AV GARASJE - 53/324 - STEINHAGEN (TUNGLAND)",
    "dato": "23.11.2006",
    "dato_iso": "2006-11-23",
    "dokumentID": "2006/18653",
    "dokumenttype": "Saksframlegg",
    "avsender_mottaker": "",
    "journal_link": "https://www.strand.kommune.no/tjenester/politikk-innsyn-og-medvirkning/postliste-dokumenter-og-vedtak/sok-i-post-dokumenter-og-saker/#/details/a-6965376f__8677__47ea__a757__23e14c179149-2006002401!Jv86D4/d-6965376f__8677__47ea__a757__23e14c179149-2006018653!tKeuxY",
    "filer": [
      {
        "tekst": "SØKNAD OM DISPENSAJSON FRA REGULET BYGGEGRENSE MOT VEG FOR ETABLERING AV GARASJE - 53/324 - STEINHAGEN (TUNGLAND) (pdf, 348KB)",
        "url": "https://www.strand.kommune.no/api/presentation/v2/nye-innsyn/filer/v-6965376f__8677__47ea__a757__23e14c179149-20573_1_A!d-2006018653!iggXrA?pid=29"
      },
      {
        "tekst": "Oversiktskart.pdf (pdf, 189KB)",
        "url": "https://www.strand.kommune.no/api/presentation/v2/nye-innsyn/filer/v-6965376f__8677__47ea__a757__23e14c179149-20574_1_A!d-2006018653!ar1JFa?pid=29"
      },
      {
        "tekst": "Søknad om dispensasjon.pdf (pdf, 37KB)",
        "url": "https://www.strand.kommune.no/api/presentation/v2/nye-innsyn/filer/v-6965376f__8677__47ea__a757__23e14c179149-20575_1_A!d-2006018653!m5RyOY?pid=29"
      },
      {
        "tekst": "Innspill til søknad om dispensasjon.pdf (pdf, 55KB)",
        "url": "https://www.strand.kommune.no/api/presentation/v2/nye-innsyn/filer/v-6965376f__8677__47ea__a757__23e14c179149-20576_1_A!d-2006018653!tDNaiA?pid=29"
      },
      {
        "tekst": "Varsel om pålegg om retting.pdf (pdf, 92KB)",
        "url": "https://www.strand.kommune.no/api/presentation/v2/nye-innsyn/filer/v-6965376f__8677__47ea__a757__23e14c179149-20577_1_A!d-2006018653!9htWqm?pid=29"
      },
      {
        "tekst": "Situasjonskart.pdf (pdf, 82KB)",
        "url": "https://www.strand.kommune.no/api/presentation/v2/nye-innsyn/filer/v-6965376f__8677__47ea__a757__23e14c179149-20578_1_A!d-2006018653!GlOWC6?pid=29"
      },
      {
        "tekst": "Fasadetegninger på godkjent garasje.pdf (pdf, 71KB)",
        "url": "https://www.strand.kommune.no/api/presentation/v2/nye-innsyn/filer/v-6965376f__8677__47ea__a757__23e14c179149-20579_1_A!d-2006018653!1ieReN?pid=29"
      },
      {
        "tekst": "Kartutsnitt reguleringsplan.pdf (pdf, 1MB)",
        "url": "https://www.strand.kommune.no/api/presentation/v2/nye-innsyn/filer/v-6965376f__8677__47ea__a757__23e14c179149-20580_1_A!d-2006018653!X2RXyk?pid=29"
      }
    ],
    "status": "Publisert"
  },
  {
    "tittel": "SØKNAD OM DISPENSASJON FRA KOMMUNEPLANEN FOR TERRENGARBEIDER OG FYLLING I SJØ PÅ GNR 7/2 FISKÅ MØLLE",
    "dato": "23.11.2006",
    "dato_iso": "2006-11-23",
    "dokumentID": "2006/17383",
    "dokumenttype": "Saksframlegg",
    "avsender_mottaker": "",
    "journal_link": "https://www.strand.kommune.no/tjenester/politikk-innsyn-og-medvirkning/postliste-dokumenter-og-vedtak/sok-i-post-dokumenter-og-saker/#/details/a-6965376f__8677__47ea__a757__23e14c179149-2006002557!qM8BFX/d-6965376f__8677__47ea__a757__23e14c179149-2006017383!3xPeJP",
    "filer": [
      {
        "tekst": "SØKNAD OM DISPENSASJON FRA KOMMUNEPLANEN FOR TERRENGARBEIDER OG FYLLING I SJØ PÅ GNR 7/2 FISKÅ MØLLE (pdf, 317KB)",
        "url": "https://www.strand.kommune.no/api/presentation/v2/nye-innsyn/filer/v-6965376f__8677__47ea__a757__23e14c179149-19218_1_A!d-2006017383!c2J9CC?pid=29"
      },
      {
        "tekst": "vedlegg 1 - revidert søknad.pdf (pdf, 1MB)",
        "url": "https://www.strand.kommune.no/api/presentation/v2/nye-innsyn/filer/v-6965376f__8677__47ea__a757__23e14c179149-19303_1_A!d-2006017383!4iu6NU?pid=29"
      },
      {
        "tekst": "7/2 SØKNAD OM DISPENSASJON/LØYVE TIL TILTAK - TERRENGARBEIDER OG FYLLING I SJØ (pdf, 1,3MB)",
        "url": "https://www.strand.kommune.no/api/presentation/v2/nye-innsyn/filer/v-6965376f__8677__47ea__a757__23e14c179149-18410_1_A!d-2006017383!yiT7mB?pid=29"
      },
      {
        "tekst": "Reguleringsplan-Kommuneplan.pdf (pdf, 1,2MB)",
        "url": "https://www.strand.kommune.no/api/presentation/v2/nye-innsyn/filer/v-6965376f__8677__47ea__a757__23e14c179149-19232_1_A!d-2006017383!ZN9URs?pid=29"
      },
      {
        "tekst": "7/2 SVAR PÅ NABOVARSEL - LØYVE TIL TILTAK - TERRENGARBEIDER OG FYLLING (pdf, 230KB)",
        "url": "https://www.strand.kommune.no/api/presentation/v2/nye-innsyn/filer/v-6965376f__8677__47ea__a757__23e14c179149-19268_1_A!d-2006017383!YYCgKH?pid=29"
      },
      {
        "tekst": "VS: UTBYGGING AV GNR. 7/BN.R. 2 STRAND - FISKÅ MØLLE AS (pdf, 273KB)",
        "url": "https://www.strand.kommune.no/api/presentation/v2/nye-innsyn/filer/v-6965376f__8677__47ea__a757__23e14c179149-18681_1_A!d-2006017383!3Ovzuv?pid=29"
      },
      {
        "tekst": "VEDR. SØKNAD OM DISPENSASJON TIL TERRENGARBEIDER OG FYLLING I SJØ PÅ GNR 7/2 FISKÅ MØLLE (pdf, 276KB)",
        "url": "https://www.strand.kommune.no/api/presentation/v2/nye-innsyn/filer/v-6965376f__8677__47ea__a757__23e14c179149-20583_1_A!d-2006017383!mEyX4H?pid=29"
      },
      {
        "tekst": "SØKNAD OM DISPENSASJON FRA KOMMUNEPLANEN FOR TERRENGARBEIDER OG FYLLING I SJØ PÅ GNR 7/2 FISKÅ MØLLE - REFERAT (pdf, 279KB)",
        "url": "https://www.strand.kommune.no/api/presentation/v2/nye-innsyn/filer/v-6965376f__8677__47ea__a757__23e14c179149-19164_1_A!d-2006017383!AMdHAL?pid=29"
      }
    ],
    "status": "Publisert"
  },
  {
    "tittel": "49/345 KLAGE PÅ AVSLAG - BUSTADBYGG MED 4 LEILIGHETER, BRAUTA",
    "dato": "23.11.2006",
    "dato_iso": "2006-11-23",
    "dokumentID": "2006/18323",
    "dokumenttype": "Saksframlegg",
    "avsender_mottaker": "",
    "journal_link": "https://www.strand.kommune.no/tjenester/politikk-innsyn-og-medvirkning/postliste-dokumenter-og-vedtak/sok-i-post-dokumenter-og-saker/#/details/a-6965376f__8677__47ea__a757__23e14c179149-2006001292!zObGh9/d-6965376f__8677__47ea__a757__23e14c179149-2006018323!t3ybmT",
    "filer": [
      {
        "tekst": "49/345 KLAGE PÅ AVSLAG - BUSTADBYGG MED 4 LEILIGHETER, BRAUTA (pdf, 482KB)",
        "url": "https://www.strand.kommune.no/api/presentation/v2/nye-innsyn/filer/v-6965376f__8677__47ea__a757__23e14c179149-20216_1_A!d-2006018323!WI02mB?pid=29"
      },
      {
        "tekst": "Situasjonskart.tif (pdf, 211KB)",
        "url": "https://www.strand.kommune.no/api/presentation/v2/nye-innsyn/filer/v-6965376f__8677__47ea__a757__23e14c179149-14426_1_A!d-2006018323!LJWHhb?pid=29"
      },
      {
        "tekst": "ANGIVELSER AV HØYDER (pdf, 487KB)",
        "url": "https://www.strand.kommune.no/api/presentation/v2/nye-innsyn/filer/v-6965376f__8677__47ea__a757__23e14c179149-20645_1_A!d-2006018323!tZ7hwz?pid=29"
      },
      {
        "tekst": "Tegninger av bygg.tif (pdf, 124KB)",
        "url": "https://www.strand.kommune.no/api/presentation/v2/nye-innsyn/filer/v-6965376f__8677__47ea__a757__23e14c179149-14427_1_A!d-2006018323!JHfmwa?pid=29"
      },
      {
        "tekst": "2006-09-28 KLAGE PÅ VEDTAK.PDF (pdf, 154KB)",
        "url": "https://www.strand.kommune.no/api/presentation/v2/nye-innsyn/filer/v-6965376f__8677__47ea__a757__23e14c179149-17131_1_A!d-2006018323!MwNv7w?pid=29"
      }
    ],
    "status": "Publisert"
  },
  {
    "tittel": "53/325 SØKNAD OM DISPENSASJON - OVERSKRIDELSE AV BYGGELINJE, 6-MANNS BOLIG TUNGLAND",
    "dato": "23.11.2006",
    "dato_iso": "2006-11-23",
    "dokumentID": "2006/18848",
    "dokumenttype": "Saksframlegg",
    "avsender_mottaker": "",
    "journal_link": "https://www.strand.kommune.no/tjenester/politikk-innsyn-og-medvirkning/postliste-dokumenter-og-vedtak/sok-i-post-dokumenter-og-saker/#/details/a-6965376f__8677__47ea__a757__23e14c179149-2006001136!qknu9a/d-6965376f__8677__47ea__a757__23e14c179149-2006018848!2frq6X",
    "filer": [
      {
        "tekst": "53/325 SØKNAD OM DISPENSASJON - OVERSKRIDELSE AV BYGGELINJE, 6-MANNS BOLIG TUNGLAND (pdf, 293KB)",
        "url": "https://www.strand.kommune.no/api/presentation/v2/nye-innsyn/filer/v-6965376f__8677__47ea__a757__23e14c179149-20825_1_A!d-2006018848!Xuogse?pid=29"
      },
      {
        "tekst": "GARASJE TUNGLAND (pdf, 852KB)",
        "url": "https://www.strand.kommune.no/api/presentation/v2/nye-innsyn/filer/v-6965376f__8677__47ea__a757__23e14c179149-20828_1_P!d-2006018848!LH5HGm?pid=29"
      },
      {
        "tekst": "SITUASJONSKART (pdf, 262KB)",
        "url": "https://www.strand.kommune.no/api/presentation/v2/nye-innsyn/filer/v-6965376f__8677__47ea__a757__23e14c179149-20829_1_A!d-2006018848!l1B3Zc?pid=29"
      },
      {
        "tekst": "FASADER (pdf, 570KB)",
        "url": "https://www.strand.kommune.no/api/presentation/v2/nye-innsyn/filer/v-6965376f__8677__47ea__a757__23e14c179149-20830_1_A!d-2006018848!GWKNRK?pid=29"
      },
      {
        "tekst": "SØKNAD OM DISPENSASJON (pdf, 85KB)",
        "url": "https://www.strand.kommune.no/api/presentation/v2/nye-innsyn/filer/v-6965376f__8677__47ea__a757__23e14c179149-20831_1_A!d-2006018848!Gp89Cy?pid=29"
      },
      {
        "tekst": "VEDR. PÅBYGG FOR GARASJE, STEINHAGEN 6 (pdf, 43KB)",
        "url": "https://www.strand.kommune.no/api/presentation/v2/nye-innsyn/filer/v-6965376f__8677__47ea__a757__23e14c179149-15763_1_A!d-2006018848!FPryBF?pid=29"
      },
      {
        "tekst": "VEDR. SAK 53/325 GARASJE OG UTKJØRSEL STEINHAGEN 6 (pdf, 57KB)",
        "url": "https://www.strand.kommune.no/api/presentation/v2/nye-innsyn/filer/v-6965376f__8677__47ea__a757__23e14c179149-16618_1_A!d-2006018848!qXn1fW?pid=29"
      }
    ],
    "status": "Publisert"
  },
  {
    "tittel": "7/51 BYGGE OG DELEFORBUD - EIENDOM FISKÅ",
    "dato": "23.11.2006",
    "dato_iso": "2006-11-23",
    "dokumentID": "2006/18772",
    "dokumenttype": "Saksframlegg",
    "avsender_mottaker": "",
    "journal_link": "https://www.strand.kommune.no/tjenester/politikk-innsyn-og-medvirkning/postliste-dokumenter-og-vedtak/sok-i-post-dokumenter-og-saker/#/details/a-6965376f__8677__47ea__a757__23e14c179149-2006002253!iIWtSE/d-6965376f__8677__47ea__a757__23e14c179149-2006018772!WbelGy",
    "filer": [
      {
        "tekst": "7/51 BYGGE OG DELEFORBUD - EIENDOM FISKÅ (pdf, 177KB)",
        "url": "https://www.strand.kommune.no/api/presentation/v2/nye-innsyn/filer/v-6965376f__8677__47ea__a757__23e14c179149-20702_1_A!d-2006018772!kz0BE2?pid=29"
      },
      {
        "tekst": "FISKÅ, REGULERINGSPLAN (pdf, 699KB)",
        "url": "https://www.strand.kommune.no/api/presentation/v2/nye-innsyn/filer/v-6965376f__8677__47ea__a757__23e14c179149-20799_1_P!d-2006018772!oOUDT5?pid=29"
      },
      {
        "tekst": "FORSLAG TIL REGULERINGSPLAN FISKÅ (pdf, 2,1MB)",
        "url": "https://www.strand.kommune.no/api/presentation/v2/nye-innsyn/filer/v-6965376f__8677__47ea__a757__23e14c179149-20816_1_A!d-2006018772!RI3YoG?pid=29"
      },
      {
        "tekst": "7/51 ANGÅENDE SØKNAD OM TILTAK - NYBYGG BOLIG (pdf, 106KB)",
        "url": "https://www.strand.kommune.no/api/presentation/v2/nye-innsyn/filer/v-6965376f__8677__47ea__a757__23e14c179149-18846_1_A!d-2006018772!yjXQgW?pid=29"
      },
      {
        "tekst": "TILSVAR TIL BREV OM BYGGEFORBUD PÅ VÅR TOMT GN 7/51 PÅ FISKÅ, SAMT VEDLEGG TIL (pdf, 124KB)",
        "url": "https://www.strand.kommune.no/api/presentation/v2/nye-innsyn/filer/v-6965376f__8677__47ea__a757__23e14c179149-20201_1_A!d-2006018772!wZr7i7?pid=29"
      }
    ],
    "status": "Publisert"
  },
  {
    "tittel": "FOR 29.11.2006",
    "dato": "22.11.2006",
    "dato_iso": "2006-11-22",
    "dokumentID": "2006/18693",
    "dokumenttype": "Møteprotokoll",
    "avsender_mottaker": "",
    "journal_link": "https://www.strand.kommune.no/tjenester/politikk-innsyn-og-medvirkning/postliste-dokumenter-og-vedtak/sok-i-post-dokumenter-og-saker/#/details/a-6965376f__8677__47ea__a757__23e14c179149-2006000389!AdetPd/d-6965376f__8677__47ea__a757__23e14c179149-2006018693!R4Wsg6",
    "filer": [
      {
        "tekst": "FOR 29.11.2006 (pdf, 737KB)",
        "url": "https://www.strand.kommune.no/api/presentation/v2/nye-innsyn/filer/v-6965376f__8677__47ea__a757__23e14c179149-20610_1_A!d-2006018693!NmRnlI?pid=29"
      }
    ],
    "status": "Publisert"
  },
  {
    "tittel": "KLAGE PÅ VEDTAK VEDRØRENDE DEKNING AV SAKSOMKOSTNINGER - ADVOKAT THOR GJERDE",
    "dato": "22.11.2006",
    "dato_iso": "2006-11-22",
    "dokumentID": "2006/15493",
    "dokumenttype": "Saksframlegg",
    "avsender_mottaker": "",
    "journal_link": "https://www.strand.kommune.no/tjenester/politikk-innsyn-og-medvirkning/postliste-dokumenter-og-vedtak/sok-i-post-dokumenter-og-saker/#/details/a-6965376f__8677__47ea__a757__23e14c179149-2006000458!R38aEj/d-6965376f__8677__47ea__a757__23e14c179149-2006015493!zMydDZ",
    "filer": [
      {
        "tekst": "KLAGE PÅ VEDTAK VEDRØRENDE DEKNING AV SAKSOMKOSTNINGER - ADVOKAT THOR GJERDE (pdf, 183KB)",
        "url": "https://www.strand.kommune.no/api/presentation/v2/nye-innsyn/filer/v-6965376f__8677__47ea__a757__23e14c179149-17166_1_A!d-2006015493!4pjt5Y?pid=29"
      }
    ],
    "status": "Publisert"
  },
  {
    "tittel": "REGULERINGSPLAN FOR GN 6/1, BJØDNÅSDALEN - 2. GANGS BEHANDLING",
    "dato": "21.11.2006",
    "dato_iso": "2006-11-21",
    "dokumentID": "2006/17716",
    "dokumenttype": "Saksframlegg",
    "avsender_mottaker": "",
    "journal_link": "https://www.strand.kommune.no/tjenester/politikk-innsyn-og-medvirkning/postliste-dokumenter-og-vedtak/sok-i-post-dokumenter-og-saker/#/details/a-6965376f__8677__47ea__a757__23e14c179149-2006001941!LAU12Z/d-6965376f__8677__47ea__a757__23e14c179149-2006017716!38Fpc3",
    "filer": [
      {
        "tekst": "REGULERINGSPLAN FOR GN 6/1, BJØDNÅSDALEN - 2. GANGS BEHANDLING (pdf, 155KB)",
        "url": "https://www.strand.kommune.no/api/presentation/v2/nye-innsyn/filer/v-6965376f__8677__47ea__a757__23e14c179149-19586_1_A!d-2006017716!N9jB0h?pid=29"
      },
      {
        "tekst": "Uttalelser.pdf (pdf, 403KB)",
        "url": "https://www.strand.kommune.no/api/presentation/v2/nye-innsyn/filer/v-6965376f__8677__47ea__a757__23e14c179149-20507_1_A!d-2006017716!8kEj73?pid=29"
      },
      {
        "tekst": "Forslag til endringer.pdf (pdf, 249KB)",
        "url": "https://www.strand.kommune.no/api/presentation/v2/nye-innsyn/filer/v-6965376f__8677__47ea__a757__23e14c179149-20508_1_A!d-2006017716!VjpsRc?pid=29"
      }
    ],
    "status": "Publisert"
  },
  {
    "tittel": "25/32 GODKJENNING AV PLAN FOR NYDYRKING",
    "dato": "21.11.2006",
    "dato_iso": "2006-11-21",
    "dokumentID": "2006/18514",
    "dokumenttype": "Saksframlegg",
    "avsender_mottaker": "",
    "journal_link": "https://www.strand.kommune.no/tjenester/politikk-innsyn-og-medvirkning/postliste-dokumenter-og-vedtak/sok-i-post-dokumenter-og-saker/#/details/a-6965376f__8677__47ea__a757__23e14c179149-2006002458!m2kpbf/d-6965376f__8677__47ea__a757__23e14c179149-2006018514!uch3Tr",
    "filer": [
      {
        "tekst": "25/32 GODKJENNING AV PLAN FOR NYDYRKING (pdf, 354KB)",
        "url": "https://www.strand.kommune.no/api/presentation/v2/nye-innsyn/filer/v-6965376f__8677__47ea__a757__23e14c179149-20404_1_A!d-2006018514!nmREge?pid=29"
      }
    ],
    "status": "Publisert"
  },
  {
    "tittel": "MINDRE VESENTLIG REGULERINGSENDRING - REGULERINGSPLAN JØRPELAND GRAVLUND",
    "dato": "21.11.2006",
    "dato_iso": "2006-11-21",
    "dokumentID": "2006/18113",
    "dokumenttype": "Saksframlegg",
    "avsender_mottaker": "",
    "journal_link": "https://www.strand.kommune.no/tjenester/politikk-innsyn-og-medvirkning/postliste-dokumenter-og-vedtak/sok-i-post-dokumenter-og-saker/#/details/a-6965376f__8677__47ea__a757__23e14c179149-2006001987!y4kwAZ/d-6965376f__8677__47ea__a757__23e14c179149-2006018113!QWRWk9",
    "filer": [
      {
        "tekst": "MINDRE VESENTLIG REGULERINGSENDRING - REGULERINGSPLAN FØRLAND KYRKJEGARD (pdf, 281KB)",
        "url": "https://www.strand.kommune.no/api/presentation/v2/nye-innsyn/filer/v-6965376f__8677__47ea__a757__23e14c179149-19987_1_A!d-2006018113!KsUinV?pid=29"
      },
      {
        "tekst": "Oversiktsplan med endringer.pdf (pdf, 681KB)",
        "url": "https://www.strand.kommune.no/api/presentation/v2/nye-innsyn/filer/v-6965376f__8677__47ea__a757__23e14c179149-20020_1_A!d-2006018113!mvQnIr?pid=29"
      },
      {
        "tekst": "Situasjonskart.pdf (pdf, 1,4MB)",
        "url": "https://www.strand.kommune.no/api/presentation/v2/nye-innsyn/filer/v-6965376f__8677__47ea__a757__23e14c179149-20021_1_A!d-2006018113!1cxFrH?pid=29"
      },
      {
        "tekst": "Reguleringsbestemmelser Jørpeland gravlund.doc (pdf, 266KB)",
        "url": "https://www.strand.kommune.no/api/presentation/v2/nye-innsyn/filer/v-6965376f__8677__47ea__a757__23e14c179149-20025_1_A!d-2006018113!4FnB41?pid=29"
      }
    ],
    "status": "Publisert"
  },
  {
    "tittel": "32/31 RVINGSTILLATELSE FOR EKSISTERENDE BOLIG OG UTHUS",
    "dato": "20.11.2006",
    "dato_iso": "2006-11-20",
    "dokumentID": "2006/18346",
    "dokumenttype": "Saksframlegg",
    "avsender_mottaker": "",
    "journal_link": "https://www.strand.kommune.no/tjenester/politikk-innsyn-og-medvirkning/postliste-dokumenter-og-vedtak/sok-i-post-dokumenter-og-saker/#/details/a-6965376f__8677__47ea__a757__23e14c179149-2006002559!PiQK1J/d-6965376f__8677__47ea__a757__23e14c179149-2006018346!EweYgl",
    "filer": [
      {
        "tekst": "32/31 RVINGSTILTILLATELSE FOR EKSISTERENDE BOLIG OG UTHUS (pdf, 292KB)",
        "url": "https://www.strand.kommune.no/api/presentation/v2/nye-innsyn/filer/v-6965376f__8677__47ea__a757__23e14c179149-20236_1_A!d-2006018346!o7Ruux?pid=29"
      }
    ],
    "status": "Publisert"
  },
  {
    "tittel": "FOR 29.11.2006",
    "dato": "20.11.2006",
    "dato_iso": "2006-11-20",
    "dokumentID": "2006/18428",
    "dokumenttype": "Sakskart",
    "avsender_mottaker": "",
    "journal_link": "https://www.strand.kommune.no/tjenester/politikk-innsyn-og-medvirkning/postliste-dokumenter-og-vedtak/sok-i-post-dokumenter-og-saker/#/details/a-6965376f__8677__47ea__a757__23e14c179149-2006000389!AdetPd/d-6965376f__8677__47ea__a757__23e14c179149-2006018428!OO2PJD",
    "filer": [
      {
        "tekst": "FOR 29.11.2006 (pdf, 1,4MB)",
        "url": "https://www.strand.kommune.no/api/presentation/v2/nye-innsyn/filer/v-6965376f__8677__47ea__a757__23e14c179149-20295_1_A!d-2006018428!FVwv99?pid=29"
      }
    ],
    "status": "Publisert"
  },
  {
    "tittel": "88/1 SØKNAD OM NYDYRKING",
    "dato": "20.11.2006",
    "dato_iso": "2006-11-20",
    "dokumentID": "2006/18421",
    "dokumenttype": "Saksframlegg",
    "avsender_mottaker": "",
    "journal_link": "https://www.strand.kommune.no/tjenester/politikk-innsyn-og-medvirkning/postliste-dokumenter-og-vedtak/sok-i-post-dokumenter-og-saker/#/details/a-6965376f__8677__47ea__a757__23e14c179149-2006002265!ceXkRZ/d-6965376f__8677__47ea__a757__23e14c179149-2006018421!umJ1pu",
    "filer": [
      {
        "tekst": "88/1 SØKNAD OM NYDYRKING (pdf, 355KB)",
        "url": "https://www.strand.kommune.no/api/presentation/v2/nye-innsyn/filer/v-6965376f__8677__47ea__a757__23e14c179149-20288_1_A!d-2006018421!8MIGkc?pid=29"
      }
    ],
    "status": "Publisert"
  },
  {
    "tittel": "Møtebok KOM 15.11.2006",
    "dato": "17.11.2006",
    "dato_iso": "2006-11-17",
    "dokumentID": "2006/18237",
    "dokumenttype": "Møtebok",
    "avsender_mottaker": "",
    "journal_link": "https://www.strand.kommune.no/tjenester/politikk-innsyn-og-medvirkning/postliste-dokumenter-og-vedtak/sok-i-post-dokumenter-og-saker/#/details/a-6965376f__8677__47ea__a757__23e14c179149-2006000395!3v1jkF/d-6965376f__8677__47ea__a757__23e14c179149-2006018237!70p8h8",
    "filer": [],
    "status": "Må bes om innsyn"
  },
  {
    "tittel": "49/37,39,56,75,133,270,536 IGANGSETTINGSTILLATELSE FOR RESTERENDE ARBEIDER - JØRPELAND BRYGGE",
    "dato": "15.11.2006",
    "dato_iso": "2006-11-15",
    "dokumentID": "2006/18024",
    "dokumenttype": "Saksframlegg",
    "avsender_mottaker": "",
    "journal_link": "https://www.strand.kommune.no/tjenester/politikk-innsyn-og-medvirkning/postliste-dokumenter-og-vedtak/sok-i-post-dokumenter-og-saker/#/details/a-6965376f__8677__47ea__a757__23e14c179149-2006000045!2TCstK/d-6965376f__8677__47ea__a757__23e14c179149-2006018024!f1jTCf",
    "filer": [
      {
        "tekst": "49/37,39,56,75,133,270,536 IGANGSETTINGSTILLATELSE FOR RESTERENDE ARBEIDER - JØRPELAND BRYGGE (pdf, 296KB)",
        "url": "https://www.strand.kommune.no/api/presentation/v2/nye-innsyn/filer/v-6965376f__8677__47ea__a757__23e14c179149-19887_1_A!d-2006018024!DTGBbD?pid=29"
      }
    ],
    "status": "Publisert"
  },
  {
    "tittel": "DELING AV GRUNNEIENDOM GN 44/21",
    "dato": "15.11.2006",
    "dato_iso": "2006-11-15",
    "dokumentID": "2006/18062",
    "dokumenttype": "Saksframlegg",
    "avsender_mottaker": "",
    "journal_link": "https://www.strand.kommune.no/tjenester/politikk-innsyn-og-medvirkning/postliste-dokumenter-og-vedtak/sok-i-post-dokumenter-og-saker/#/details/a-6965376f__8677__47ea__a757__23e14c179149-2006001378!LryWDF/d-6965376f__8677__47ea__a757__23e14c179149-2006018062!kryL6p",
    "filer": [
      {
        "tekst": "DELING AV GRUNNEIENDOM GN 44/21 (pdf, 93KB)",
        "url": "https://www.strand.kommune.no/api/presentation/v2/nye-innsyn/filer/v-6965376f__8677__47ea__a757__23e14c179149-19919_1_A!d-2006018062!bZbhrp?pid=29"
      }
    ],
    "status": "Publisert"
  },
  {
    "tittel": "49/37, MFL. LOKAL GODKJENNING - JØRPELAND BRYGGE",
    "dato": "15.11.2006",
    "dato_iso": "2006-11-15",
    "dokumentID": "2006/18005",
    "dokumenttype": "Saksframlegg",
    "avsender_mottaker": "",
    "journal_link": "https://www.strand.kommune.no/tjenester/politikk-innsyn-og-medvirkning/postliste-dokumenter-og-vedtak/sok-i-post-dokumenter-og-saker/#/details/a-6965376f__8677__47ea__a757__23e14c179149-2006000045!2TCstK/d-6965376f__8677__47ea__a757__23e14c179149-2006018005!rOVhLZ",
    "filer": [
      {
        "tekst": "49/37, MFL. LOKAL GODKJENNING - JØRPELAND BRYGGE (pdf, 273KB)",
        "url": "https://www.strand.kommune.no/api/presentation/v2/nye-innsyn/filer/v-6965376f__8677__47ea__a757__23e14c179149-19882_1_A!d-2006018005!a5Uays?pid=29"
      }
    ],
    "status": "Publisert"
  },
  {
    "tittel": "KOM 15.11.2006",
    "dato": "13.11.2006",
    "dato_iso": "2006-11-13",
    "dokumentID": "2006/17756",
    "dokumenttype": "Møteprotokoll",
    "avsender_mottaker": "",
    "journal_link": "https://www.strand.kommune.no/tjenester/politikk-innsyn-og-medvirkning/postliste-dokumenter-og-vedtak/sok-i-post-dokumenter-og-saker/#/details/a-6965376f__8677__47ea__a757__23e14c179149-2006000395!3v1jkF/d-6965376f__8677__47ea__a757__23e14c179149-2006017756!pYX1Ro",
    "filer": [
      {
        "tekst": "KOM 15.11.2006 (pdf, 527KB)",
        "url": "https://www.strand.kommune.no/api/presentation/v2/nye-innsyn/filer/v-6965376f__8677__47ea__a757__23e14c179149-19600_1_A!d-2006017756!YeqRyA?pid=29"
      }
    ],
    "status": "Publisert"
  },
  {
    "tittel": "OPPDELING I EIERSEKSJONER, GN 44/638",
    "dato": "13.11.2006",
    "dato_iso": "2006-11-13",
    "dokumentID": "2006/17841",
    "dokumenttype": "Saksframlegg",
    "avsender_mottaker": "",
    "journal_link": "https://www.strand.kommune.no/tjenester/politikk-innsyn-og-medvirkning/postliste-dokumenter-og-vedtak/sok-i-post-dokumenter-og-saker/#/details/a-6965376f__8677__47ea__a757__23e14c179149-2006002627!sMXNBE/d-6965376f__8677__47ea__a757__23e14c179149-2006017841!0l8ZdZ",
    "filer": [
      {
        "tekst": "OPPDELING I EIERSEKSJONER, GN 44/638 (pdf, 90KB)",
        "url": "https://www.strand.kommune.no/api/presentation/v2/nye-innsyn/filer/v-6965376f__8677__47ea__a757__23e14c179149-19687_1_A!d-2006017841!SB7olB?pid=29"
      }
    ],
    "status": "Publisert"
  },
  {
    "tittel": "KOM 15.11.2006",
    "dato": "13.11.2006",
    "dato_iso": "2006-11-13",
    "dokumentID": "2006/17354",
    "dokumenttype": "Sakskart",
    "avsender_mottaker": "",
    "journal_link": "https://www.strand.kommune.no/tjenester/politikk-innsyn-og-medvirkning/postliste-dokumenter-og-vedtak/sok-i-post-dokumenter-og-saker/#/details/a-6965376f__8677__47ea__a757__23e14c179149-2006000395!3v1jkF/d-6965376f__8677__47ea__a757__23e14c179149-2006017354!VqFGC5",
    "filer": [
      {
        "tekst": "KOM 15.11.2006 (pdf, 944KB)",
        "url": "https://www.strand.kommune.no/api/presentation/v2/nye-innsyn/filer/v-6965376f__8677__47ea__a757__23e14c179149-19183_1_A!d-2006017354!DcVV7c?pid=29"
      }
    ],
    "status": "Publisert"
  },
  {
    "tittel": "FVA 15.11.2006",
    "dato": "13.11.2006",
    "dato_iso": "2006-11-13",
    "dokumentID": "2006/17484",
    "dokumenttype": "Sakskart",
    "avsender_mottaker": "",
    "journal_link": "https://www.strand.kommune.no/tjenester/politikk-innsyn-og-medvirkning/postliste-dokumenter-og-vedtak/sok-i-post-dokumenter-og-saker/#/details/a-6965376f__8677__47ea__a757__23e14c179149-2006002623!dgjHon/d-6965376f__8677__47ea__a757__23e14c179149-2006017484!3dHyX3",
    "filer": [
      {
        "tekst": "FVA 15.11.2006 (pdf, 336KB)",
        "url": "https://www.strand.kommune.no/api/presentation/v2/nye-innsyn/filer/v-6965376f__8677__47ea__a757__23e14c179149-19324_1_A!d-2006017484!3qgHv0?pid=29"
      }
    ],
    "status": "Publisert"
  },
  {
    "tittel": "OMGJØRING AV VEDTAK - DELING AV GRUNNEIENDOM, GN 10/9",
    "dato": "09.11.2006",
    "dato_iso": "2006-11-09",
    "dokumentID": "2006/17607",
    "dokumenttype": "Saksframlegg",
    "avsender_mottaker": "",
    "journal_link": "https://www.strand.kommune.no/tjenester/politikk-innsyn-og-medvirkning/postliste-dokumenter-og-vedtak/sok-i-post-dokumenter-og-saker/#/details/a-6965376f__8677__47ea__a757__23e14c179149-2006002336!1AAKjm/d-6965376f__8677__47ea__a757__23e14c179149-2006017607!iQ0sof",
    "filer": [
      {
        "tekst": "OMGJØRING AV VEDTAK - DELING AV GRUNNEIENDOM, GN 10/9 (pdf, 95KB)",
        "url": "https://www.strand.kommune.no/api/presentation/v2/nye-innsyn/filer/v-6965376f__8677__47ea__a757__23e14c179149-19455_1_A!d-2006017607!ji5WEe?pid=29"
      }
    ],
    "status": "Publisert"
  },
  {
    "tittel": "OPPDELING I EIERSEKSJONER GN 49/665",
    "dato": "08.11.2006",
    "dato_iso": "2006-11-08",
    "dokumentID": "2006/17517",
    "dokumenttype": "Saksframlegg",
    "avsender_mottaker": "",
    "journal_link": "https://www.strand.kommune.no/tjenester/politikk-innsyn-og-medvirkning/postliste-dokumenter-og-vedtak/sok-i-post-dokumenter-og-saker/#/details/a-6965376f__8677__47ea__a757__23e14c179149-2006002596!viNqis/d-6965376f__8677__47ea__a757__23e14c179149-2006017517!UIo1ed",
    "filer": [
      {
        "tekst": "OPPDELING I EIERSEKSJONER GN 49/665 (pdf, 90KB)",
        "url": "https://www.strand.kommune.no/api/presentation/v2/nye-innsyn/filer/v-6965376f__8677__47ea__a757__23e14c179149-19346_1_A!d-2006017517!jViNFO?pid=29"
      }
    ],
    "status": "Publisert"
  },
  {
    "tittel": "63/280 TILLATELSE TIL TILTAK - RIVE OG SETTE OPP FELLES BRYGGEANLEGG",
    "dato": "08.11.2006",
    "dato_iso": "2006-11-08",
    "dokumentID": "2006/17479",
    "dokumenttype": "Saksframlegg",
    "avsender_mottaker": "",
    "journal_link": "https://www.strand.kommune.no/tjenester/politikk-innsyn-og-medvirkning/postliste-dokumenter-og-vedtak/sok-i-post-dokumenter-og-saker/#/details/a-6965376f__8677__47ea__a757__23e14c179149-2006002618!7FeBN6/d-6965376f__8677__47ea__a757__23e14c179149-2006017479!ReRpMU",
    "filer": [
      {
        "tekst": "63/280 TILLATELSE TIL TILTAK - RIVE OG SETTE OPP FELLES BRYGGEANLEGG (pdf, 293KB)",
        "url": "https://www.strand.kommune.no/api/presentation/v2/nye-innsyn/filer/v-6965376f__8677__47ea__a757__23e14c179149-19319_1_A!d-2006017479!Y6HhLa?pid=29"
      }
    ],
    "status": "Publisert"
  },
  {
    "tittel": "16/290 TILLATELSE TIL TILTAK - FLYTTING OG OPPFØRING AV BOLIG",
    "dato": "08.11.2006",
    "dato_iso": "2006-11-08",
    "dokumentID": "2006/17489",
    "dokumenttype": "Saksframlegg",
    "avsender_mottaker": "",
    "journal_link": "https://www.strand.kommune.no/tjenester/politikk-innsyn-og-medvirkning/postliste-dokumenter-og-vedtak/sok-i-post-dokumenter-og-saker/#/details/a-6965376f__8677__47ea__a757__23e14c179149-2006002486!p1G4eZ/d-6965376f__8677__47ea__a757__23e14c179149-2006017489!wba0ZT",
    "filer": [
      {
        "tekst": "16/290 TILLATELSE TIL TILTAK - FLYTTING OG OPPFØRING AV BOLIG (pdf, 275KB)",
        "url": "https://www.strand.kommune.no/api/presentation/v2/nye-innsyn/filer/v-6965376f__8677__47ea__a757__23e14c179149-19329_1_A!d-2006017489!lUrpSE?pid=29"
      }
    ],
    "status": "Publisert"
  },
  {
    "tittel": "16/272 LOKAL GODKJENNING",
    "dato": "08.11.2006",
    "dato_iso": "2006-11-08",
    "dokumentID": "2006/17510",
    "dokumenttype": "Saksframlegg",
    "avsender_mottaker": "",
    "journal_link": "https://www.strand.kommune.no/tjenester/politikk-innsyn-og-medvirkning/postliste-dokumenter-og-vedtak/sok-i-post-dokumenter-og-saker/#/details/a-6965376f__8677__47ea__a757__23e14c179149-2006002631!pRsJO7/d-6965376f__8677__47ea__a757__23e14c179149-2006017510!nMZx1D",
    "filer": [
      {
        "tekst": "16/272 LOKAL GODKJENNING (pdf, 287KB)",
        "url": "https://www.strand.kommune.no/api/presentation/v2/nye-innsyn/filer/v-6965376f__8677__47ea__a757__23e14c179149-19341_1_A!d-2006017510!ij0t6C?pid=29"
      }
    ],
    "status": "Publisert"
  },
  {
    "tittel": "DELING AV GRUNNEIENDOM, GN 16/75",
    "dato": "07.11.2006",
    "dato_iso": "2006-11-07",
    "dokumentID": "2006/17477",
    "dokumenttype": "Saksframlegg",
    "avsender_mottaker": "",
    "journal_link": "https://www.strand.kommune.no/tjenester/politikk-innsyn-og-medvirkning/postliste-dokumenter-og-vedtak/sok-i-post-dokumenter-og-saker/#/details/a-6965376f__8677__47ea__a757__23e14c179149-2006002499!F7S0lr/d-6965376f__8677__47ea__a757__23e14c179149-2006017477!L6WFZC",
    "filer": [
      {
        "tekst": "DELING AV GRUNNEIENDOM, GN 16/75 (pdf, 93KB)",
        "url": "https://www.strand.kommune.no/api/presentation/v2/nye-innsyn/filer/v-6965376f__8677__47ea__a757__23e14c179149-19302_1_A!d-2006017477!JknSyg?pid=29"
      }
    ],
    "status": "Publisert"
  },
  {
    "tittel": "DELING AV GRUNNEIENDOM, GN 31/1/26",
    "dato": "03.11.2006",
    "dato_iso": "2006-11-03",
    "dokumentID": "2006/17253",
    "dokumenttype": "Saksframlegg",
    "avsender_mottaker": "",
    "journal_link": "https://www.strand.kommune.no/tjenester/politikk-innsyn-og-medvirkning/postliste-dokumenter-og-vedtak/sok-i-post-dokumenter-og-saker/#/details/a-6965376f__8677__47ea__a757__23e14c179149-2006001316!VpXdl4/d-6965376f__8677__47ea__a757__23e14c179149-2006017253!axMw5U",
    "filer": [
      {
        "tekst": "DELING AV GRUNNEIENDOM, GN 31/1/26 (pdf, 93KB)",
        "url": "https://www.strand.kommune.no/api/presentation/v2/nye-innsyn/filer/v-6965376f__8677__47ea__a757__23e14c179149-19069_1_A!d-2006017253!bRmgrt?pid=29"
      }
    ],
    "status": "Publisert"
  },
  {
    "tittel": "DELING AV GRUNNEIENDOM, GN 16/13,26",
    "dato": "03.11.2006",
    "dato_iso": "2006-11-03",
    "dokumentID": "2006/17305",
    "dokumenttype": "Saksframlegg",
    "avsender_mottaker": "",
    "journal_link": "https://www.strand.kommune.no/tjenester/politikk-innsyn-og-medvirkning/postliste-dokumenter-og-vedtak/sok-i-post-dokumenter-og-saker/#/details/a-6965376f__8677__47ea__a757__23e14c179149-2006002132!5lWYS7/d-6965376f__8677__47ea__a757__23e14c179149-2006017305!o7KXmb",
    "filer": [
      {
        "tekst": "DELING AV GRUNNEIENDOM, GN 16/13,26 (pdf, 93KB)",
        "url": "https://www.strand.kommune.no/api/presentation/v2/nye-innsyn/filer/v-6965376f__8677__47ea__a757__23e14c179149-19122_1_A!d-2006017305!zzXE3G?pid=29"
      }
    ],
    "status": "Publisert"
  },
  {
    "tittel": "DELING AV GRUNNEIENDOM, GN 31/535",
    "dato": "03.11.2006",
    "dato_iso": "2006-11-03",
    "dokumentID": "2006/17222",
    "dokumenttype": "Saksframlegg",
    "avsender_mottaker": "",
    "journal_link": "https://www.strand.kommune.no/tjenester/politikk-innsyn-og-medvirkning/postliste-dokumenter-og-vedtak/sok-i-post-dokumenter-og-saker/#/details/a-6965376f__8677__47ea__a757__23e14c179149-2006002502!xZ8Ntn/d-6965376f__8677__47ea__a757__23e14c179149-2006017222!pmUTAR",
    "filer": [
      {
        "tekst": "DELING AV GRUNNEIENDOM, GN 31/535 (pdf, 93KB)",
        "url": "https://www.strand.kommune.no/api/presentation/v2/nye-innsyn/filer/v-6965376f__8677__47ea__a757__23e14c179149-19028_1_A!d-2006017222!rrAjNK?pid=29"
      }
    ],
    "status": "Publisert"
  },
  {
    "tittel": "47/611 M.FLERE TILLATELSE TIL TILTAK - FØRLAND KYRKJEGARD",
    "dato": "03.11.2006",
    "dato_iso": "2006-11-03",
    "dokumentID": "2006/17225",
    "dokumenttype": "Saksframlegg",
    "avsender_mottaker": "",
    "journal_link": "https://www.strand.kommune.no/tjenester/politikk-innsyn-og-medvirkning/postliste-dokumenter-og-vedtak/sok-i-post-dokumenter-og-saker/#/details/a-6965376f__8677__47ea__a757__23e14c179149-2006002128!J8WeeX/d-6965376f__8677__47ea__a757__23e14c179149-2006017225!2uYv31",
    "filer": [
      {
        "tekst": "47/611 M.FLERE TILLATELSE TIL TILTAK - FØRLAND KYRKJEGARD (pdf, 291KB)",
        "url": "https://www.strand.kommune.no/api/presentation/v2/nye-innsyn/filer/v-6965376f__8677__47ea__a757__23e14c179149-19030_1_A!d-2006017225!lwfKLY?pid=29"
      }
    ],
    "status": "Publisert"
  },
  {
    "tittel": "45/146 LOKAL GODKJENNING - ENEBOLIG MED GARASJE",
    "dato": "02.11.2006",
    "dato_iso": "2006-11-02",
    "dokumentID": "2006/17081",
    "dokumenttype": "Saksframlegg",
    "avsender_mottaker": "",
    "journal_link": "https://www.strand.kommune.no/tjenester/politikk-innsyn-og-medvirkning/postliste-dokumenter-og-vedtak/sok-i-post-dokumenter-og-saker/#/details/a-6965376f__8677__47ea__a757__23e14c179149-2006002448!BbezzU/d-6965376f__8677__47ea__a757__23e14c179149-2006017081!bH0lMp",
    "filer": [
      {
        "tekst": "45/146 LOKAL GODKJENNING - ENEBOLIG MED GARASJE (pdf, 272KB)",
        "url": "https://www.strand.kommune.no/api/presentation/v2/nye-innsyn/filer/v-6965376f__8677__47ea__a757__23e14c179149-18882_1_A!d-2006017081!mddz9U?pid=29"
      }
    ],
    "status": "Publisert"
  },
  {
    "tittel": "45/146 RAMMETILLATELSE - ENEBOLIG MED GARASJE",
    "dato": "02.11.2006",
    "dato_iso": "2006-11-02",
    "dokumentID": "2006/17101",
    "dokumenttype": "Saksframlegg",
    "avsender_mottaker": "",
    "journal_link": "https://www.strand.kommune.no/tjenester/politikk-innsyn-og-medvirkning/postliste-dokumenter-og-vedtak/sok-i-post-dokumenter-og-saker/#/details/a-6965376f__8677__47ea__a757__23e14c179149-2006002448!BbezzU/d-6965376f__8677__47ea__a757__23e14c179149-2006017101!nq2khK",
    "filer": [
      {
        "tekst": "45/146 RAMMETILLATELSE - ENEBOLIG MED GARASJE (pdf, 297KB)",
        "url": "https://www.strand.kommune.no/api/presentation/v2/nye-innsyn/filer/v-6965376f__8677__47ea__a757__23e14c179149-18900_1_A!d-2006017101!cl9raV?pid=29"
      }
    ],
    "status": "Publisert"
  },
  {
    "tittel": "DELING AV GRUNNEIENDOM, GN 31/9",
    "dato": "01.11.2006",
    "dato_iso": "2006-11-01",
    "dokumentID": "2006/17080",
    "dokumenttype": "Saksframlegg",
    "avsender_mottaker": "",
    "journal_link": "https://www.strand.kommune.no/tjenester/politikk-innsyn-og-medvirkning/postliste-dokumenter-og-vedtak/sok-i-post-dokumenter-og-saker/#/details/a-6965376f__8677__47ea__a757__23e14c179149-2006002449!25OVcJ/d-6965376f__8677__47ea__a757__23e14c179149-2006017080!ucdo9g",
    "filer": [
      {
        "tekst": "DELING AV GRUNNEIENDOM, GN 31/9 (pdf, 95KB)",
        "url": "https://www.strand.kommune.no/api/presentation/v2/nye-innsyn/filer/v-6965376f__8677__47ea__a757__23e14c179149-18881_1_A!d-2006017080!wXDbPu?pid=29"
      }
    ],
    "status": "Publisert"
  },
  {
    "tittel": "MØTEBOK FVA 26.10.2006",
    "dato": "31.10.2006",
    "dato_iso": "2006-10-31",
    "dokumentID": "2006/17006",
    "dokumenttype": "Møtebok",
    "avsender_mottaker": "",
    "journal_link": "https://www.strand.kommune.no/tjenester/politikk-innsyn-og-medvirkning/postliste-dokumenter-og-vedtak/sok-i-post-dokumenter-og-saker/#/details/a-6965376f__8677__47ea__a757__23e14c179149-2006000404!51u3At/d-6965376f__8677__47ea__a757__23e14c179149-2006017006!47Jmv2",
    "filer": [
      {
        "tekst": "Møtebok FVA 26.10.2006 (pdf, 1,1MB)",
        "url": "https://www.strand.kommune.no/api/presentation/v2/nye-innsyn/filer/v-6965376f__8677__47ea__a757__23e14c179149-18789_1_A!d-2006017006!u4txFX?pid=29"
      }
    ],
    "status": "Publisert"
  },
  {
    "tittel": "43/297 MELDING OM TILTAK -TILLATELSE TIL TILTAK - GARASJE",
    "dato": "30.10.2006",
    "dato_iso": "2006-10-30",
    "dokumentID": "2006/16889",
    "dokumenttype": "Saksframlegg",
    "avsender_mottaker": "",
    "journal_link": "https://www.strand.kommune.no/tjenester/politikk-innsyn-og-medvirkning/postliste-dokumenter-og-vedtak/sok-i-post-dokumenter-og-saker/#/details/a-6965376f__8677__47ea__a757__23e14c179149-2006001498!dwXwGm/d-6965376f__8677__47ea__a757__23e14c179149-2006016889!efvhAQ",
    "filer": [
      {
        "tekst": "43/297 MELDING OM TILTAK -TILLATELSE TIL TILTAK - GARASJE (pdf, 293KB)",
        "url": "https://www.strand.kommune.no/api/presentation/v2/nye-innsyn/filer/v-6965376f__8677__47ea__a757__23e14c179149-18676_1_A!d-2006016889!eVpb04?pid=29"
      }
    ],
    "status": "Publisert"
  },
  {
    "tittel": "49/553,30,73,438,151,442,124,439 IGANGSETTING BETONGARBEID - FORRETNINGSBYGG",
    "dato": "27.10.2006",
    "dato_iso": "2006-10-27",
    "dokumentID": "2006/16859",
    "dokumenttype": "Saksframlegg",
    "avsender_mottaker": "",
    "journal_link": "https://www.strand.kommune.no/tjenester/politikk-innsyn-og-medvirkning/postliste-dokumenter-og-vedtak/sok-i-post-dokumenter-og-saker/#/details/a-6965376f__8677__47ea__a757__23e14c179149-2006002207!sb4fOr/d-6965376f__8677__47ea__a757__23e14c179149-2006016859!8ZJoQr",
    "filer": [
      {
        "tekst": "49/553,30,73,438,151,442,124,439 IGANGSETTING BETONGARBEID - FORRETNINGSBYGG (pdf, 300KB)",
        "url": "https://www.strand.kommune.no/api/presentation/v2/nye-innsyn/filer/v-6965376f__8677__47ea__a757__23e14c179149-18632_1_A!d-2006016859!2JThe1?pid=29"
      }
    ],
    "status": "Publisert"
  },
  {
    "tittel": "Møtebok FOR 25.10.2006",
    "dato": "27.10.2006",
    "dato_iso": "2006-10-27",
    "dokumentID": "2006/16802",
    "dokumenttype": "Møtebok",
    "avsender_mottaker": "",
    "journal_link": "https://www.strand.kommune.no/tjenester/politikk-innsyn-og-medvirkning/postliste-dokumenter-og-vedtak/sok-i-post-dokumenter-og-saker/#/details/a-6965376f__8677__47ea__a757__23e14c179149-2006000388!nhwVUM/d-6965376f__8677__47ea__a757__23e14c179149-2006016802!fVGmOE",
    "filer": [],
    "status": "Må bes om innsyn"
  },
  {
    "tittel": "Møtebok ADM 25.10.2006",
    "dato": "26.10.2006",
    "dato_iso": "2006-10-26",
    "dokumentID": "2006/16733",
    "dokumenttype": "Møtebok",
    "avsender_mottaker": "",
    "journal_link": "https://www.strand.kommune.no/tjenester/politikk-innsyn-og-medvirkning/postliste-dokumenter-og-vedtak/sok-i-post-dokumenter-og-saker/#/details/a-6965376f__8677__47ea__a757__23e14c179149-2006001152!k5zMjb/d-6965376f__8677__47ea__a757__23e14c179149-2006016733!kMoaTA",
    "filer": [],
    "status": "Må bes om innsyn"
  },
  {
    "tittel": "67/23 TILLATELSE TIL TILTAK - PLANERING AV TOMT",
    "dato": "25.10.2006",
    "dato_iso": "2006-10-25",
    "dokumentID": "2006/16496",
    "dokumenttype": "Saksframlegg",
    "avsender_mottaker": "",
    "journal_link": "https://www.strand.kommune.no/tjenester/politikk-innsyn-og-medvirkning/postliste-dokumenter-og-vedtak/sok-i-post-dokumenter-og-saker/#/details/a-6965376f__8677__47ea__a757__23e14c179149-2006002490!1Ozf4q/d-6965376f__8677__47ea__a757__23e14c179149-2006016496!Z62jGB",
    "filer": [
      {
        "tekst": "67/23 TILLATELSE TIL TILTAK - PLANERING AV TOMT (pdf, 97KB)",
        "url": "https://www.strand.kommune.no/api/presentation/v2/nye-innsyn/filer/v-6965376f__8677__47ea__a757__23e14c179149-18261_1_A!d-2006016496!dJQOK7?pid=29"
      }
    ],
    "status": "Publisert"
  },
  {
    "tittel": "FOR 25.10.2006",
    "dato": "24.10.2006",
    "dato_iso": "2006-10-24",
    "dokumentID": "2006/16621",
    "dokumenttype": "Møteprotokoll",
    "avsender_mottaker": "",
    "journal_link": "https://www.strand.kommune.no/tjenester/politikk-innsyn-og-medvirkning/postliste-dokumenter-og-vedtak/sok-i-post-dokumenter-og-saker/#/details/a-6965376f__8677__47ea__a757__23e14c179149-2006000388!nhwVUM/d-6965376f__8677__47ea__a757__23e14c179149-2006016621!IfPAgT",
    "filer": [
      {
        "tekst": "FOR 25.10.2006 (pdf, 480KB)",
        "url": "https://www.strand.kommune.no/api/presentation/v2/nye-innsyn/filer/v-6965376f__8677__47ea__a757__23e14c179149-18405_1_A!d-2006016621!FXyW64?pid=29"
      }
    ],
    "status": "Publisert"
  },
  {
    "tittel": "FVA 26.10.2006",
    "dato": "24.10.2006",
    "dato_iso": "2006-10-24",
    "dokumentID": "2006/16643",
    "dokumenttype": "Møteprotokoll",
    "avsender_mottaker": "",
    "journal_link": "https://www.strand.kommune.no/tjenester/politikk-innsyn-og-medvirkning/postliste-dokumenter-og-vedtak/sok-i-post-dokumenter-og-saker/#/details/a-6965376f__8677__47ea__a757__23e14c179149-2006000404!51u3At/d-6965376f__8677__47ea__a757__23e14c179149-2006016643!kRnTDs",
    "filer": [
      {
        "tekst": "FVA 26.10.2006 (pdf, 501KB)",
        "url": "https://www.strand.kommune.no/api/presentation/v2/nye-innsyn/filer/v-6965376f__8677__47ea__a757__23e14c179149-18430_1_A!d-2006016643!2Zf0kw?pid=29"
      }
    ],
    "status": "Publisert"
  },
  {
    "tittel": "67/3 (OG 66/1,3) TILLATELSE TIL TILTAK - FLOMSIKRING AV DØVIKÅNÅ",
    "dato": "20.10.2006",
    "dato_iso": "2006-10-20",
    "dokumentID": "2006/16463",
    "dokumenttype": "Saksframlegg",
    "avsender_mottaker": "",
    "journal_link": "https://www.strand.kommune.no/tjenester/politikk-innsyn-og-medvirkning/postliste-dokumenter-og-vedtak/sok-i-post-dokumenter-og-saker/#/details/a-6965376f__8677__47ea__a757__23e14c179149-2006002485!2GoEQz/d-6965376f__8677__47ea__a757__23e14c179149-2006016463!rbMi9z",
    "filer": [
      {
        "tekst": "67/3 (OG 66/1,3) TILLATELSE TIL TILTAK - FLOMSIKRING AV DØVIKÅNÅ (pdf, 102KB)",
        "url": "https://www.strand.kommune.no/api/presentation/v2/nye-innsyn/filer/v-6965376f__8677__47ea__a757__23e14c179149-18224_1_A!d-2006016463!pGhTWd?pid=29"
      }
    ],
    "status": "Publisert"
  },
  {
    "tittel": "62/1/28 TILLATELSE TIL TILTAK - FRITIDSBOLIG",
    "dato": "20.10.2006",
    "dato_iso": "2006-10-20",
    "dokumentID": "2006/16488",
    "dokumenttype": "Saksframlegg",
    "avsender_mottaker": "",
    "journal_link": "https://www.strand.kommune.no/tjenester/politikk-innsyn-og-medvirkning/postliste-dokumenter-og-vedtak/sok-i-post-dokumenter-og-saker/#/details/a-6965376f__8677__47ea__a757__23e14c179149-2006002089!e2aRHG/d-6965376f__8677__47ea__a757__23e14c179149-2006016488!TRevb3",
    "filer": [
      {
        "tekst": "62/1/28 TILLATELSE TIL TILTAK - FRITIDSBOLIG (pdf, 296KB)",
        "url": "https://www.strand.kommune.no/api/presentation/v2/nye-innsyn/filer/v-6965376f__8677__47ea__a757__23e14c179149-18251_1_A!d-2006016488!8vWBXa?pid=29"
      }
    ],
    "status": "Publisert"
  },
  {
    "tittel": "ADM 25.10.2006",
    "dato": "18.10.2006",
    "dato_iso": "2006-10-18",
    "dokumentID": "2006/16312",
    "dokumenttype": "Sakskart",
    "avsender_mottaker": "",
    "journal_link": "https://www.strand.kommune.no/tjenester/politikk-innsyn-og-medvirkning/postliste-dokumenter-og-vedtak/sok-i-post-dokumenter-og-saker/#/details/a-6965376f__8677__47ea__a757__23e14c179149-2006001152!k5zMjb/d-6965376f__8677__47ea__a757__23e14c179149-2006016312!gjSozA",
    "filer": [],
    "status": "Må bes om innsyn"
  },
  {
    "tittel": "ADM 25.10.2006",
    "dato": "18.10.2006",
    "dato_iso": "2006-10-18",
    "dokumentID": "2006/16316",
    "dokumenttype": "Møteprotokoll",
    "avsender_mottaker": "",
    "journal_link": "https://www.strand.kommune.no/tjenester/politikk-innsyn-og-medvirkning/postliste-dokumenter-og-vedtak/sok-i-post-dokumenter-og-saker/#/details/a-6965376f__8677__47ea__a757__23e14c179149-2006001152!k5zMjb/d-6965376f__8677__47ea__a757__23e14c179149-2006016316!x4mjYN",
    "filer": [],
    "status": "Må bes om innsyn"
  },
  {
    "tittel": "FOR 25.10.2006",
    "dato": "17.10.2006",
    "dato_iso": "2006-10-17",
    "dokumentID": "2006/16265",
    "dokumenttype": "Sakskart",
    "avsender_mottaker": "",
    "journal_link": "https://www.strand.kommune.no/tjenester/politikk-innsyn-og-medvirkning/postliste-dokumenter-og-vedtak/sok-i-post-dokumenter-og-saker/#/details/a-6965376f__8677__47ea__a757__23e14c179149-2006000388!nhwVUM/d-6965376f__8677__47ea__a757__23e14c179149-2006016265!8xGyHC",
    "filer": [
      {
        "tekst": "FOR 25.10.2006 (pdf, 622KB)",
        "url": "https://www.strand.kommune.no/api/presentation/v2/nye-innsyn/filer/v-6965376f__8677__47ea__a757__23e14c179149-18018_1_A!d-2006016265!Z7gXQT?pid=29"
      }
    ],
    "status": "Publisert"
  },
  {
    "tittel": "FVA 26.10.2006",
    "dato": "16.10.2006",
    "dato_iso": "2006-10-16",
    "dokumentID": "2006/16180",
    "dokumenttype": "Sakskart",
    "avsender_mottaker": "",
    "journal_link": "https://www.strand.kommune.no/tjenester/politikk-innsyn-og-medvirkning/postliste-dokumenter-og-vedtak/sok-i-post-dokumenter-og-saker/#/details/a-6965376f__8677__47ea__a757__23e14c179149-2006000404!51u3At/d-6965376f__8677__47ea__a757__23e14c179149-2006016180!vnBDcU",
    "filer": [
      {
        "tekst": "FVA 26.10.2006 (pdf, 1MB)",
        "url": "https://www.strand.kommune.no/api/presentation/v2/nye-innsyn/filer/v-6965376f__8677__47ea__a757__23e14c179149-17934_1_A!d-2006016180!baMcrw?pid=29"
      }
    ],
    "status": "Publisert"
  },
  {
    "tittel": "SØKNAD OM DISPENSASJON FRA KOMMUNEPLANEN FOR OPPFØRING AV 4 UNGDOMSHYTTER PÅ GNR 56/1 VED PREIKESTOLHYTTA",
    "dato": "12.10.2006",
    "dato_iso": "2006-10-12",
    "dokumentID": "2006/15718",
    "dokumenttype": "Saksframlegg",
    "avsender_mottaker": "",
    "journal_link": "https://www.strand.kommune.no/tjenester/politikk-innsyn-og-medvirkning/postliste-dokumenter-og-vedtak/sok-i-post-dokumenter-og-saker/#/details/a-6965376f__8677__47ea__a757__23e14c179149-2006002299!TWqSYO/d-6965376f__8677__47ea__a757__23e14c179149-2006015718!jznmYQ",
    "filer": [
      {
        "tekst": "SØKNAD OM DISPENSASJON FRA KOMMUNEPLANEN FOR OPPFØRING AV 4 UNGDOMSHYTTER PÅ GNR 56/1 VED PREIKESTOLHYTTA (pdf, 267KB)",
        "url": "https://www.strand.kommune.no/api/presentation/v2/nye-innsyn/filer/v-6965376f__8677__47ea__a757__23e14c179149-17423_1_A!d-2006015718!xdWJXc?pid=29"
      },
      {
        "tekst": "SØKNAD OM BASECAMPS.PDF (pdf, 3,6MB)",
        "url": "https://www.strand.kommune.no/api/presentation/v2/nye-innsyn/filer/v-6965376f__8677__47ea__a757__23e14c179149-17422_1_A!d-2006015718!25AoUQ?pid=29"
      }
    ],
    "status": "Publisert"
  },
  {
    "tittel": "32/4 SØKNAD OM DISPENSASJON FRÅ KOMMUNEPLANEN FOR FRÅDELING AV TUN MED TILLEGGSAREAL GNR 32 BNR 4 PÅ STRAND",
    "dato": "12.10.2006",
    "dato_iso": "2006-10-12",
    "dokumentID": "2006/15992",
    "dokumenttype": "Saksframlegg",
    "avsender_mottaker": "",
    "journal_link": "https://www.strand.kommune.no/tjenester/politikk-innsyn-og-medvirkning/postliste-dokumenter-og-vedtak/sok-i-post-dokumenter-og-saker/#/details/a-6965376f__8677__47ea__a757__23e14c179149-2006001526!8UuUn9/d-6965376f__8677__47ea__a757__23e14c179149-2006015992!ndS494",
    "filer": [
      {
        "tekst": "32/4 SØKNAD OM DISPENSASJON FRÅ KOMMUNEPLANEN FOR FRÅDELING AV TUN MED (pdf, 115KB)",
        "url": "https://www.strand.kommune.no/api/presentation/v2/nye-innsyn/filer/v-6965376f__8677__47ea__a757__23e14c179149-17709_1_A!d-2006015992!ZIi6ek?pid=29"
      },
      {
        "tekst": "UTTALE - SØKNAD OM DISPENSASJON FRÅ KOMMUNEPLANEN FOR FRÅDELING AV TUN MED (pdf, 113KB)",
        "url": "https://www.strand.kommune.no/api/presentation/v2/nye-innsyn/filer/v-6965376f__8677__47ea__a757__23e14c179149-17620_1_A!d-2006015992!quyssA?pid=29"
      },
      {
        "tekst": "Kart - Søknad om frådeling 32/4 (pdf, 178KB)",
        "url": "https://www.strand.kommune.no/api/presentation/v2/nye-innsyn/filer/v-6965376f__8677__47ea__a757__23e14c179149-9688_1_A!d-2006015992!e88TrH?pid=29"
      },
      {
        "tekst": "Kart - Søknad om frådeling 32/4 parsell Strand (pdf, 141KB)",
        "url": "https://www.strand.kommune.no/api/presentation/v2/nye-innsyn/filer/v-6965376f__8677__47ea__a757__23e14c179149-9689_1_A!d-2006015992!Y9UZBk?pid=29"
      }
    ],
    "status": "Publisert"
  },
  {
    "tittel": "REGULERINGSPLAN FOR BÅTHUS PÅ GNR 1/1 MFL. GEITASKJÆR - 1. GANGS BEHANDLING",
    "dato": "11.10.2006",
    "dato_iso": "2006-10-11",
    "dokumentID": "2006/14693",
    "dokumenttype": "Saksframlegg",
    "avsender_mottaker": "",
    "journal_link": "https://www.strand.kommune.no/tjenester/politikk-innsyn-og-medvirkning/postliste-dokumenter-og-vedtak/sok-i-post-dokumenter-og-saker/#/details/a-6965376f__8677__47ea__a757__23e14c179149-2006000800!qtI6Dz/d-6965376f__8677__47ea__a757__23e14c179149-2006014693!StjZzi",
    "filer": [
      {
        "tekst": "REGULERINGSPLAN FOR BÅTHUS PÅ GNR 1/1, GEITASKJÆR - 1. GANGS BEHANDLING (pdf, 288KB)",
        "url": "https://www.strand.kommune.no/api/presentation/v2/nye-innsyn/filer/v-6965376f__8677__47ea__a757__23e14c179149-16288_1_A!d-2006014693!feTs8r?pid=29"
      },
      {
        "tekst": "0606Regu.pdf (pdf, 96KB)",
        "url": "https://www.strand.kommune.no/api/presentation/v2/nye-innsyn/filer/v-6965376f__8677__47ea__a757__23e14c179149-12893_1_A!d-2006014693!Dh49Qm?pid=29"
      },
      {
        "tekst": "0606. Reguleringbestemmelser.doc (pdf, 294KB)",
