[
  {
    "tittel": "69/41 TILLATELSE TIL TILTAK - FRITIDSBOLIG",
    "dato": "23.06.2006",
    "dato_iso": "2006-06-23",
    "dokumentID": "2006/10880",
    "dokumenttype": "Saksframlegg",
    "avsender_mottaker": "",
    "journal_link": "https://www.strand.kommune.no/tjenester/politikk-innsyn-og-medvirkning/postliste-dokumenter-og-vedtak/sok-i-post-dokumenter-og-saker/#/details/a-6965376f__8677__47ea__a757__23e14c179149-2006001748!YceLBJ/d-6965376f__8677__47ea__a757__23e14c179149-2006010880!Y2DnkP",
    "filer": [
      {
        "tekst": "69/41 TILLATELSE TIL TILTAK - FRITIDSBOLIG (pdf, 101KB)",
        "url": "https://www.strand.kommune.no/api/presentation/v2/nye-innsyn/filer/v-6965376f__8677__47ea__a757__23e14c179149-12076_1_A!d-2006010880!U9YBjF?pid=29"
      }
    ],
    "status": "Publisert"
  },
  {
    "tittel": "69/40 TILLATELSE TIL TILTAK - FRITIDSBOLIG",
    "dato": "23.06.2006",
    "dato_iso": "2006-06-23",
    "dokumentID": "2006/10836",
    "dokumenttype": "Saksframlegg",
    "avsender_mottaker": "",
    "journal_link": "https://www.strand.kommune.no/tjenester/politikk-innsyn-og-medvirkning/postliste-dokumenter-og-vedtak/sok-i-post-dokumenter-og-saker/#/details/a-6965376f__8677__47ea__a757__23e14c179149-2006001747!VVhTgb/d-6965376f__8677__47ea__a757__23e14c179149-2006010836!d2nRvW",
    "filer": [
      {
        "tekst": "69/40 TILLATELSE TIL TILTAK - FRITIDSBOLIG (pdf, 101KB)",
        "url": "https://www.strand.kommune.no/api/presentation/v2/nye-innsyn/filer/v-6965376f__8677__47ea__a757__23e14c179149-12046_1_A!d-2006010836!rQqESd?pid=29"
      }
    ],
    "status": "Publisert"
  },
  {
    "tittel": "DELING AV GRUNNEIENDOM, GN 49/28",
    "dato": "23.06.2006",
    "dato_iso": "2006-06-23",
    "dokumentID": "2006/10817",
    "dokumenttype": "Saksframlegg",
    "avsender_mottaker": "",
    "journal_link": "https://www.strand.kommune.no/tjenester/politikk-innsyn-og-medvirkning/postliste-dokumenter-og-vedtak/sok-i-post-dokumenter-og-saker/#/details/a-6965376f__8677__47ea__a757__23e14c179149-2006001823!vD2rgX/d-6965376f__8677__47ea__a757__23e14c179149-2006010817!xFuddd",
    "filer": [
      {
        "tekst": "DELING AV GRUNNEIENDOM, GN 49/28 (pdf, 92KB)",
        "url": "https://www.strand.kommune.no/api/presentation/v2/nye-innsyn/filer/v-6965376f__8677__47ea__a757__23e14c179149-12012_1_A!d-2006010817!4bwVCd?pid=29"
      }
    ],
    "status": "Publisert"
  },
  {
    "tittel": "31/67 IGANGSETTING RESTEN AV TILTAKET - 2 FIREMANNSBOLIGER M/GARASJER",
    "dato": "23.06.2006",
    "dato_iso": "2006-06-23",
    "dokumentID": "2006/10798",
    "dokumenttype": "Saksframlegg",
    "avsender_mottaker": "",
    "journal_link": "https://www.strand.kommune.no/tjenester/politikk-innsyn-og-medvirkning/postliste-dokumenter-og-vedtak/sok-i-post-dokumenter-og-saker/#/details/a-6965376f__8677__47ea__a757__23e14c179149-2006000150!lpBgYQ/d-6965376f__8677__47ea__a757__23e14c179149-2006010798!SYY5EK",
    "filer": [
      {
        "tekst": "31/67 IGANGSETTING RESTEN AV TILTAKET - 2 FIREMANNSBOLIGER M/GARASJER (pdf, 298KB)",
        "url": "https://www.strand.kommune.no/api/presentation/v2/nye-innsyn/filer/v-6965376f__8677__47ea__a757__23e14c179149-11985_1_A!d-2006010798!9QCuC7?pid=29"
      }
    ],
    "status": "Publisert"
  },
  {
    "tittel": "49/213 49/218 TILLATELSE TIL TILTAK - RIVING AV BYGNINGER",
    "dato": "23.06.2006",
    "dato_iso": "2006-06-23",
    "dokumentID": "2006/10904",
    "dokumenttype": "Saksframlegg",
    "avsender_mottaker": "",
    "journal_link": "https://www.strand.kommune.no/tjenester/politikk-innsyn-og-medvirkning/postliste-dokumenter-og-vedtak/sok-i-post-dokumenter-og-saker/#/details/a-6965376f__8677__47ea__a757__23e14c179149-2006001863!DVuxIk/d-6965376f__8677__47ea__a757__23e14c179149-2006010904!vg4L44",
    "filer": [
      {
        "tekst": "49/213 49/218 TILLATELSE TIL TILTAK - RIVING AV BYGNINGER (pdf, 293KB)",
        "url": "https://www.strand.kommune.no/api/presentation/v2/nye-innsyn/filer/v-6965376f__8677__47ea__a757__23e14c179149-12094_1_A!d-2006010904!LIEZpy?pid=29"
      }
    ],
    "status": "Publisert"
  },
  {
    "tittel": "Møtebok KLA 22.06.2006",
    "dato": "23.06.2006",
    "dato_iso": "2006-06-23",
    "dokumentID": "2006/10824",
    "dokumenttype": "Møtebok",
    "avsender_mottaker": "",
    "journal_link": "https://www.strand.kommune.no/tjenester/politikk-innsyn-og-medvirkning/postliste-dokumenter-og-vedtak/sok-i-post-dokumenter-og-saker/#/details/a-6965376f__8677__47ea__a757__23e14c179149-2006001841!ZREyy1/d-6965376f__8677__47ea__a757__23e14c179149-2006010824!s9unYQ",
    "filer": [],
    "status": "Må bes om innsyn"
  },
  {
    "tittel": "69/42 TILLATELSE TIL TILTAK - FRITIDSBOLIG",
    "dato": "23.06.2006",
    "dato_iso": "2006-06-23",
    "dokumentID": "2006/10859",
    "dokumenttype": "Saksframlegg",
    "avsender_mottaker": "",
    "journal_link": "https://www.strand.kommune.no/tjenester/politikk-innsyn-og-medvirkning/postliste-dokumenter-og-vedtak/sok-i-post-dokumenter-og-saker/#/details/a-6965376f__8677__47ea__a757__23e14c179149-2006001749!NLkE18/d-6965376f__8677__47ea__a757__23e14c179149-2006010859!eclgEw",
    "filer": [
      {
        "tekst": "69/42 TILLATELSE TIL TILTAK - FRITIDSBOLIG (pdf, 102KB)",
        "url": "https://www.strand.kommune.no/api/presentation/v2/nye-innsyn/filer/v-6965376f__8677__47ea__a757__23e14c179149-12066_1_A!d-2006010859!FmeaHL?pid=29"
      }
    ],
    "status": "Publisert"
  },
  {
    "tittel": "53/334 TILLATELSE TIL TILTAK - ENEBOLIG MED GARASJE",
    "dato": "22.06.2006",
    "dato_iso": "2006-06-22",
    "dokumentID": "2006/10575",
    "dokumenttype": "Saksframlegg",
    "avsender_mottaker": "",
    "journal_link": "https://www.strand.kommune.no/tjenester/politikk-innsyn-og-medvirkning/postliste-dokumenter-og-vedtak/sok-i-post-dokumenter-og-saker/#/details/a-6965376f__8677__47ea__a757__23e14c179149-2006001766!RFZsPd/d-6965376f__8677__47ea__a757__23e14c179149-2006010575!bDamSa",
    "filer": [
      {
        "tekst": "53/334 TILLATELSE TIL TILTAK - ENEBOLIG MED GARASJE (pdf, 296KB)",
        "url": "https://www.strand.kommune.no/api/presentation/v2/nye-innsyn/filer/v-6965376f__8677__47ea__a757__23e14c179149-11752_1_A!d-2006010575!ylaLo8?pid=29"
      }
    ],
    "status": "Publisert"
  },
  {
    "tittel": "44/497 LOKAL GODKJENNING - INGENIØR T. MELVÆR - TILBYGG VERKSTEDHALL",
    "dato": "22.06.2006",
    "dato_iso": "2006-06-22",
    "dokumentID": "2006/10703",
    "dokumenttype": "Saksframlegg",
    "avsender_mottaker": "",
    "journal_link": "https://www.strand.kommune.no/tjenester/politikk-innsyn-og-medvirkning/postliste-dokumenter-og-vedtak/sok-i-post-dokumenter-og-saker/#/details/a-6965376f__8677__47ea__a757__23e14c179149-2006000444!nF7EmQ/d-6965376f__8677__47ea__a757__23e14c179149-2006010703!Vxvp5j",
    "filer": [
      {
        "tekst": "44/497 LOKAL GODKJENNING - INGENIØR T. MELVÆR - TILBYGG VERKSTEDHALL (pdf, 256KB)",
        "url": "https://www.strand.kommune.no/api/presentation/v2/nye-innsyn/filer/v-6965376f__8677__47ea__a757__23e14c179149-11884_1_A!d-2006010703!kz2Ooq?pid=29"
      }
    ],
    "status": "Publisert"
  },
  {
    "tittel": "53/331 TILLATELSE TIL TILTAK - ENEBOLIG STEINHAGEN, TOMT 12",
    "dato": "22.06.2006",
    "dato_iso": "2006-06-22",
    "dokumentID": "2006/10669",
    "dokumenttype": "Saksframlegg",
    "avsender_mottaker": "",
    "journal_link": "https://www.strand.kommune.no/tjenester/politikk-innsyn-og-medvirkning/postliste-dokumenter-og-vedtak/sok-i-post-dokumenter-og-saker/#/details/a-6965376f__8677__47ea__a757__23e14c179149-2006001559!9GgXOx/d-6965376f__8677__47ea__a757__23e14c179149-2006010669!gK01B5",
    "filer": [
      {
        "tekst": "53/331 TILLATELSE TIL TILTAK - ENEBOLIG STEINHAGEN, TOMT 12 (pdf, 100KB)",
        "url": "https://www.strand.kommune.no/api/presentation/v2/nye-innsyn/filer/v-6965376f__8677__47ea__a757__23e14c179149-11843_1_A!d-2006010669!9EjlAl?pid=29"
      }
    ],
    "status": "Publisert"
  },
  {
    "tittel": "OPPDELING I EIERSEKSJONER, GN 49/364",
    "dato": "22.06.2006",
    "dato_iso": "2006-06-22",
    "dokumentID": "2006/10713",
    "dokumenttype": "Saksframlegg",
    "avsender_mottaker": "",
    "journal_link": "https://www.strand.kommune.no/tjenester/politikk-innsyn-og-medvirkning/postliste-dokumenter-og-vedtak/sok-i-post-dokumenter-og-saker/#/details/a-6965376f__8677__47ea__a757__23e14c179149-2006001907!qilmU1/d-6965376f__8677__47ea__a757__23e14c179149-2006010713!AgYZhz",
    "filer": [
      {
        "tekst": "OPPDELING I EIERSEKSJONER, GN 49/364 (pdf, 89KB)",
        "url": "https://www.strand.kommune.no/api/presentation/v2/nye-innsyn/filer/v-6965376f__8677__47ea__a757__23e14c179149-11892_1_A!d-2006010713!aa4CWL?pid=29"
      }
    ],
    "status": "Publisert"
  },
  {
    "tittel": "53/334 LOKAL GODKJENNING - FIRMA GULV OG TAK AS - ENEBOLIG MED GARASJE",
    "dato": "22.06.2006",
    "dato_iso": "2006-06-22",
    "dokumentID": "2006/10589",
    "dokumenttype": "Saksframlegg",
    "avsender_mottaker": "",
    "journal_link": "https://www.strand.kommune.no/tjenester/politikk-innsyn-og-medvirkning/postliste-dokumenter-og-vedtak/sok-i-post-dokumenter-og-saker/#/details/a-6965376f__8677__47ea__a757__23e14c179149-2006001766!RFZsPd/d-6965376f__8677__47ea__a757__23e14c179149-2006010589!Ik4kKA",
    "filer": [
      {
        "tekst": "53/334 LOKAL GODKJENNING - FIRMA GULV OG TAK AS - ENEBOLIG MED GARASJE (pdf, 269KB)",
        "url": "https://www.strand.kommune.no/api/presentation/v2/nye-innsyn/filer/v-6965376f__8677__47ea__a757__23e14c179149-11765_1_A!d-2006010589!LNZleu?pid=29"
      }
    ],
    "status": "Publisert"
  },
  {
    "tittel": "44/497 RAMMETILLATELSE - TILBYGG VERKSTEDHALL",
    "dato": "21.06.2006",
    "dato_iso": "2006-06-21",
    "dokumentID": "2006/10593",
    "dokumenttype": "Saksframlegg",
    "avsender_mottaker": "",
    "journal_link": "https://www.strand.kommune.no/tjenester/politikk-innsyn-og-medvirkning/postliste-dokumenter-og-vedtak/sok-i-post-dokumenter-og-saker/#/details/a-6965376f__8677__47ea__a757__23e14c179149-2006000444!nF7EmQ/d-6965376f__8677__47ea__a757__23e14c179149-2006010593!BWZMOh",
    "filer": [
      {
        "tekst": "44/497 RAMMETILLATELSE - TILBYGG VERKSTEDHALL (pdf, 291KB)",
        "url": "https://www.strand.kommune.no/api/presentation/v2/nye-innsyn/filer/v-6965376f__8677__47ea__a757__23e14c179149-11769_1_A!d-2006010593!BszXl6?pid=29"
      }
    ],
    "status": "Publisert"
  },
  {
    "tittel": "66/11 TILLATELSE TIL TILTAK - GARASJE",
    "dato": "21.06.2006",
    "dato_iso": "2006-06-21",
    "dokumentID": "2006/10616",
    "dokumenttype": "Saksframlegg",
    "avsender_mottaker": "",
    "journal_link": "https://www.strand.kommune.no/tjenester/politikk-innsyn-og-medvirkning/postliste-dokumenter-og-vedtak/sok-i-post-dokumenter-og-saker/#/details/a-6965376f__8677__47ea__a757__23e14c179149-2006001502!0gxKsd/d-6965376f__8677__47ea__a757__23e14c179149-2006010616!At24U4",
    "filer": [
      {
        "tekst": "66/11 TILLATELSE TIL TILTAK - GARASJE (pdf, 289KB)",
        "url": "https://www.strand.kommune.no/api/presentation/v2/nye-innsyn/filer/v-6965376f__8677__47ea__a757__23e14c179149-11784_1_A!d-2006010616!s1e7aO?pid=29"
      }
    ],
    "status": "Publisert"
  },
  {
    "tittel": "48/75 TILLATELSE TIL TILTAK - RIVING AV BOLIG",
    "dato": "21.06.2006",
    "dato_iso": "2006-06-21",
    "dokumentID": "2006/10621",
    "dokumenttype": "Saksframlegg",
    "avsender_mottaker": "",
    "journal_link": "https://www.strand.kommune.no/tjenester/politikk-innsyn-og-medvirkning/postliste-dokumenter-og-vedtak/sok-i-post-dokumenter-og-saker/#/details/a-6965376f__8677__47ea__a757__23e14c179149-2006001471!jDWKOf/d-6965376f__8677__47ea__a757__23e14c179149-2006010621!DB9FSC",
    "filer": [
      {
        "tekst": "48/75 TILLATELSE TIL TILTAK - RIVING AV BOLIG (pdf, 291KB)",
        "url": "https://www.strand.kommune.no/api/presentation/v2/nye-innsyn/filer/v-6965376f__8677__47ea__a757__23e14c179149-11787_1_A!d-2006010621!hFupVj?pid=29"
      }
    ],
    "status": "Publisert"
  },
  {
    "tittel": "48/398 RAMMETILLATELSE TIL TILTAK - 2 ENEBOLIGER MED UTLEIEDEL -",
    "dato": "20.06.2006",
    "dato_iso": "2006-06-20",
    "dokumentID": "2006/10505",
    "dokumenttype": "Saksframlegg",
    "avsender_mottaker": "",
    "journal_link": "https://www.strand.kommune.no/tjenester/politikk-innsyn-og-medvirkning/postliste-dokumenter-og-vedtak/sok-i-post-dokumenter-og-saker/#/details/a-6965376f__8677__47ea__a757__23e14c179149-2006001511!PuqMON/d-6965376f__8677__47ea__a757__23e14c179149-2006010505!4UdGT1",
    "filer": [
      {
        "tekst": "48/398 RAMMETILLATELSE TIL TILTAK - 2 ENEBOLIGER MED UTLEIEDEL - (pdf, 339KB)",
        "url": "https://www.strand.kommune.no/api/presentation/v2/nye-innsyn/filer/v-6965376f__8677__47ea__a757__23e14c179149-11672_1_A!d-2006010505!sV6KAP?pid=29"
      }
    ],
    "status": "Publisert"
  },
  {
    "tittel": "58/1 TILLATELSE TIL TILTAK - FRITIDSBOLIG",
    "dato": "20.06.2006",
    "dato_iso": "2006-06-20",
    "dokumentID": "2006/10546",
    "dokumenttype": "Saksframlegg",
    "avsender_mottaker": "",
    "journal_link": "https://www.strand.kommune.no/tjenester/politikk-innsyn-og-medvirkning/postliste-dokumenter-og-vedtak/sok-i-post-dokumenter-og-saker/#/details/a-6965376f__8677__47ea__a757__23e14c179149-2006001634!CCgdGC/d-6965376f__8677__47ea__a757__23e14c179149-2006010546!y66emY",
    "filer": [
      {
        "tekst": "58/1 TILLATELSE TIL TILTAK - FRITIDSBOLIG (pdf, 293KB)",
        "url": "https://www.strand.kommune.no/api/presentation/v2/nye-innsyn/filer/v-6965376f__8677__47ea__a757__23e14c179149-11694_1_A!d-2006010546!7Pi6Ik?pid=29"
      }
    ],
    "status": "Publisert"
  },
  {
    "tittel": "REGISTRERING AV GNR. 44/627 FJELDEBAKKANE BARNEHAGE AS SOM SÆRSKILT BRANNOBJEKT",
    "dato": "19.06.2006",
    "dato_iso": "2006-06-19",
    "dokumentID": "2006/10385",
    "dokumenttype": "Saksframlegg",
    "avsender_mottaker": "",
    "journal_link": "https://www.strand.kommune.no/tjenester/politikk-innsyn-og-medvirkning/postliste-dokumenter-og-vedtak/sok-i-post-dokumenter-og-saker/#/details/a-6965376f__8677__47ea__a757__23e14c179149-2006001273!dXgBMN/d-6965376f__8677__47ea__a757__23e14c179149-2006010385!76uMHr",
    "filer": [
      {
        "tekst": "REGISTRERING AV GNR. 44/627 FJELDEBAKKANE BARNEHAGE AS SOM SÆRSKILT BRANNOBJEKT (pdf, 101KB)",
        "url": "https://www.strand.kommune.no/api/presentation/v2/nye-innsyn/filer/v-6965376f__8677__47ea__a757__23e14c179149-11536_1_A!d-2006010385!36ZV3l?pid=29"
      }
    ],
    "status": "Publisert"
  },
  {
    "tittel": "REGISTRERING AV GNR. 49/652 SKALLSTØPERIET PUB SOM SÆRSKILT BRANNOBJEKT",
    "dato": "19.06.2006",
    "dato_iso": "2006-06-19",
    "dokumentID": "2006/10395",
    "dokumenttype": "Saksframlegg",
    "avsender_mottaker": "",
    "journal_link": "https://www.strand.kommune.no/tjenester/politikk-innsyn-og-medvirkning/postliste-dokumenter-og-vedtak/sok-i-post-dokumenter-og-saker/#/details/a-6965376f__8677__47ea__a757__23e14c179149-2006001274!cC6rfD/d-6965376f__8677__47ea__a757__23e14c179149-2006010395!JEDUw5",
    "filer": [
      {
        "tekst": "REGISTRERING AV GNR. 49/652 SKALLSTØPERIET SOM SÆRSKILT BRANNOBJEKT (pdf, 101KB)",
        "url": "https://www.strand.kommune.no/api/presentation/v2/nye-innsyn/filer/v-6965376f__8677__47ea__a757__23e14c179149-11543_1_A!d-2006010395!UOSv68?pid=29"
      }
    ],
    "status": "Publisert"
  },
  {
    "tittel": "REGISTRERING AV GNR. 31/669 RØDLANDSMYRÅ BARNEHAGE BA SOM SÆRSKILT BRANNOBJEKT",
    "dato": "19.06.2006",
    "dato_iso": "2006-06-19",
    "dokumentID": "2006/10348",
    "dokumenttype": "Saksframlegg",
    "avsender_mottaker": "",
    "journal_link": "https://www.strand.kommune.no/tjenester/politikk-innsyn-og-medvirkning/postliste-dokumenter-og-vedtak/sok-i-post-dokumenter-og-saker/#/details/a-6965376f__8677__47ea__a757__23e14c179149-2006001272!icWxYq/d-6965376f__8677__47ea__a757__23e14c179149-2006010348!PoK6EI",
    "filer": [
      {
        "tekst": "REGISTRERING AV GNR. 31/669 RØDLANDSMYRÅ BARNEHAGE BA SOM SÆRSKILT BRANNOBJEKT (pdf, 102KB)",
        "url": "https://www.strand.kommune.no/api/presentation/v2/nye-innsyn/filer/v-6965376f__8677__47ea__a757__23e14c179149-11506_1_A!d-2006010348!ltNfND?pid=29"
      }
    ],
    "status": "Publisert"
  },
  {
    "tittel": "KLA 22.06.2006",
    "dato": "19.06.2006",
    "dato_iso": "2006-06-19",
    "dokumentID": "2006/10402",
    "dokumenttype": "Møteprotokoll",
    "avsender_mottaker": "",
    "journal_link": "https://www.strand.kommune.no/tjenester/politikk-innsyn-og-medvirkning/postliste-dokumenter-og-vedtak/sok-i-post-dokumenter-og-saker/#/details/a-6965376f__8677__47ea__a757__23e14c179149-2006001841!ZREyy1/d-6965376f__8677__47ea__a757__23e14c179149-2006010402!TcJDCv",
    "filer": [],
    "status": "Må bes om innsyn"
  },
  {
    "tittel": "KLA 22.06.2006",
    "dato": "19.06.2006",
    "dato_iso": "2006-06-19",
    "dokumentID": "2006/10383",
    "dokumenttype": "Sakskart",
    "avsender_mottaker": "",
    "journal_link": "https://www.strand.kommune.no/tjenester/politikk-innsyn-og-medvirkning/postliste-dokumenter-og-vedtak/sok-i-post-dokumenter-og-saker/#/details/a-6965376f__8677__47ea__a757__23e14c179149-2006001841!ZREyy1/d-6965376f__8677__47ea__a757__23e14c179149-2006010383!9ioHLF",
    "filer": [],
    "status": "Må bes om innsyn"
  },
  {
    "tittel": "REGISTRERING AV GNR. 49/116 PSYKIATRIBOLIGER JONSOK 10 SOM SÆRSKILT BRANNOBJEKT",
    "dato": "16.06.2006",
    "dato_iso": "2006-06-16",
    "dokumentID": "2006/10285",
    "dokumenttype": "Saksframlegg",
    "avsender_mottaker": "",
    "journal_link": "https://www.strand.kommune.no/tjenester/politikk-innsyn-og-medvirkning/postliste-dokumenter-og-vedtak/sok-i-post-dokumenter-og-saker/#/details/a-6965376f__8677__47ea__a757__23e14c179149-2006001268!T8SiRT/d-6965376f__8677__47ea__a757__23e14c179149-2006010285!R2QrRb",
    "filer": [
      {
        "tekst": "REGISTRERING AV GNR. 49/116 PSYKIATRIBOLIGER JONSOK 10 SOM SÆRSKILT BRANNOBJEKT (pdf, 102KB)",
        "url": "https://www.strand.kommune.no/api/presentation/v2/nye-innsyn/filer/v-6965376f__8677__47ea__a757__23e14c179149-11433_1_A!d-2006010285!FXT9h1?pid=29"
      }
    ],
    "status": "Publisert"
  },
  {
    "tittel": "MØTEBOK KOM 14.06.2006",
    "dato": "16.06.2006",
    "dato_iso": "2006-06-16",
    "dokumentID": "2006/10216",
    "dokumenttype": "Møtebok",
    "avsender_mottaker": "",
    "journal_link": "https://www.strand.kommune.no/tjenester/politikk-innsyn-og-medvirkning/postliste-dokumenter-og-vedtak/sok-i-post-dokumenter-og-saker/#/details/a-6965376f__8677__47ea__a757__23e14c179149-2006000392!uU0ZzF/d-6965376f__8677__47ea__a757__23e14c179149-2006010216!pXxiVh",
    "filer": [],
    "status": "Må bes om innsyn"
  },
  {
    "tittel": "REGISTRERING AV GNR. 47/517 47/581 BEKKEVEGEN 16 OG 18 SOM SÆRSKILT BRANNOBJEKT",
    "dato": "16.06.2006",
    "dato_iso": "2006-06-16",
    "dokumentID": "2006/10283",
    "dokumenttype": "Saksframlegg",
    "avsender_mottaker": "",
    "journal_link": "https://www.strand.kommune.no/tjenester/politikk-innsyn-og-medvirkning/postliste-dokumenter-og-vedtak/sok-i-post-dokumenter-og-saker/#/details/a-6965376f__8677__47ea__a757__23e14c179149-2006001267!SXAuBL/d-6965376f__8677__47ea__a757__23e14c179149-2006010283!dgs5IQ",
    "filer": [
      {
        "tekst": "REGISTRERING AV GNR. 47/517 47/581 BEKKEVEGEN 16 OG 18 SOM SÆRSKILT BRANNOBJEKT (pdf, 101KB)",
        "url": "https://www.strand.kommune.no/api/presentation/v2/nye-innsyn/filer/v-6965376f__8677__47ea__a757__23e14c179149-11431_1_A!d-2006010283!TRDSjn?pid=29"
      }
    ],
    "status": "Publisert"
  },
  {
    "tittel": "48/201 48/202 TILLATELSE TIL TILTAK - OMBYGGING/BRUKSENDRING",
    "dato": "16.06.2006",
    "dato_iso": "2006-06-16",
    "dokumentID": "2006/10267",
    "dokumenttype": "Saksframlegg",
    "avsender_mottaker": "",
    "journal_link": "https://www.strand.kommune.no/tjenester/politikk-innsyn-og-medvirkning/postliste-dokumenter-og-vedtak/sok-i-post-dokumenter-og-saker/#/details/a-6965376f__8677__47ea__a757__23e14c179149-2006001195!cvXEiC/d-6965376f__8677__47ea__a757__23e14c179149-2006010267!dRR0JC",
    "filer": [
      {
        "tekst": "48/201 48/202 TILLATELSE TIL TILTAK - OMBYGGING/BRUKSENDRING (pdf, 97KB)",
        "url": "https://www.strand.kommune.no/api/presentation/v2/nye-innsyn/filer/v-6965376f__8677__47ea__a757__23e14c179149-11395_1_A!d-2006010267!Ykox5z?pid=29"
      }
    ],
    "status": "Publisert"
  },
  {
    "tittel": "REGISTRERING AV GNR. 44/640 KLIPPEN SOM SÆRSKILT BRANNOBJEKT",
    "dato": "16.06.2006",
    "dato_iso": "2006-06-16",
    "dokumentID": "2006/10293",
    "dokumenttype": "Saksframlegg",
    "avsender_mottaker": "",
    "journal_link": "https://www.strand.kommune.no/tjenester/politikk-innsyn-og-medvirkning/postliste-dokumenter-og-vedtak/sok-i-post-dokumenter-og-saker/#/details/a-6965376f__8677__47ea__a757__23e14c179149-2006001270!GNy0Sm/d-6965376f__8677__47ea__a757__23e14c179149-2006010293!07rIJa",
    "filer": [
      {
        "tekst": "REGISTRERING AV GNR. 44/640 KLIPPEN SOM SÆRSKILT BRANNOBJEKT (pdf, 101KB)",
        "url": "https://www.strand.kommune.no/api/presentation/v2/nye-innsyn/filer/v-6965376f__8677__47ea__a757__23e14c179149-11442_1_A!d-2006010293!MdgcrD?pid=29"
      }
    ],
    "status": "Publisert"
  },
  {
    "tittel": "RESISTRERING AV GNR. 49/314 BØKESTIEN 1 SOM SÆRSKILT BRANNOBJEKKT",
    "dato": "16.06.2006",
    "dato_iso": "2006-06-16",
    "dokumentID": "2006/10290",
    "dokumenttype": "Saksframlegg",
    "avsender_mottaker": "",
    "journal_link": "https://www.strand.kommune.no/tjenester/politikk-innsyn-og-medvirkning/postliste-dokumenter-og-vedtak/sok-i-post-dokumenter-og-saker/#/details/a-6965376f__8677__47ea__a757__23e14c179149-2006001269!akS3Mm/d-6965376f__8677__47ea__a757__23e14c179149-2006010290!EXAfyx",
    "filer": [
      {
        "tekst": "RESISTRERING AV GNR. 49/314 BØKESTIEN 1 SOM SÆRSKKILT BRANNOBJEKKT (pdf, 100KB)",
        "url": "https://www.strand.kommune.no/api/presentation/v2/nye-innsyn/filer/v-6965376f__8677__47ea__a757__23e14c179149-11439_1_A!d-2006010290!YSNneQ?pid=29"
      }
    ],
    "status": "Publisert"
  },
  {
    "tittel": "REGISTRERING AV GNR. 49/614 VERKSHOTELLET SOM SÆRSKILT BRANNOBJEKT",
    "dato": "16.06.2006",
    "dato_iso": "2006-06-16",
    "dokumentID": "2006/10243",
    "dokumenttype": "Saksframlegg",
    "avsender_mottaker": "",
    "journal_link": "https://www.strand.kommune.no/tjenester/politikk-innsyn-og-medvirkning/postliste-dokumenter-og-vedtak/sok-i-post-dokumenter-og-saker/#/details/a-6965376f__8677__47ea__a757__23e14c179149-2006001265!qlv7gK/d-6965376f__8677__47ea__a757__23e14c179149-2006010243!s7SC4N",
    "filer": [
      {
        "tekst": "49/614 VERKSHOTELLET (pdf, 101KB)",
        "url": "https://www.strand.kommune.no/api/presentation/v2/nye-innsyn/filer/v-6965376f__8677__47ea__a757__23e14c179149-11384_1_A!d-2006010243!8oiwHF?pid=29"
      }
    ],
    "status": "Publisert"
  },
  {
    "tittel": "31/248 TILLATELSE TIL TILTAK - TILBYGG BOLIG",
    "dato": "16.06.2006",
    "dato_iso": "2006-06-16",
    "dokumentID": "2006/9973",
    "dokumenttype": "Saksframlegg",
    "avsender_mottaker": "",
    "journal_link": "https://www.strand.kommune.no/tjenester/politikk-innsyn-og-medvirkning/postliste-dokumenter-og-vedtak/sok-i-post-dokumenter-og-saker/#/details/a-6965376f__8677__47ea__a757__23e14c179149-2006001580!fWYEpU/d-6965376f__8677__47ea__a757__23e14c179149-2006009973!QtHKgJ",
    "filer": [
      {
        "tekst": "31/248 TILLATELSE TIL TILTAK - TILBYGG BOLIG (pdf, 294KB)",
        "url": "https://www.strand.kommune.no/api/presentation/v2/nye-innsyn/filer/v-6965376f__8677__47ea__a757__23e14c179149-11102_1_A!d-2006009973!OlZ7xW?pid=29"
      }
    ],
    "status": "Publisert"
  },
  {
    "tittel": "REGISTRERING AV GNR. 49/27 DIREKTØR POULSONSGT. 31 SOM SÆRSKILT BRANNOBJEKT",
    "dato": "16.06.2006",
    "dato_iso": "2006-06-16",
    "dokumentID": "2006/10274",
    "dokumenttype": "Saksframlegg",
    "avsender_mottaker": "",
    "journal_link": "https://www.strand.kommune.no/tjenester/politikk-innsyn-og-medvirkning/postliste-dokumenter-og-vedtak/sok-i-post-dokumenter-og-saker/#/details/a-6965376f__8677__47ea__a757__23e14c179149-2006001266!jKBs3y/d-6965376f__8677__47ea__a757__23e14c179149-2006010274!rRzwrq",
    "filer": [
      {
        "tekst": "REGISTRERING AV GNR. 49/27 DIREKTØR POULSONSGT. 31 SOM SÆRSKILT BRANNOBJEKT (pdf, 101KB)",
        "url": "https://www.strand.kommune.no/api/presentation/v2/nye-innsyn/filer/v-6965376f__8677__47ea__a757__23e14c179149-11415_1_A!d-2006010274!OnwEly?pid=29"
      }
    ],
    "status": "Publisert"
  },
  {
    "tittel": "49/345 TILLATELSE TIL TILTAK - BUSTADBYGG MED 4 LEILIGHETER",
    "dato": "16.06.2006",
    "dato_iso": "2006-06-16",
    "dokumentID": "2006/10219",
    "dokumenttype": "Saksframlegg",
    "avsender_mottaker": "",
    "journal_link": "https://www.strand.kommune.no/tjenester/politikk-innsyn-og-medvirkning/postliste-dokumenter-og-vedtak/sok-i-post-dokumenter-og-saker/#/details/a-6965376f__8677__47ea__a757__23e14c179149-2006001292!zObGh9/d-6965376f__8677__47ea__a757__23e14c179149-2006010219!44PKjk",
    "filer": [
      {
        "tekst": "49/345 TILLATELSE TIL TILTAK - BUSTADBYGG MED 4 LEILIGHETER (pdf, 297KB)",
        "url": "https://www.strand.kommune.no/api/presentation/v2/nye-innsyn/filer/v-6965376f__8677__47ea__a757__23e14c179149-11372_1_A!d-2006010219!SFODZj?pid=29"
      }
    ],
    "status": "Publisert"
  },
  {
    "tittel": "REGISTRERING AV GNR. 16/20 LILLAND HOTELL SOM SÆRSKILT BRANNOBJEKT",
    "dato": "16.06.2006",
    "dato_iso": "2006-06-16",
    "dokumentID": "2006/10295",
    "dokumenttype": "Saksframlegg",
    "avsender_mottaker": "",
    "journal_link": "https://www.strand.kommune.no/tjenester/politikk-innsyn-og-medvirkning/postliste-dokumenter-og-vedtak/sok-i-post-dokumenter-og-saker/#/details/a-6965376f__8677__47ea__a757__23e14c179149-2006001271!IdXffg/d-6965376f__8677__47ea__a757__23e14c179149-2006010295!wnGhIm",
    "filer": [
      {
        "tekst": "REGISTRERING AV GNR. 16/20 LILLAND HOTELL SOM SÆRSKILT BRANNOBJEKT (pdf, 101KB)",
        "url": "https://www.strand.kommune.no/api/presentation/v2/nye-innsyn/filer/v-6965376f__8677__47ea__a757__23e14c179149-11444_1_A!d-2006010295!2GFyS4?pid=29"
      }
    ],
    "status": "Publisert"
  },
  {
    "tittel": "OPPDELING I EIERSEKSJONER, GN 48/461",
    "dato": "15.06.2006",
    "dato_iso": "2006-06-15",
    "dokumentID": "2006/10188",
    "dokumenttype": "Saksframlegg",
    "avsender_mottaker": "",
    "journal_link": "https://www.strand.kommune.no/tjenester/politikk-innsyn-og-medvirkning/postliste-dokumenter-og-vedtak/sok-i-post-dokumenter-og-saker/#/details/a-6965376f__8677__47ea__a757__23e14c179149-2006001845!KSvo1n/d-6965376f__8677__47ea__a757__23e14c179149-2006010188!nad8G6",
    "filer": [
      {
        "tekst": "OPPDELING I EIERSEKSJONER, GN 48/461 (pdf, 89KB)",
        "url": "https://www.strand.kommune.no/api/presentation/v2/nye-innsyn/filer/v-6965376f__8677__47ea__a757__23e14c179149-11328_1_A!d-2006010188!RCZNDr?pid=29"
      }
    ],
    "status": "Publisert"
  },
  {
    "tittel": "DELING AV GRUNNEIENDOM, GN 45/5",
    "dato": "15.06.2006",
    "dato_iso": "2006-06-15",
    "dokumentID": "2006/10191",
    "dokumenttype": "Saksframlegg",
    "avsender_mottaker": "",
    "journal_link": "https://www.strand.kommune.no/tjenester/politikk-innsyn-og-medvirkning/postliste-dokumenter-og-vedtak/sok-i-post-dokumenter-og-saker/#/details/a-6965376f__8677__47ea__a757__23e14c179149-2006001844!ltK3fv/d-6965376f__8677__47ea__a757__23e14c179149-2006010191!QDWizN",
    "filer": [
      {
        "tekst": "DELING AV GRUNNEIENDOM, GN 45/5 (pdf, 92KB)",
        "url": "https://www.strand.kommune.no/api/presentation/v2/nye-innsyn/filer/v-6965376f__8677__47ea__a757__23e14c179149-11331_1_A!d-2006010191!cGxiGZ?pid=29"
      }
    ],
    "status": "Publisert"
  },
  {
    "tittel": "Møtebok ADM 14.06.2006",
    "dato": "15.06.2006",
    "dato_iso": "2006-06-15",
    "dokumentID": "2006/10136",
    "dokumenttype": "Møtebok",
    "avsender_mottaker": "",
    "journal_link": "https://www.strand.kommune.no/tjenester/politikk-innsyn-og-medvirkning/postliste-dokumenter-og-vedtak/sok-i-post-dokumenter-og-saker/#/details/a-6965376f__8677__47ea__a757__23e14c179149-2006001786!qZBcdJ/d-6965376f__8677__47ea__a757__23e14c179149-2006010136!IoNPTw",
    "filer": [],
    "status": "Må bes om innsyn"
  },
  {
    "tittel": "31/1 KARTFORRETNING",
    "dato": "15.06.2006",
    "dato_iso": "2006-06-15",
    "dokumentID": "2006/10183",
    "dokumenttype": "Saksframlegg",
    "avsender_mottaker": "",
    "journal_link": "https://www.strand.kommune.no/tjenester/politikk-innsyn-og-medvirkning/postliste-dokumenter-og-vedtak/sok-i-post-dokumenter-og-saker/#/details/a-6965376f__8677__47ea__a757__23e14c179149-2006001678!3TTKmj/d-6965376f__8677__47ea__a757__23e14c179149-2006010183!XpYFik",
    "filer": [
      {
        "tekst": "31/1 KARTFORRETNING (pdf, 90KB)",
        "url": "https://www.strand.kommune.no/api/presentation/v2/nye-innsyn/filer/v-6965376f__8677__47ea__a757__23e14c179149-11323_1_A!d-2006010183!qLxbHN?pid=29"
      }
    ],
    "status": "Publisert"
  },
  {
    "tittel": "44/646 TILLATELSE TIL TILTAK - NYBYGG BOLIG",
    "dato": "14.06.2006",
    "dato_iso": "2006-06-14",
    "dokumentID": "2006/10060",
    "dokumenttype": "Saksframlegg",
    "avsender_mottaker": "",
    "journal_link": "https://www.strand.kommune.no/tjenester/politikk-innsyn-og-medvirkning/postliste-dokumenter-og-vedtak/sok-i-post-dokumenter-og-saker/#/details/a-6965376f__8677__47ea__a757__23e14c179149-2006001750!CLGKF2/d-6965376f__8677__47ea__a757__23e14c179149-2006010060!mDGraH",
    "filer": [
      {
        "tekst": "44/646 TILLATELSE TIL TILTAK - NYBYGG BOLIG (pdf, 294KB)",
        "url": "https://www.strand.kommune.no/api/presentation/v2/nye-innsyn/filer/v-6965376f__8677__47ea__a757__23e14c179149-11188_1_A!d-2006010060!M9XZbU?pid=29"
      }
    ],
    "status": "Publisert"
  },
  {
    "tittel": "ADM 14.06.2006",
    "dato": "13.06.2006",
    "dato_iso": "2006-06-13",
    "dokumentID": "2006/9946",
    "dokumenttype": "Møteprotokoll",
    "avsender_mottaker": "",
    "journal_link": "https://www.strand.kommune.no/tjenester/politikk-innsyn-og-medvirkning/postliste-dokumenter-og-vedtak/sok-i-post-dokumenter-og-saker/#/details/a-6965376f__8677__47ea__a757__23e14c179149-2006001786!qZBcdJ/d-6965376f__8677__47ea__a757__23e14c179149-2006009946!DQPbaO",
    "filer": [],
    "status": "Må bes om innsyn"
  },
  {
    "tittel": "KOM 14.06.2006",
    "dato": "12.06.2006",
    "dato_iso": "2006-06-12",
    "dokumentID": "2006/9807",
    "dokumenttype": "Møteprotokoll",
    "avsender_mottaker": "",
    "journal_link": "https://www.strand.kommune.no/tjenester/politikk-innsyn-og-medvirkning/postliste-dokumenter-og-vedtak/sok-i-post-dokumenter-og-saker/#/details/a-6965376f__8677__47ea__a757__23e14c179149-2006000392!uU0ZzF/d-6965376f__8677__47ea__a757__23e14c179149-2006009807!24jKYF",
    "filer": [
      {
        "tekst": "KOM 14.06.2006 (pdf, 615KB)",
        "url": "https://www.strand.kommune.no/api/presentation/v2/nye-innsyn/filer/v-6965376f__8677__47ea__a757__23e14c179149-10910_1_A!d-2006009807!RzGmHJ?pid=29"
      }
    ],
    "status": "Publisert"
  },
  {
    "tittel": "Møtebok FOR 07.06.2006",
    "dato": "11.06.2006",
    "dato_iso": "2006-06-11",
    "dokumentID": "2006/9797",
    "dokumenttype": "Møtebok",
    "avsender_mottaker": "",
    "journal_link": "https://www.strand.kommune.no/tjenester/politikk-innsyn-og-medvirkning/postliste-dokumenter-og-vedtak/sok-i-post-dokumenter-og-saker/#/details/a-6965376f__8677__47ea__a757__23e14c179149-2006000384!BKP5U0/d-6965376f__8677__47ea__a757__23e14c179149-2006009797!hJthuz",
    "filer": [],
    "status": "Må bes om innsyn"
  },
  {
    "tittel": "57/6/2 TILLATELSE TIL TILTAK - RAMMESØKNAD FRITIDSBOLIG",
    "dato": "09.06.2006",
    "dato_iso": "2006-06-09",
    "dokumentID": "2006/9747",
    "dokumenttype": "Saksframlegg",
    "avsender_mottaker": "",
    "journal_link": "https://www.strand.kommune.no/tjenester/politikk-innsyn-og-medvirkning/postliste-dokumenter-og-vedtak/sok-i-post-dokumenter-og-saker/#/details/a-6965376f__8677__47ea__a757__23e14c179149-2006000780!xMcQoK/d-6965376f__8677__47ea__a757__23e14c179149-2006009747!UOAu9E",
    "filer": [
      {
        "tekst": "57/6/2 TILLATELSE TIL TILTAK - RAMMESØKNAD FRITIDSBOLIG (pdf, 274KB)",
        "url": "https://www.strand.kommune.no/api/presentation/v2/nye-innsyn/filer/v-6965376f__8677__47ea__a757__23e14c179149-10848_1_A!d-2006009747!o3jdhJ?pid=29"
      }
    ],
    "status": "Publisert"
  },
  {
    "tittel": "32/66 TILLATELSE TIL TILTAK - NYBYGG NAUST,",
    "dato": "08.06.2006",
    "dato_iso": "2006-06-08",
    "dokumentID": "2006/9700",
    "dokumenttype": "Saksframlegg",
    "avsender_mottaker": "",
    "journal_link": "https://www.strand.kommune.no/tjenester/politikk-innsyn-og-medvirkning/postliste-dokumenter-og-vedtak/sok-i-post-dokumenter-og-saker/#/details/a-6965376f__8677__47ea__a757__23e14c179149-2006001690!0gXGTi/d-6965376f__8677__47ea__a757__23e14c179149-2006009700!m5XSZw",
    "filer": [
      {
        "tekst": "32/66 TILLATELSE TIL TILTAK - NYBYGG NAUST, (pdf, 99KB)",
        "url": "https://www.strand.kommune.no/api/presentation/v2/nye-innsyn/filer/v-6965376f__8677__47ea__a757__23e14c179149-10808_1_A!d-2006009700!RwQKIl?pid=29"
      }
    ],
    "status": "Publisert"
  },
  {
    "tittel": "MØTEBOK FVA 07.06.2006",
    "dato": "08.06.2006",
    "dato_iso": "2006-06-08",
    "dokumentID": "2006/9676",
    "dokumenttype": "Møtebok",
    "avsender_mottaker": "",
    "journal_link": "https://www.strand.kommune.no/tjenester/politikk-innsyn-og-medvirkning/postliste-dokumenter-og-vedtak/sok-i-post-dokumenter-og-saker/#/details/a-6965376f__8677__47ea__a757__23e14c179149-2006000401!tZFpMU/d-6965376f__8677__47ea__a757__23e14c179149-2006009676!6sjs1r",
    "filer": [
      {
        "tekst": "Møtebok FVA 07.06.2006 (pdf, 1,3MB)",
        "url": "https://www.strand.kommune.no/api/presentation/v2/nye-innsyn/filer/v-6965376f__8677__47ea__a757__23e14c179149-10773_1_A!d-2006009676!1NKQkj?pid=29"
      }
    ],
    "status": "Publisert"
  },
  {
    "tittel": "44/57 TILLATELSE TIL TILTAK - TILBYGG BOLIG OG GARASJE",
    "dato": "08.06.2006",
    "dato_iso": "2006-06-08",
    "dokumentID": "2006/9706",
    "dokumenttype": "Saksframlegg",
    "avsender_mottaker": "",
    "journal_link": "https://www.strand.kommune.no/tjenester/politikk-innsyn-og-medvirkning/postliste-dokumenter-og-vedtak/sok-i-post-dokumenter-og-saker/#/details/a-6965376f__8677__47ea__a757__23e14c179149-2006001505!btNlNX/d-6965376f__8677__47ea__a757__23e14c179149-2006009706!hfGvxd",
    "filer": [
      {
        "tekst": "44/57 TILLATELSE TIL TILTAK - TILBYGG BOLIG OG GARASJE (pdf, 293KB)",
        "url": "https://www.strand.kommune.no/api/presentation/v2/nye-innsyn/filer/v-6965376f__8677__47ea__a757__23e14c179149-10813_1_A!d-2006009706!Cwd6LF?pid=29"
      }
    ],
    "status": "Publisert"
  },
  {
    "tittel": "55/27 SØKNAD OM FRÅDELING AV PARSELL TIL INDUSTRI FØREMÅL",
    "dato": "07.06.2006",
    "dato_iso": "2006-06-07",
    "dokumentID": "2006/9501",
    "dokumenttype": "Saksframlegg",
    "avsender_mottaker": "",
    "journal_link": "https://www.strand.kommune.no/tjenester/politikk-innsyn-og-medvirkning/postliste-dokumenter-og-vedtak/sok-i-post-dokumenter-og-saker/#/details/a-6965376f__8677__47ea__a757__23e14c179149-2006001045!C5PhSl/d-6965376f__8677__47ea__a757__23e14c179149-2006009501!UqQzMq",
    "filer": [
      {
        "tekst": "55/27 SØKNAD OM FRÅDELING AV PARSELL TIL INDUSTRI FØREMÅL (pdf, 350KB)",
        "url": "https://www.strand.kommune.no/api/presentation/v2/nye-innsyn/filer/v-6965376f__8677__47ea__a757__23e14c179149-10599_2_A!d-2006009501!TFBuQM?pid=29"
      }
    ],
    "status": "Publisert"
  },
  {
    "tittel": "FVA 07.06.2006",
    "dato": "07.06.2006",
    "dato_iso": "2006-06-07",
    "dokumentID": "2006/9568",
    "dokumenttype": "Møteprotokoll",
    "avsender_mottaker": "",
    "journal_link": "https://www.strand.kommune.no/tjenester/politikk-innsyn-og-medvirkning/postliste-dokumenter-og-vedtak/sok-i-post-dokumenter-og-saker/#/details/a-6965376f__8677__47ea__a757__23e14c179149-2006000401!tZFpMU/d-6965376f__8677__47ea__a757__23e14c179149-2006009568!gRzl4Y",
    "filer": [
      {
        "tekst": "FVA 07.06.2006 (pdf, 508KB)",
        "url": "https://www.strand.kommune.no/api/presentation/v2/nye-innsyn/filer/v-6965376f__8677__47ea__a757__23e14c179149-10665_1_A!d-2006009568!DkeZPa?pid=29"
      }
    ],
    "status": "Publisert"
  },
  {
    "tittel": "KOM 14.06.2006",
    "dato": "06.06.2006",
    "dato_iso": "2006-06-06",
    "dokumentID": "2006/9541",
    "dokumenttype": "Sakskart",
    "avsender_mottaker": "",
    "journal_link": "https://www.strand.kommune.no/tjenester/politikk-innsyn-og-medvirkning/postliste-dokumenter-og-vedtak/sok-i-post-dokumenter-og-saker/#/details/a-6965376f__8677__47ea__a757__23e14c179149-2006000392!uU0ZzF/d-6965376f__8677__47ea__a757__23e14c179149-2006009541!PPf48a",
    "filer": [
      {
        "tekst": "KOM 14.06.2006 (pdf, 1,5MB)",
        "url": "https://www.strand.kommune.no/api/presentation/v2/nye-innsyn/filer/v-6965376f__8677__47ea__a757__23e14c179149-10642_1_A!d-2006009541!uvBrRN?pid=29"
      }
    ],
    "status": "Publisert"
  },
  {
    "tittel": "ADM 14.06.2006",
    "dato": "06.06.2006",
    "dato_iso": "2006-06-06",
    "dokumentID": "2006/9565",
    "dokumenttype": "Sakskart",
    "avsender_mottaker": "",
    "journal_link": "https://www.strand.kommune.no/tjenester/politikk-innsyn-og-medvirkning/postliste-dokumenter-og-vedtak/sok-i-post-dokumenter-og-saker/#/details/a-6965376f__8677__47ea__a757__23e14c179149-2006001786!qZBcdJ/d-6965376f__8677__47ea__a757__23e14c179149-2006009565!JWli7e",
    "filer": [],
    "status": "Må bes om innsyn"
  },
  {
    "tittel": "Møtebok KOM 31.05.2006",
    "dato": "06.06.2006",
    "dato_iso": "2006-06-06",
    "dokumentID": "2006/9510",
    "dokumenttype": "Møtebok",
    "avsender_mottaker": "",
    "journal_link": "https://www.strand.kommune.no/tjenester/politikk-innsyn-og-medvirkning/postliste-dokumenter-og-vedtak/sok-i-post-dokumenter-og-saker/#/details/a-6965376f__8677__47ea__a757__23e14c179149-2006001518!Cloevf/d-6965376f__8677__47ea__a757__23e14c179149-2006009510!fBHqPh",
    "filer": [],
    "status": "Må bes om innsyn"
  },
  {
    "tittel": "48/390 ENDRING AV TILLATELSE - NYE ANSVARSRETTER FOR SNR. 1, 2 OG 3",
    "dato": "03.06.2006",
    "dato_iso": "2006-06-03",
    "dokumentID": "2006/9468",
    "dokumenttype": "Saksframlegg",
    "avsender_mottaker": "",
    "journal_link": "https://www.strand.kommune.no/tjenester/politikk-innsyn-og-medvirkning/postliste-dokumenter-og-vedtak/sok-i-post-dokumenter-og-saker/#/details/a-6965376f__8677__47ea__a757__23e14c179149-2006001557!CjbL5j/d-6965376f__8677__47ea__a757__23e14c179149-2006009468!W3BKOi",
    "filer": [
      {
        "tekst": "48/390 ENDRING AV TILLATELSE - NYE ANSVARSRETTER FOR SNR. 1, 2 OG 3 (pdf, 272KB)",
        "url": "https://www.strand.kommune.no/api/presentation/v2/nye-innsyn/filer/v-6965376f__8677__47ea__a757__23e14c179149-10538_1_A!d-2006009468!HWS5jc?pid=29"
      }
    ],
    "status": "Publisert"
  },
  {
    "tittel": "53/326 ENDRING AV TILLATELSE TIL TILTAK - UTVIDELSE AV GARASJE OG VINDU",
    "dato": "03.06.2006",
    "dato_iso": "2006-06-03",
    "dokumentID": "2006/9470",
    "dokumenttype": "Saksframlegg",
    "avsender_mottaker": "",
    "journal_link": "https://www.strand.kommune.no/tjenester/politikk-innsyn-og-medvirkning/postliste-dokumenter-og-vedtak/sok-i-post-dokumenter-og-saker/#/details/a-6965376f__8677__47ea__a757__23e14c179149-2006001640!OD4H9R/d-6965376f__8677__47ea__a757__23e14c179149-2006009470!MoSTyr",
    "filer": [
      {
        "tekst": "53/326 ENDRING AV TILLATELSE TIL TILTAK - UTVIDELSE AV GARASJE OG VINDU (pdf, 293KB)",
        "url": "https://www.strand.kommune.no/api/presentation/v2/nye-innsyn/filer/v-6965376f__8677__47ea__a757__23e14c179149-10540_1_A!d-2006009470!qyLS2H?pid=29"
      }
    ],
    "status": "Publisert"
  },
  {
    "tittel": "63/148 LOKAL GODKJENNING - FRITIDSBOLIG - IDSE",
    "dato": "02.06.2006",
    "dato_iso": "2006-06-02",
    "dokumentID": "2006/2200",
    "dokumenttype": "Saksframlegg",
    "avsender_mottaker": "",
    "journal_link": "https://www.strand.kommune.no/tjenester/politikk-innsyn-og-medvirkning/postliste-dokumenter-og-vedtak/sok-i-post-dokumenter-og-saker/#/details/a-6965376f__8677__47ea__a757__23e14c179149-2006000288!ioRJ3g/d-6965376f__8677__47ea__a757__23e14c179149-2006002200!wy3HU3",
    "filer": [
      {
        "tekst": "63/148 LOKAL GODKJENNING - FRITIDSBOLIG - IDSE (pdf, 85KB)",
        "url": "https://www.strand.kommune.no/api/presentation/v2/nye-innsyn/filer/v-6965376f__8677__47ea__a757__23e14c179149-2516_2_P!d-2006002200!cOJTwf?pid=29"
      }
    ],
    "status": "Publisert"
  },
  {
    "tittel": "58/38 TILLATELSE TIL TILTAK - FRITIDSBOLIG",
    "dato": "02.06.2006",
    "dato_iso": "2006-06-02",
    "dokumentID": "2006/9466",
    "dokumenttype": "Saksframlegg",
    "avsender_mottaker": "",
    "journal_link": "https://www.strand.kommune.no/tjenester/politikk-innsyn-og-medvirkning/postliste-dokumenter-og-vedtak/sok-i-post-dokumenter-og-saker/#/details/a-6965376f__8677__47ea__a757__23e14c179149-2006001635!GBLwxv/d-6965376f__8677__47ea__a757__23e14c179149-2006009466!2ZajdC",
    "filer": [
      {
        "tekst": "58/38 TILLATELSE TIL TILTAK - FRITIDSBOLIG (pdf, 294KB)",
        "url": "https://www.strand.kommune.no/api/presentation/v2/nye-innsyn/filer/v-6965376f__8677__47ea__a757__23e14c179149-10536_1_A!d-2006009466!cwIhje?pid=29"
      }
    ],
    "status": "Publisert"
  },
  {
    "tittel": "22/6 SØKNAD OM FRÅDELING AV HYTTETOMT OG NAUSTTOMT PÅ GNR 22 BNR 6",
    "dato": "02.06.2006",
    "dato_iso": "2006-06-02",
    "dokumentID": "2006/9360",
    "dokumenttype": "Saksframlegg",
    "avsender_mottaker": "",
    "journal_link": "https://www.strand.kommune.no/tjenester/politikk-innsyn-og-medvirkning/postliste-dokumenter-og-vedtak/sok-i-post-dokumenter-og-saker/#/details/a-6965376f__8677__47ea__a757__23e14c179149-2006000997!svVMxN/d-6965376f__8677__47ea__a757__23e14c179149-2006009360!jjHB6V",
    "filer": [
      {
        "tekst": "22/6 SØKNAD OM FRÅDELING AV HYTTETOMT OG NAUSTTOMT PÅ GNR 22 BNR 6 (pdf, 118KB)",
        "url": "https://www.strand.kommune.no/api/presentation/v2/nye-innsyn/filer/v-6965376f__8677__47ea__a757__23e14c179149-10405_1_A!d-2006009360!dxzj2G?pid=29"
      }
    ],
    "status": "Publisert"
  },
  {
    "tittel": "66/36 TILLATELSE TIL TILTAK - FRITIDSBOLIG3",
    "dato": "02.06.2006",
    "dato_iso": "2006-06-02",
    "dokumentID": "2006/9335",
    "dokumenttype": "Saksframlegg",
    "avsender_mottaker": "",
    "journal_link": "https://www.strand.kommune.no/tjenester/politikk-innsyn-og-medvirkning/postliste-dokumenter-og-vedtak/sok-i-post-dokumenter-og-saker/#/details/a-6965376f__8677__47ea__a757__23e14c179149-2006001546!damjm0/d-6965376f__8677__47ea__a757__23e14c179149-2006009335!9w8FBz",
    "filer": [
      {
        "tekst": "66/36 TILLATELSE TIL TILTAK - FRITIDSBOLIG3 (pdf, 292KB)",
        "url": "https://www.strand.kommune.no/api/presentation/v2/nye-innsyn/filer/v-6965376f__8677__47ea__a757__23e14c179149-10388_1_A!d-2006009335!GKbIYQ?pid=29"
      }
    ],
    "status": "Publisert"
  },
  {
    "tittel": "63/9/3 TILLATELSE TIL TILTAK - FRITIDSBOLIG",
    "dato": "01.06.2006",
    "dato_iso": "2006-06-01",
    "dokumentID": "2006/9250",
    "dokumenttype": "Saksframlegg",
    "avsender_mottaker": "",
    "journal_link": "https://www.strand.kommune.no/tjenester/politikk-innsyn-og-medvirkning/postliste-dokumenter-og-vedtak/sok-i-post-dokumenter-og-saker/#/details/a-6965376f__8677__47ea__a757__23e14c179149-2006001374!Ad9gkP/d-6965376f__8677__47ea__a757__23e14c179149-2006009250!CnCdcs",
    "filer": [
      {
        "tekst": "63/9/3 TILLATELSE TIL TILTAK - FRITIDSBOLIG (pdf, 355KB)",
        "url": "https://www.strand.kommune.no/api/presentation/v2/nye-innsyn/filer/v-6965376f__8677__47ea__a757__23e14c179149-10276_1_A!d-2006009250!feB44z?pid=29"
      }
    ],
    "status": "Publisert"
  },
  {
    "tittel": "44/638 TILLATELSE TIL TILTAK - 3 STK. VERTIKALDELTE TOMANNSBOLIGER M/GARASJEPLASS",
    "dato": "01.06.2006",
    "dato_iso": "2006-06-01",
    "dokumentID": "2006/9266",
    "dokumenttype": "Saksframlegg",
    "avsender_mottaker": "",
    "journal_link": "https://www.strand.kommune.no/tjenester/politikk-innsyn-og-medvirkning/postliste-dokumenter-og-vedtak/sok-i-post-dokumenter-og-saker/#/details/a-6965376f__8677__47ea__a757__23e14c179149-2006001194!nZTmXS/d-6965376f__8677__47ea__a757__23e14c179149-2006009266!D6Wq70",
    "filer": [
      {
        "tekst": "44/638 TILLATELSE TIL TILTAK - 3 STK. VERTIKALDELTE TOMANNSBOLIGER M/GARASJEPLASS (pdf, 104KB)",
        "url": "https://www.strand.kommune.no/api/presentation/v2/nye-innsyn/filer/v-6965376f__8677__47ea__a757__23e14c179149-10283_1_A!d-2006009266!98Eo3D?pid=29"
      }
    ],
    "status": "Publisert"
  },
  {
    "tittel": "ANDOR FJELDE AS, SØKNAD OM RAMMETILLATELSE OG DISPENSASJON FRA GJELDENDE PLANER, GN 49/383 M.FL.",
    "dato": "01.06.2006",
    "dato_iso": "2006-06-01",
    "dokumentID": "2006/9071",
    "dokumenttype": "Saksframlegg",
    "avsender_mottaker": "",
    "journal_link": "https://www.strand.kommune.no/tjenester/politikk-innsyn-og-medvirkning/postliste-dokumenter-og-vedtak/sok-i-post-dokumenter-og-saker/#/details/a-6965376f__8677__47ea__a757__23e14c179149-2006001685!yr7BZZ/d-6965376f__8677__47ea__a757__23e14c179149-2006009071!8oqlxp",
    "filer": [
      {
        "tekst": "ANDOR FJELDE AS, SØKNAD OM RAMMETILLATELSE OG DISPENSASJON FRA GJELDENDE PLANER, GN 49/383 M.FL. (pdf, 215KB)",
        "url": "https://www.strand.kommune.no/api/presentation/v2/nye-innsyn/filer/v-6965376f__8677__47ea__a757__23e14c179149-10094_1_A!d-2006009071!7qAJQC?pid=29"
      },
      {
        "tekst": "SØKNAD MED TEGNINGER OG ILLUSTRASJONER (pdf, 5,4MB)",
        "url": "https://www.strand.kommune.no/api/presentation/v2/nye-innsyn/filer/v-6965376f__8677__47ea__a757__23e14c179149-10338_1_A!d-2006009071!Np7ovG?pid=29"
      }
    ],
    "status": "Publisert"
  },
  {
    "tittel": "44/635 TILLATELSE TIL TILTAK - HUS OG GARASJE",
    "dato": "01.06.2006",
    "dato_iso": "2006-06-01",
    "dokumentID": "2006/9294",
    "dokumenttype": "Saksframlegg",
    "avsender_mottaker": "",
    "journal_link": "https://www.strand.kommune.no/tjenester/politikk-innsyn-og-medvirkning/postliste-dokumenter-og-vedtak/sok-i-post-dokumenter-og-saker/#/details/a-6965376f__8677__47ea__a757__23e14c179149-2006001614!vocyTN/d-6965376f__8677__47ea__a757__23e14c179149-2006009294!zyD43A",
    "filer": [
      {
        "tekst": "44/635 TILLATELSE TIL TILTAK - HUS OG GARASJE (pdf, 298KB)",
        "url": "https://www.strand.kommune.no/api/presentation/v2/nye-innsyn/filer/v-6965376f__8677__47ea__a757__23e14c179149-10339_2_A!d-2006009294!bgA2wM?pid=29"
      }
    ],
    "status": "Publisert"
  },
  {
    "tittel": "16/279 TILLATELSE TIL TILTAK - NYBYGG BOLIG",
    "dato": "31.05.2006",
    "dato_iso": "2006-05-31",
    "dokumentID": "2006/9135",
    "dokumenttype": "Saksframlegg",
    "avsender_mottaker": "",
    "journal_link": "https://www.strand.kommune.no/tjenester/politikk-innsyn-og-medvirkning/postliste-dokumenter-og-vedtak/sok-i-post-dokumenter-og-saker/#/details/a-6965376f__8677__47ea__a757__23e14c179149-2006001473!A6N5CQ/d-6965376f__8677__47ea__a757__23e14c179149-2006009135!1kjfAH",
    "filer": [
      {
        "tekst": "16/279 TILLATELSE TIL TILTAK - NYBYGG BOLIG (pdf, 295KB)",
        "url": "https://www.strand.kommune.no/api/presentation/v2/nye-innsyn/filer/v-6965376f__8677__47ea__a757__23e14c179149-10166_1_A!d-2006009135!4VzuPZ?pid=29"
      }
    ],
    "status": "Publisert"
  },
  {
    "tittel": "53/4 IGANGSSETTING RESTEN AV TILTAKET - REKKEHUS FELT B1",
    "dato": "31.05.2006",
    "dato_iso": "2006-05-31",
    "dokumentID": "2006/9211",
    "dokumenttype": "Saksframlegg",
    "avsender_mottaker": "",
    "journal_link": "https://www.strand.kommune.no/tjenester/politikk-innsyn-og-medvirkning/postliste-dokumenter-og-vedtak/sok-i-post-dokumenter-og-saker/#/details/a-6965376f__8677__47ea__a757__23e14c179149-2006000047!LggiRI/d-6965376f__8677__47ea__a757__23e14c179149-2006009211!GMtAGf",
    "filer": [
      {
        "tekst": "53/4 IGANGSSETTING RESTEN AV TILTAKET - REKKEHUS FELT B1 (pdf, 294KB)",
        "url": "https://www.strand.kommune.no/api/presentation/v2/nye-innsyn/filer/v-6965376f__8677__47ea__a757__23e14c179149-10227_1_A!d-2006009211!tfzvw7?pid=29"
      }
    ],
    "status": "Publisert"
  },
  {
    "tittel": "49/521 TILLATELSE TIL TILTAK - BRUKSENDRING OG TAKOPPLETT",
    "dato": "31.05.2006",
    "dato_iso": "2006-05-31",
    "dokumentID": "2006/9161",
    "dokumenttype": "Saksframlegg",
    "avsender_mottaker": "",
    "journal_link": "https://www.strand.kommune.no/tjenester/politikk-innsyn-og-medvirkning/postliste-dokumenter-og-vedtak/sok-i-post-dokumenter-og-saker/#/details/a-6965376f__8677__47ea__a757__23e14c179149-2006000580!TRMpYy/d-6965376f__8677__47ea__a757__23e14c179149-2006009161!LUpbB5",
    "filer": [
      {
        "tekst": "49/521 TILLATELSE TIL TILTAK - BRUKSENDRING OG TAKOPPLETT (pdf, 295KB)",
        "url": "https://www.strand.kommune.no/api/presentation/v2/nye-innsyn/filer/v-6965376f__8677__47ea__a757__23e14c179149-10185_1_A!d-2006009161!MVEJwD?pid=29"
      }
    ],
    "status": "Publisert"
  },
  {
    "tittel": "FVA 07.06.2006",
    "dato": "30.05.2006",
    "dato_iso": "2006-05-30",
    "dokumentID": "2006/9027",
    "dokumenttype": "Sakskart",
    "avsender_mottaker": "",
    "journal_link": "https://www.strand.kommune.no/tjenester/politikk-innsyn-og-medvirkning/postliste-dokumenter-og-vedtak/sok-i-post-dokumenter-og-saker/#/details/a-6965376f__8677__47ea__a757__23e14c179149-2006000401!tZFpMU/d-6965376f__8677__47ea__a757__23e14c179149-2006009027!9StoUi",
    "filer": [
      {
        "tekst": "FVA 07.06.2006 (pdf, 1,2MB)",
        "url": "https://www.strand.kommune.no/api/presentation/v2/nye-innsyn/filer/v-6965376f__8677__47ea__a757__23e14c179149-10038_1_A!d-2006009027!GV8mH5?pid=29"
      }
    ],
    "status": "Publisert"
  },
  {
    "tittel": "49/223 49/429 RAMMETILLATELSE TIL TILTAK - PÅBYGG BOLIG OG NY GARASJEPLASSERING",
    "dato": "30.05.2006",
    "dato_iso": "2006-05-30",
    "dokumentID": "2006/9120",
    "dokumenttype": "Saksframlegg",
    "avsender_mottaker": "",
    "journal_link": "https://www.strand.kommune.no/tjenester/politikk-innsyn-og-medvirkning/postliste-dokumenter-og-vedtak/sok-i-post-dokumenter-og-saker/#/details/a-6965376f__8677__47ea__a757__23e14c179149-2006001454!qBv8jL/d-6965376f__8677__47ea__a757__23e14c179149-2006009120!Wbzokm",
    "filer": [
      {
        "tekst": "49/223 49/429 RAMMETILLATELSE TIL TILTAK - PÅBYGG BOLIG OG NY GARASJEPLASSERING (pdf, 294KB)",
        "url": "https://www.strand.kommune.no/api/presentation/v2/nye-innsyn/filer/v-6965376f__8677__47ea__a757__23e14c179149-10151_1_A!d-2006009120!rIxTlk?pid=29"
      }
    ],
    "status": "Publisert"
  },
  {
    "tittel": "44/597 TILLATELSE TIL TILTAK - BOLIG",
    "dato": "30.05.2006",
    "dato_iso": "2006-05-30",
    "dokumentID": "2006/9121",
    "dokumenttype": "Saksframlegg",
    "avsender_mottaker": "",
    "journal_link": "https://www.strand.kommune.no/tjenester/politikk-innsyn-og-medvirkning/postliste-dokumenter-og-vedtak/sok-i-post-dokumenter-og-saker/#/details/a-6965376f__8677__47ea__a757__23e14c179149-2006001423!WXFfRm/d-6965376f__8677__47ea__a757__23e14c179149-2006009121!DPKQaM",
    "filer": [
      {
        "tekst": "44/597 TILLATELSE TIL TILTAK - BOLIG (pdf, 295KB)",
        "url": "https://www.strand.kommune.no/api/presentation/v2/nye-innsyn/filer/v-6965376f__8677__47ea__a757__23e14c179149-10152_1_A!d-2006009121!A6tfDk?pid=29"
      }
    ],
    "status": "Publisert"
  },
  {
    "tittel": "DELING AV GRUNNEIENDOM, GN 48/218",
    "dato": "29.05.2006",
    "dato_iso": "2006-05-29",
    "dokumentID": "2006/8933",
    "dokumenttype": "Saksframlegg",
    "avsender_mottaker": "",
    "journal_link": "https://www.strand.kommune.no/tjenester/politikk-innsyn-og-medvirkning/postliste-dokumenter-og-vedtak/sok-i-post-dokumenter-og-saker/#/details/a-6965376f__8677__47ea__a757__23e14c179149-2006001564!j9IDIK/d-6965376f__8677__47ea__a757__23e14c179149-2006008933!Ls2Fxz",
    "filer": [
      {
        "tekst": "DELING AV GRUNNEIENDOM, GN 48/218 (pdf, 92KB)",
        "url": "https://www.strand.kommune.no/api/presentation/v2/nye-innsyn/filer/v-6965376f__8677__47ea__a757__23e14c179149-9952_1_A!d-2006008933!Q5cIQ7?pid=29"
      }
    ],
    "status": "Publisert"
  },
  {
    "tittel": "49/28 TILLATELSE TIL TILTAK - RIVING AV MINDRE BYGNINGER",
    "dato": "29.05.2006",
    "dato_iso": "2006-05-29",
    "dokumentID": "2006/8940",
    "dokumenttype": "Saksframlegg",
    "avsender_mottaker": "",
    "journal_link": "https://www.strand.kommune.no/tjenester/politikk-innsyn-og-medvirkning/postliste-dokumenter-og-vedtak/sok-i-post-dokumenter-og-saker/#/details/a-6965376f__8677__47ea__a757__23e14c179149-2006001372!15Fnp7/d-6965376f__8677__47ea__a757__23e14c179149-2006008940!INGtrK",
    "filer": [
      {
        "tekst": "49/28 TILLATELSE TIL TILTAK - RIVING AV MINDRE BYGNINGER (pdf, 98KB)",
        "url": "https://www.strand.kommune.no/api/presentation/v2/nye-innsyn/filer/v-6965376f__8677__47ea__a757__23e14c179149-9956_1_A!d-2006008940!gQ1PCe?pid=29"
      }
    ],
    "status": "Publisert"
  },
  {
    "tittel": "7/10 SØKNAD OM FRÅDELING AV GARDSHUS",
    "dato": "29.05.2006",
    "dato_iso": "2006-05-29",
    "dokumentID": "2006/7147",
    "dokumenttype": "Saksframlegg",
    "avsender_mottaker": "",
    "journal_link": "https://www.strand.kommune.no/tjenester/politikk-innsyn-og-medvirkning/postliste-dokumenter-og-vedtak/sok-i-post-dokumenter-og-saker/#/details/a-6965376f__8677__47ea__a757__23e14c179149-2006001402!ARJZD7/d-6965376f__8677__47ea__a757__23e14c179149-2006007147!Pp8Ldu",
    "filer": [
      {
        "tekst": "7/10 SØKNAD OM FRÅDELING AV GARDSHUS (pdf, 149KB)",
        "url": "https://www.strand.kommune.no/api/presentation/v2/nye-innsyn/filer/v-6965376f__8677__47ea__a757__23e14c179149-7960_1_A!d-2006007147!KZ0TZV?pid=29"
      },
      {
        "tekst": "KART VEDK. SØKNAD OM FRÅDELING AV GARDSHUS PÅ GN 7/10 (pdf, 80KB)",
        "url": "https://www.strand.kommune.no/api/presentation/v2/nye-innsyn/filer/v-6965376f__8677__47ea__a757__23e14c179149-9416_1_A!d-2006007147!2LeGUB?pid=29"
      }
    ],
    "status": "Publisert"
  },
  {
    "tittel": "9/4 KLAGE PÅ SØKNAD OM FRITAK FRÅ BU OG DRIVEPLIKT",
    "dato": "29.05.2006",
    "dato_iso": "2006-05-29",
    "dokumentID": "2006/7989",
    "dokumenttype": "Saksframlegg",
    "avsender_mottaker": "",
    "journal_link": "https://www.strand.kommune.no/tjenester/politikk-innsyn-og-medvirkning/postliste-dokumenter-og-vedtak/sok-i-post-dokumenter-og-saker/#/details/a-6965376f__8677__47ea__a757__23e14c179149-2006000274!1s7S7s/d-6965376f__8677__47ea__a757__23e14c179149-2006007989!fBzkJ2",
    "filer": [
      {
        "tekst": "9/4 KLAGE PÅ SØKNAD OM FRITAK FRÅ BU OG DRIVEPLIKT (pdf, 389KB)",
        "url": "https://www.strand.kommune.no/api/presentation/v2/nye-innsyn/filer/v-6965376f__8677__47ea__a757__23e14c179149-8844_1_A!d-2006007989!WoEzKq?pid=29"
      }
    ],
    "status": "Publisert"
  },
  {
    "tittel": "45/148 TILLATELSE TIL TILTAK - IGANGSETTINGSTILLATELSE FOR DELER AV TILTAKET - UTSTIKKING, GRUNN OG GRAVEARBEIDER - FJELLSVEGEN 73",
    "dato": "29.05.2006",
    "dato_iso": "2006-05-29",
    "dokumentID": "2006/8951",
    "dokumenttype": "Saksframlegg",
    "avsender_mottaker": "",
    "journal_link": "https://www.strand.kommune.no/tjenester/politikk-innsyn-og-medvirkning/postliste-dokumenter-og-vedtak/sok-i-post-dokumenter-og-saker/#/details/a-6965376f__8677__47ea__a757__23e14c179149-2006001078!LBMXKk/d-6965376f__8677__47ea__a757__23e14c179149-2006008951!tiMSPS",
    "filer": [
      {
        "tekst": "45/148 TILLATELSE TIL TILTAK - IGANGSETTINGSTILLATELSE FOR DELER AV TILTAKET - UTSTIKKING, GRUNN OG GRAVEARBEIDER - FJELLSVEGEN 73 (pdf, 101KB)",
        "url": "https://www.strand.kommune.no/api/presentation/v2/nye-innsyn/filer/v-6965376f__8677__47ea__a757__23e14c179149-9968_1_A!d-2006008951!6kJLfv?pid=29"
      }
    ],
    "status": "Publisert"
  },
  {
    "tittel": "8/14,36,37,47 SØKNAD OM DISPENSASJON FRA FRA 2-DEKAR BESTEMMELSEN, § 5 I KOMMUNEPLANEN, FOR FRADELING AV HYTTETOMT PÅ GNR. 8 BNR. 47, 37 OG 36 - HØYLAND",
    "dato": "29.05.2006",
    "dato_iso": "2006-05-29",
    "dokumentID": "2006/8874",
    "dokumenttype": "Saksframlegg",
    "avsender_mottaker": "",
    "journal_link": "https://www.strand.kommune.no/tjenester/politikk-innsyn-og-medvirkning/postliste-dokumenter-og-vedtak/sok-i-post-dokumenter-og-saker/#/details/a-6965376f__8677__47ea__a757__23e14c179149-2006001710!di0YBS/d-6965376f__8677__47ea__a757__23e14c179149-2006008874!GJqOSw",
    "filer": [
      {
        "tekst": "8/14,36,37,47 SØKNAD OM DISPENSASJON KOMMUNEPLANEN FRA 2-DEKAR BESTEMMELSEN, § 5 I KOMMUNEPLANEN, FOR FRADELING AV HYTTETOMT PÅ GNR. 8 BNR. 47, 37 OG 36 - HØYLAND (pdf, 154KB)",
        "url": "https://www.strand.kommune.no/api/presentation/v2/nye-innsyn/filer/v-6965376f__8677__47ea__a757__23e14c179149-9894_1_A!d-2006008874!lEjyL3?pid=29"
      },
      {
        "tekst": "Oversiktskart.pdf (pdf, 161KB)",
        "url": "https://www.strand.kommune.no/api/presentation/v2/nye-innsyn/filer/v-6965376f__8677__47ea__a757__23e14c179149-9923_1_A!d-2006008874!nkqi7r?pid=29"
      },
      {
        "tekst": "Søknad om fradeling (Dispensasjon).pdf (pdf, 89KB)",
        "url": "https://www.strand.kommune.no/api/presentation/v2/nye-innsyn/filer/v-6965376f__8677__47ea__a757__23e14c179149-9924_1_A!d-2006008874!8AZUOo?pid=29"
      },
      {
        "tekst": "Situasjonskart.pdf (pdf, 88KB)",
        "url": "https://www.strand.kommune.no/api/presentation/v2/nye-innsyn/filer/v-6965376f__8677__47ea__a757__23e14c179149-9925_1_A!d-2006008874!0oop5n?pid=29"
      },
      {
        "tekst": "Svarbrev vedr. søknad om fradeling.pdf (pdf, 41KB)",
        "url": "https://www.strand.kommune.no/api/presentation/v2/nye-innsyn/filer/v-6965376f__8677__47ea__a757__23e14c179149-9926_1_A!d-2006008874!b2RWkv?pid=29"
      },
      {
        "tekst": "Utsnitt av kommuneplanen.pdf (pdf, 685KB)",
        "url": "https://www.strand.kommune.no/api/presentation/v2/nye-innsyn/filer/v-6965376f__8677__47ea__a757__23e14c179149-9927_1_A!d-2006008874!8Zkj5O?pid=29"
      },
      {
        "tekst": "§ 5 i kommuneplanen for Strand.pdf (pdf, 54KB)",
        "url": "https://www.strand.kommune.no/api/presentation/v2/nye-innsyn/filer/v-6965376f__8677__47ea__a757__23e14c179149-9928_1_A!d-2006008874!Sc1Pyt?pid=29"
      }
    ],
    "status": "Publisert"
  },
  {
    "tittel": "FOR 07.06.2006",
    "dato": "29.05.2006",
    "dato_iso": "2006-05-29",
    "dokumentID": "2006/8948",
    "dokumenttype": "Sakskart",
    "avsender_mottaker": "",
    "journal_link": "https://www.strand.kommune.no/tjenester/politikk-innsyn-og-medvirkning/postliste-dokumenter-og-vedtak/sok-i-post-dokumenter-og-saker/#/details/a-6965376f__8677__47ea__a757__23e14c179149-2006000384!BKP5U0/d-6965376f__8677__47ea__a757__23e14c179149-2006008948!MALg7L",
    "filer": [
      {
        "tekst": "FOR 07.06.2006 (pdf, 701KB)",
        "url": "https://www.strand.kommune.no/api/presentation/v2/nye-innsyn/filer/v-6965376f__8677__47ea__a757__23e14c179149-9964_1_A!d-2006008948!FA2gM1?pid=29"
      }
    ],
    "status": "Publisert"
  },
  {
    "tittel": "FOR 07.06.2006",
    "dato": "29.05.2006",
    "dato_iso": "2006-05-29",
    "dokumentID": "2006/8957",
    "dokumenttype": "Møteprotokoll",
    "avsender_mottaker": "",
    "journal_link": "https://www.strand.kommune.no/tjenester/politikk-innsyn-og-medvirkning/postliste-dokumenter-og-vedtak/sok-i-post-dokumenter-og-saker/#/details/a-6965376f__8677__47ea__a757__23e14c179149-2006000384!BKP5U0/d-6965376f__8677__47ea__a757__23e14c179149-2006008957!tSKmHB",
    "filer": [
      {
        "tekst": "FOR 07.06.2006 (pdf, 459KB)",
        "url": "https://www.strand.kommune.no/api/presentation/v2/nye-innsyn/filer/v-6965376f__8677__47ea__a757__23e14c179149-9975_1_A!d-2006008957!q2ZatK?pid=29"
      }
    ],
    "status": "Publisert"
  },
  {
    "tittel": "DELING AV GRUNNEIENDOM, GN 53/10",
    "dato": "29.05.2006",
    "dato_iso": "2006-05-29",
    "dokumentID": "2006/8943",
    "dokumenttype": "Saksframlegg",
    "avsender_mottaker": "",
    "journal_link": "https://www.strand.kommune.no/tjenester/politikk-innsyn-og-medvirkning/postliste-dokumenter-og-vedtak/sok-i-post-dokumenter-og-saker/#/details/a-6965376f__8677__47ea__a757__23e14c179149-2006001618!iLoWpb/d-6965376f__8677__47ea__a757__23e14c179149-2006008943!sx4QgB",
    "filer": [
      {
        "tekst": "DELING AV GRUNNEIENDOM, GN 53710 (pdf, 95KB)",
        "url": "https://www.strand.kommune.no/api/presentation/v2/nye-innsyn/filer/v-6965376f__8677__47ea__a757__23e14c179149-9958_1_A!d-2006008943!7oqE8p?pid=29"
      }
    ],
    "status": "Publisert"
  },
  {
    "tittel": "MINDRE VESENTLIG REGULERINGSENDRING, REGULERT HYTTEOMRÅDE PÅ GNR. 63/21, ØKSNABERG PÅ IDSE",
    "dato": "26.05.2006",
    "dato_iso": "2006-05-26",
    "dokumentID": "2006/8359",
    "dokumenttype": "Saksframlegg",
    "avsender_mottaker": "",
    "journal_link": "https://www.strand.kommune.no/tjenester/politikk-innsyn-og-medvirkning/postliste-dokumenter-og-vedtak/sok-i-post-dokumenter-og-saker/#/details/a-6965376f__8677__47ea__a757__23e14c179149-2006001052!f1a62S/d-6965376f__8677__47ea__a757__23e14c179149-2006008359!PN3iZb",
    "filer": [
      {
        "tekst": "REGULERINGSPLAN FOR HYTTER, ØKSNABERG, MINDRE VESENTLIG REGULERINGSENDRING (pdf, 288KB)",
        "url": "https://www.strand.kommune.no/api/presentation/v2/nye-innsyn/filer/v-6965376f__8677__47ea__a757__23e14c179149-9253_1_A!d-2006008359!wWyoJP?pid=29"
      },
      {
        "tekst": "oversiktskart.jpg (pdf, 198KB)",
        "url": "https://www.strand.kommune.no/api/presentation/v2/nye-innsyn/filer/v-6965376f__8677__47ea__a757__23e14c179149-9731_1_P!d-2006008359!UU9lmo?pid=29"
      },
      {
        "tekst": "Gjeldende reguleringsbestemmelser.doc (pdf, 499KB)",
        "url": "https://www.strand.kommune.no/api/presentation/v2/nye-innsyn/filer/v-6965376f__8677__47ea__a757__23e14c179149-9763_1_A!d-2006008359!wXgOvg?pid=29"
      },
      {
        "tekst": "gjeldende reguleringsplan.jpg (pdf, 431KB)",
        "url": "https://www.strand.kommune.no/api/presentation/v2/nye-innsyn/filer/v-6965376f__8677__47ea__a757__23e14c179149-9765_1_P!d-2006008359!MCIHnU?pid=29"
      },
      {
        "tekst": "Søknad.pdf (pdf, 77KB)",
        "url": "https://www.strand.kommune.no/api/presentation/v2/nye-innsyn/filer/v-6965376f__8677__47ea__a757__23e14c179149-9769_1_A!d-2006008359!xlutMM?pid=29"
      },
      {
        "tekst": "Reviderte reguleringsbestemmelser.pdf (pdf, 133KB)",
        "url": "https://www.strand.kommune.no/api/presentation/v2/nye-innsyn/filer/v-6965376f__8677__47ea__a757__23e14c179149-9772_1_A!d-2006008359!PbLOcs?pid=29"
      },
      {
        "tekst": "Plantegning.pdf (pdf, 768KB)",
        "url": "https://www.strand.kommune.no/api/presentation/v2/nye-innsyn/filer/v-6965376f__8677__47ea__a757__23e14c179149-9770_1_A!d-2006008359!40GVY9?pid=29"
      },
      {
        "tekst": "Plantegning detaljert.pdf (pdf, 79KB)",
        "url": "https://www.strand.kommune.no/api/presentation/v2/nye-innsyn/filer/v-6965376f__8677__47ea__a757__23e14c179149-9771_1_A!d-2006008359!wH6stO?pid=29"
      }
    ],
    "status": "Publisert"
  },
  {
    "tittel": "16/302 TILLATELSE TIL TILTAK - IGANGSETTING AV PELE OG GRAVEARBEIDER",
    "dato": "26.05.2006",
    "dato_iso": "2006-05-26",
    "dokumentID": "2006/8903",
    "dokumenttype": "Saksframlegg",
    "avsender_mottaker": "",
    "journal_link": "https://www.strand.kommune.no/tjenester/politikk-innsyn-og-medvirkning/postliste-dokumenter-og-vedtak/sok-i-post-dokumenter-og-saker/#/details/a-6965376f__8677__47ea__a757__23e14c179149-2006001504!oBz0QU/d-6965376f__8677__47ea__a757__23e14c179149-2006008903!uRx6Nv",
    "filer": [
      {
        "tekst": "16/302 TILLATELSE TIL TILTAK - IGANGSETTING AV PELE OG GRAVEARBEIDER (pdf, 300KB)",
        "url": "https://www.strand.kommune.no/api/presentation/v2/nye-innsyn/filer/v-6965376f__8677__47ea__a757__23e14c179149-9907_1_A!d-2006008903!9DEgQe?pid=29"
      }
    ],
    "status": "Publisert"
  },
  {
    "tittel": "SØKNAD OM DISPENSASJON FRA KOMMUNEPLANEN - NYBYGG PÅ BOLIGEIENDOM I LNF-OMRÅDE, GN 16/160, UGELI",
    "dato": "26.05.2006",
    "dato_iso": "2006-05-26",
    "dokumentID": "2006/8554",
    "dokumenttype": "Saksframlegg",
    "avsender_mottaker": "",
    "journal_link": "https://www.strand.kommune.no/tjenester/politikk-innsyn-og-medvirkning/postliste-dokumenter-og-vedtak/sok-i-post-dokumenter-og-saker/#/details/a-6965376f__8677__47ea__a757__23e14c179149-2006001472!enpPLU/d-6965376f__8677__47ea__a757__23e14c179149-2006008554!4zgmCk",
    "filer": [
      {
        "tekst": "SØKNAD OM DISPENSASJON FRA KOMMUNEPLANEN - NYBYGG PÅ BOLIGEIENDOM I LNF-OMRÅDE, GN 16/160, UGELI (pdf, 107KB)",
        "url": "https://www.strand.kommune.no/api/presentation/v2/nye-innsyn/filer/v-6965376f__8677__47ea__a757__23e14c179149-9458_1_A!d-2006008554!qspzMM?pid=29"
      },
      {
        "tekst": "SØKNAD MED SITUASJONSKART OG FASADER (pdf, 197KB)",
        "url": "https://www.strand.kommune.no/api/presentation/v2/nye-innsyn/filer/v-6965376f__8677__47ea__a757__23e14c179149-9482_1_A!d-2006008554!3HQEt6?pid=29"
      },
      {
        "tekst": "Nabouttalelse.pdf (pdf, 81KB)",
        "url": "https://www.strand.kommune.no/api/presentation/v2/nye-innsyn/filer/v-6965376f__8677__47ea__a757__23e14c179149-9884_1_A!d-2006008554!jIA7Nx?pid=29"
      },
      {
        "tekst": "oversiktskart - kommuneplan.jpg (pdf, 825KB)",
        "url": "https://www.strand.kommune.no/api/presentation/v2/nye-innsyn/filer/v-6965376f__8677__47ea__a757__23e14c179149-9483_1_P!d-2006008554!BCzdFE?pid=29"
      }
    ],
    "status": "Publisert"
  },
  {
    "tittel": "SØKNAD OM DISPENSASJON FRA KOMMUNEPLANEN, UTVIDELSE AV PARKERING/GARASJE I LNF-OMRÅDE, KVEDNANESET",
    "dato": "26.05.2006",
    "dato_iso": "2006-05-26",
    "dokumentID": "2006/8565",
    "dokumenttype": "Saksframlegg",
    "avsender_mottaker": "",
    "journal_link": "https://www.strand.kommune.no/tjenester/politikk-innsyn-og-medvirkning/postliste-dokumenter-og-vedtak/sok-i-post-dokumenter-og-saker/#/details/a-6965376f__8677__47ea__a757__23e14c179149-2006001323!gKRymV/d-6965376f__8677__47ea__a757__23e14c179149-2006008565!j4Rh3K",
    "filer": [
      {
        "tekst": "SØKNAD OM DISPENSASJON FRA KOMMUNEPLANEN, UTVIDELSE AV PARKERING/GARASJE I LNF-OMRÅDE, KVEDNANESET (pdf, 104KB)",
        "url": "https://www.strand.kommune.no/api/presentation/v2/nye-innsyn/filer/v-6965376f__8677__47ea__a757__23e14c179149-9484_1_A!d-2006008565!SRM8wQ?pid=29"
      },
      {
        "tekst": "SØKNAD MED ILLUSTRASJON (pdf, 739KB)",
        "url": "https://www.strand.kommune.no/api/presentation/v2/nye-innsyn/filer/v-6965376f__8677__47ea__a757__23e14c179149-9486_1_A!d-2006008565!qBfRNe?pid=29"
      },
      {
        "tekst": "oversiktskart, kommuneplan.jpg (pdf, 610KB)",
        "url": "https://www.strand.kommune.no/api/presentation/v2/nye-innsyn/filer/v-6965376f__8677__47ea__a757__23e14c179149-9485_1_P!d-2006008565!ptPWxU?pid=29"
      }
    ],
    "status": "Publisert"
  },
  {
    "tittel": "44/497 SØKNAD OM DISPENSASJON FRA REGULERT BYGGEGRENSE OG PARKBELTE - TILBYGG VERKSTEDHALL - JØRPELAND SERVICESENTER (ESSO)",
    "dato": "26.05.2006",
    "dato_iso": "2006-05-26",
    "dokumentID": "2006/8819",
    "dokumenttype": "Saksframlegg",
    "avsender_mottaker": "",
    "journal_link": "https://www.strand.kommune.no/tjenester/politikk-innsyn-og-medvirkning/postliste-dokumenter-og-vedtak/sok-i-post-dokumenter-og-saker/#/details/a-6965376f__8677__47ea__a757__23e14c179149-2006000444!nF7EmQ/d-6965376f__8677__47ea__a757__23e14c179149-2006008819!tOdwkc",
    "filer": [
      {
        "tekst": "44/497 SØKNAD OM DISPENSASJON FRA REGULERT BYGGEGRENSE OG PARKBELTE - TILBYGG VERKSTEDHALL - JØRPELAND SERVICESENTER (ESSO) (pdf, 472KB)",
        "url": "https://www.strand.kommune.no/api/presentation/v2/nye-innsyn/filer/v-6965376f__8677__47ea__a757__23e14c179149-9776_1_A!d-2006008819!lE3z38?pid=29"
      },
      {
        "tekst": "OVERSIKTSKART (pdf, 338KB)",
        "url": "https://www.strand.kommune.no/api/presentation/v2/nye-innsyn/filer/v-6965376f__8677__47ea__a757__23e14c179149-9796_1_A!d-2006008819!6DDFH2?pid=29"
      },
      {
        "tekst": "SØKNAD OM DISPENSASJON (pdf, 68KB)",
        "url": "https://www.strand.kommune.no/api/presentation/v2/nye-innsyn/filer/v-6965376f__8677__47ea__a757__23e14c179149-9797_1_A!d-2006008819!QPOkKV?pid=29"
      },
      {
        "tekst": "DISPENSASJON_2 (pdf, 49KB)",
        "url": "https://www.strand.kommune.no/api/presentation/v2/nye-innsyn/filer/v-6965376f__8677__47ea__a757__23e14c179149-9835_1_A!d-2006008819!Vn4hnM?pid=29"
      },
      {
        "tekst": "REDGJØRELSE AV PROSJEKTET (pdf, 73KB)",
        "url": "https://www.strand.kommune.no/api/presentation/v2/nye-innsyn/filer/v-6965376f__8677__47ea__a757__23e14c179149-9798_1_A!d-2006008819!5IbPbJ?pid=29"
      },
      {
        "tekst": "SITUASJONSKART (pdf, 460KB)",
        "url": "https://www.strand.kommune.no/api/presentation/v2/nye-innsyn/filer/v-6965376f__8677__47ea__a757__23e14c179149-9802_1_A!d-2006008819!vji7ox?pid=29"
      },
      {
        "tekst": "FASADETEGNINGER FOR OMSØKT TILBYGG (pdf, 119KB)",
        "url": "https://www.strand.kommune.no/api/presentation/v2/nye-innsyn/filer/v-6965376f__8677__47ea__a757__23e14c179149-9804_1_A!d-2006008819!YsMmXr?pid=29"
      },
      {
        "tekst": "REGULERINGSPLAN (pdf, 143KB)",
        "url": "https://www.strand.kommune.no/api/presentation/v2/nye-innsyn/filer/v-6965376f__8677__47ea__a757__23e14c179149-9806_1_A!d-2006008819!DceGdj?pid=29"
      },
      {
        "tekst": "BESTEMMELSER TIL REGULERINGSPLAN (pdf, 29KB)",
        "url": "https://www.strand.kommune.no/api/presentation/v2/nye-innsyn/filer/v-6965376f__8677__47ea__a757__23e14c179149-9807_1_A!d-2006008819!b4O48T?pid=29"
      },
      {
        "tekst": "UTTALE FRA STATENS VEGVESEN (pdf, 54KB)",
        "url": "https://www.strand.kommune.no/api/presentation/v2/nye-innsyn/filer/v-6965376f__8677__47ea__a757__23e14c179149-9809_1_A!d-2006008819!ACmago?pid=29"
      },
      {
        "tekst": "NABOPROTEST 1 (pdf, 38KB)",
        "url": "https://www.strand.kommune.no/api/presentation/v2/nye-innsyn/filer/v-6965376f__8677__47ea__a757__23e14c179149-9810_1_A!d-2006008819!jJu77Q?pid=29"
      },
      {
        "tekst": "NABOPROTEST 2 (pdf, 70KB)",
        "url": "https://www.strand.kommune.no/api/presentation/v2/nye-innsyn/filer/v-6965376f__8677__47ea__a757__23e14c179149-9812_1_A!d-2006008819!5GYr6z?pid=29"
      },
      {
        "tekst": "OVERSIKT OVER NABOPROTESTER (pdf, 341KB)",
        "url": "https://www.strand.kommune.no/api/presentation/v2/nye-innsyn/filer/v-6965376f__8677__47ea__a757__23e14c179149-9813_1_A!d-2006008819!Q2f15k?pid=29"
      }
    ],
    "status": "Publisert"
  },
  {
    "tittel": "REGULERINGSPLAN FOR FØRLAND BARNEHAGE - 2. GANGS BEHANDLING",
    "dato": "26.05.2006",
    "dato_iso": "2006-05-26",
    "dokumentID": "2006/8591",
    "dokumenttype": "Saksframlegg",
    "avsender_mottaker": "",
    "journal_link": "https://www.strand.kommune.no/tjenester/politikk-innsyn-og-medvirkning/postliste-dokumenter-og-vedtak/sok-i-post-dokumenter-og-saker/#/details/a-6965376f__8677__47ea__a757__23e14c179149-2006000138!3TxQLR/d-6965376f__8677__47ea__a757__23e14c179149-2006008591!DVBFyQ",
    "filer": [
      {
        "tekst": "REGULERINGSPLAN FOR FØRLAND BARNEHAGE - 2. GANGS BEHANDLING (pdf, 141KB)",
        "url": "https://www.strand.kommune.no/api/presentation/v2/nye-innsyn/filer/v-6965376f__8677__47ea__a757__23e14c179149-9500_1_A!d-2006008591!1qEvYE?pid=29"
      },
      {
        "tekst": "gjeldende plan.jpg (pdf, 595KB)",
        "url": "https://www.strand.kommune.no/api/presentation/v2/nye-innsyn/filer/v-6965376f__8677__47ea__a757__23e14c179149-9579_1_P!d-2006008591!TfoeKY?pid=29"
      },
      {
        "tekst": "Førland barnehage - uttalelser.pdf (pdf, 150KB)",
        "url": "https://www.strand.kommune.no/api/presentation/v2/nye-innsyn/filer/v-6965376f__8677__47ea__a757__23e14c179149-9580_1_A!d-2006008591!w7hGCA?pid=29"
      },
      {
        "tekst": "Plankart fra offentlig ettersyn.pdf (pdf, 163KB)",
        "url": "https://www.strand.kommune.no/api/presentation/v2/nye-innsyn/filer/v-6965376f__8677__47ea__a757__23e14c179149-9584_1_A!d-2006008591!BHNMwP?pid=29"
      },
      {
        "tekst": "Bestemmelser fra offentlig ettersyn.doc (pdf, 138KB)",
        "url": "https://www.strand.kommune.no/api/presentation/v2/nye-innsyn/filer/v-6965376f__8677__47ea__a757__23e14c179149-9582_1_A!d-2006008591!alhPPC?pid=29"
      },
      {
        "tekst": "oversiktskart.jpg (pdf, 1MB)",
        "url": "https://www.strand.kommune.no/api/presentation/v2/nye-innsyn/filer/v-6965376f__8677__47ea__a757__23e14c179149-9583_1_P!d-2006008591!UpkSFe?pid=29"
      }
    ],
    "status": "Publisert"
  },
  {
    "tittel": "REGULERINGSPLAN FOR GN,49/30 M.FL., OLDEIDEGÅRDEN, JØRPELAND - 2. GANGS BEHANDLING",
    "dato": "26.05.2006",
    "dato_iso": "2006-05-26",
    "dokumentID": "2006/8779",
    "dokumenttype": "Saksframlegg",
    "avsender_mottaker": "",
    "journal_link": "https://www.strand.kommune.no/tjenester/politikk-innsyn-og-medvirkning/postliste-dokumenter-og-vedtak/sok-i-post-dokumenter-og-saker/#/details/a-6965376f__8677__47ea__a757__23e14c179149-2006000804!DzlZxm/d-6965376f__8677__47ea__a757__23e14c179149-2006008779!sZNW0k",
    "filer": [
      {
        "tekst": "REGULERINGSPLAN OLDEIDEGÅRDEN, JØRPELAND (pdf, 209KB)",
        "url": "https://www.strand.kommune.no/api/presentation/v2/nye-innsyn/filer/v-6965376f__8677__47ea__a757__23e14c179149-9714_1_A!d-2006008779!7REnxY?pid=29"
      },
      {
        "tekst": "Plankart fra off. ettersyn m. rådm. endringsforslag.pdf (pdf, 194KB)",
        "url": "https://www.strand.kommune.no/api/presentation/v2/nye-innsyn/filer/v-6965376f__8677__47ea__a757__23e14c179149-9829_1_A!d-2006008779!EI08C6?pid=29"
      },
      {
        "tekst": "Bestemmelser fra off. ettersyn m. rådm. endringsforslag.doc (pdf, 179KB)",
        "url": "https://www.strand.kommune.no/api/presentation/v2/nye-innsyn/filer/v-6965376f__8677__47ea__a757__23e14c179149-9831_1_A!d-2006008779!QhmU6Z?pid=29"
      },
      {
        "tekst": "Uttalelser.pdf (pdf, 258KB)",
        "url": "https://www.strand.kommune.no/api/presentation/v2/nye-innsyn/filer/v-6965376f__8677__47ea__a757__23e14c179149-9832_1_A!d-2006008779!fiQFBZ?pid=29"
      },
      {
        "tekst": "Nåværende plan.pdf (pdf, 920KB)",
        "url": "https://www.strand.kommune.no/api/presentation/v2/nye-innsyn/filer/v-6965376f__8677__47ea__a757__23e14c179149-9833_1_A!d-2006008779!UUxJDo?pid=29"
      },
      {
        "tekst": "Illustrasjon - byggeprosjekt.pdf (pdf, 498KB)",
        "url": "https://www.strand.kommune.no/api/presentation/v2/nye-innsyn/filer/v-6965376f__8677__47ea__a757__23e14c179149-9834_1_A!d-2006008779!HwJcvN?pid=29"
      }
    ],
    "status": "Publisert"
  },
  {
    "tittel": "REGULERINGSENDRING FOR DEL AV GN 55/23, MOSLINESET - 1. GANGS BEHANDLING",
    "dato": "26.05.2006",
    "dato_iso": "2006-05-26",
    "dokumentID": "2006/8866",
    "dokumenttype": "Saksframlegg",
    "avsender_mottaker": "",
    "journal_link": "https://www.strand.kommune.no/tjenester/politikk-innsyn-og-medvirkning/postliste-dokumenter-og-vedtak/sok-i-post-dokumenter-og-saker/#/details/a-6965376f__8677__47ea__a757__23e14c179149-2006000053!ymx2zR/d-6965376f__8677__47ea__a757__23e14c179149-2006008866!w6KB0c",
    "filer": [
      {
        "tekst": "REGULERINGSENDRING FOR DEL AV GN 55/23, MOSLINESET (pdf, 139KB)",
        "url": "https://www.strand.kommune.no/api/presentation/v2/nye-innsyn/filer/v-6965376f__8677__47ea__a757__23e14c179149-9838_1_A!d-2006008866!YvM0zC?pid=29"
      },
      {
        "tekst": "Planforslag med beskrivelse, kart og bestemmelser.pdf (pdf, 303KB)",
        "url": "https://www.strand.kommune.no/api/presentation/v2/nye-innsyn/filer/v-6965376f__8677__47ea__a757__23e14c179149-9839_1_A!d-2006008866!Y3OulH?pid=29"
      },
      {
        "tekst": "Uttalelser.pdf (pdf, 268KB)",
        "url": "https://www.strand.kommune.no/api/presentation/v2/nye-innsyn/filer/v-6965376f__8677__47ea__a757__23e14c179149-9840_1_A!d-2006008866!1qgIyM?pid=29"
      },
      {
        "tekst": "Oversiktskart.pdf (pdf, 312KB)",
        "url": "https://www.strand.kommune.no/api/presentation/v2/nye-innsyn/filer/v-6965376f__8677__47ea__a757__23e14c179149-9841_1_A!d-2006008866!FQJwZB?pid=29"
      }
    ],
    "status": "Publisert"
  },
  {
    "tittel": "49/69 TILLATELSE TIL TILTAK - SERVICEBYGG",
    "dato": "26.05.2006",
    "dato_iso": "2006-05-26",
    "dokumentID": "2006/8889",
    "dokumenttype": "Saksframlegg",
    "avsender_mottaker": "",
    "journal_link": "https://www.strand.kommune.no/tjenester/politikk-innsyn-og-medvirkning/postliste-dokumenter-og-vedtak/sok-i-post-dokumenter-og-saker/#/details/a-6965376f__8677__47ea__a757__23e14c179149-2006001543!CF7eqU/d-6965376f__8677__47ea__a757__23e14c179149-2006008889!A0eMlf",
    "filer": [
      {
        "tekst": "49/69 TILLATELSE TIL TILTAK - SERVICEBYGG (pdf, 293KB)",
        "url": "https://www.strand.kommune.no/api/presentation/v2/nye-innsyn/filer/v-6965376f__8677__47ea__a757__23e14c179149-9898_1_A!d-2006008889!gPWNbz?pid=29"
      }
    ],
    "status": "Publisert"
  },
  {
    "tittel": "REGULERINGSPLAN FOR FORTAU FRA TUNGLAND - SKJERSVIK - 1. GANGS BEHANDLING",
    "dato": "26.05.2006",
    "dato_iso": "2006-05-26",
    "dokumentID": "2006/8872",
    "dokumenttype": "Saksframlegg",
    "avsender_mottaker": "",
    "journal_link": "https://www.strand.kommune.no/tjenester/politikk-innsyn-og-medvirkning/postliste-dokumenter-og-vedtak/sok-i-post-dokumenter-og-saker/#/details/a-6965376f__8677__47ea__a757__23e14c179149-2006001711!PhNHHh/d-6965376f__8677__47ea__a757__23e14c179149-2006008872!Gw9NWm",
    "filer": [
      {
        "tekst": "REGULERINGSPLAN FOR FORTAU FRA TUNGLAND - SKJÆRSVIK - 1. GANGS BEHANDLING (pdf, 136KB)",
        "url": "https://www.strand.kommune.no/api/presentation/v2/nye-innsyn/filer/v-6965376f__8677__47ea__a757__23e14c179149-9846_1_A!d-2006008872!BTVSfr?pid=29"
      },
      {
        "tekst": "Planforslag med beskrivelse, kart og bestemmelser.tif (pdf, 668KB)",
        "url": "https://www.strand.kommune.no/api/presentation/v2/nye-innsyn/filer/v-6965376f__8677__47ea__a757__23e14c179149-9908_1_A!d-2006008872!N4ZNH5?pid=29"
      },
      {
        "tekst": "Illustrasjon i industriområdet.tif (pdf, 459KB)",
        "url": "https://www.strand.kommune.no/api/presentation/v2/nye-innsyn/filer/v-6965376f__8677__47ea__a757__23e14c179149-9909_1_A!d-2006008872!pmh7Ss?pid=29"
      },
      {
        "tekst": "Uttalelse fra næringsforeningen.tif (pdf, 77KB)",
        "url": "https://www.strand.kommune.no/api/presentation/v2/nye-innsyn/filer/v-6965376f__8677__47ea__a757__23e14c179149-9910_1_A!d-2006008872!B862cZ?pid=29"
      }
    ],
    "status": "Publisert"
  },
  {
    "tittel": "SLUTTBEHANDLING AV REGULERINGSPLANEN FOR BOLIGOMRÅDE MELLOM KVERNVEGEN OG KROSSVATNET",
    "dato": "26.05.2006",
    "dato_iso": "2006-05-26",
    "dokumentID": "2006/8567",
    "dokumenttype": "Saksframlegg",
    "avsender_mottaker": "",
    "journal_link": "https://www.strand.kommune.no/tjenester/politikk-innsyn-og-medvirkning/postliste-dokumenter-og-vedtak/sok-i-post-dokumenter-og-saker/#/details/a-6965376f__8677__47ea__a757__23e14c179149-2006000142!L4T5bj/d-6965376f__8677__47ea__a757__23e14c179149-2006008567!RD8G2z",
    "filer": [
      {
        "tekst": "KVERNVEGEN/KROSSVATNET (pdf, 131KB)",
        "url": "https://www.strand.kommune.no/api/presentation/v2/nye-innsyn/filer/v-6965376f__8677__47ea__a757__23e14c179149-9487_1_A!d-2006008567!aWREsD?pid=29"
      },
      {
        "tekst": "REFERAT FRA MEKLINGSMØTE (pdf, 215KB)",
        "url": "https://www.strand.kommune.no/api/presentation/v2/nye-innsyn/filer/v-6965376f__8677__47ea__a757__23e14c179149-9489_1_A!d-2006008567!57ktKA?pid=29"
      },
      {
        "tekst": "Planforslag med meklingsresultat.pdf (pdf, 271KB)",
        "url": "https://www.strand.kommune.no/api/presentation/v2/nye-innsyn/filer/v-6965376f__8677__47ea__a757__23e14c179149-9490_1_A!d-2006008567!CUDAcp?pid=29"
      }
    ],
    "status": "Publisert"
  },
  {
    "tittel": "Møtebok KLA 23.05.2006",
    "dato": "24.05.2006",
    "dato_iso": "2006-05-24",
    "dokumentID": "2006/8852",
    "dokumenttype": "Møtebok",
    "avsender_mottaker": "",
    "journal_link": "https://www.strand.kommune.no/tjenester/politikk-innsyn-og-medvirkning/postliste-dokumenter-og-vedtak/sok-i-post-dokumenter-og-saker/#/details/a-6965376f__8677__47ea__a757__23e14c179149-2006001566!YPgIsG/d-6965376f__8677__47ea__a757__23e14c179149-2006008852!p3hrGt",
    "filer": [],
    "status": "Må bes om innsyn"
  },
  {
    "tittel": "KLA 23.05.2006",
    "dato": "23.05.2006",
    "dato_iso": "2006-05-23",
    "dokumentID": "2006/8713",
    "dokumenttype": "Møteprotokoll",
    "avsender_mottaker": "",
    "journal_link": "https://www.strand.kommune.no/tjenester/politikk-innsyn-og-medvirkning/postliste-dokumenter-og-vedtak/sok-i-post-dokumenter-og-saker/#/details/a-6965376f__8677__47ea__a757__23e14c179149-2006001566!YPgIsG/d-6965376f__8677__47ea__a757__23e14c179149-2006008713!HjaAMv",
    "filer": [],
    "status": "Må bes om innsyn"
  },
  {
    "tittel": "32/57 TILLATELSE TIL TILTAK - NYBYGG NAUST",
    "dato": "22.05.2006",
    "dato_iso": "2006-05-22",
    "dokumentID": "2006/8633",
    "dokumenttype": "Saksframlegg",
    "avsender_mottaker": "",
    "journal_link": "https://www.strand.kommune.no/tjenester/politikk-innsyn-og-medvirkning/postliste-dokumenter-og-vedtak/sok-i-post-dokumenter-og-saker/#/details/a-6965376f__8677__47ea__a757__23e14c179149-2006000495!2PdJsd/d-6965376f__8677__47ea__a757__23e14c179149-2006008633!PIBzIQ",
    "filer": [
      {
        "tekst": "32/57 TILLATELSE TIL TILTAK - NYBYGG NAUST (pdf, 292KB)",
        "url": "https://www.strand.kommune.no/api/presentation/v2/nye-innsyn/filer/v-6965376f__8677__47ea__a757__23e14c179149-9566_1_A!d-2006008633!XNjuJu?pid=29"
      }
    ],
    "status": "Publisert"
  },
  {
    "tittel": "OPPDELING I EIERSEKSJONER, GN 49/551",
    "dato": "22.05.2006",
    "dato_iso": "2006-05-22",
    "dokumentID": "2006/8647",
    "dokumenttype": "Saksframlegg",
    "avsender_mottaker": "",
    "journal_link": "https://www.strand.kommune.no/tjenester/politikk-innsyn-og-medvirkning/postliste-dokumenter-og-vedtak/sok-i-post-dokumenter-og-saker/#/details/a-6965376f__8677__47ea__a757__23e14c179149-2006001638!hl8uuL/d-6965376f__8677__47ea__a757__23e14c179149-2006008647!yl2I0M",
    "filer": [
      {
        "tekst": "OPPDELING I EIERSEKSJONER, GN 49/551 (pdf, 90KB)",
        "url": "https://www.strand.kommune.no/api/presentation/v2/nye-innsyn/filer/v-6965376f__8677__47ea__a757__23e14c179149-9576_1_A!d-2006008647!b8rdnZ?pid=29"
      }
    ],
    "status": "Publisert"
  },
  {
    "tittel": "57/6/1 LOKAL GODKJENNING AV FORETAK - FRITIDSBOLIG, BOTNEHAGEN",
    "dato": "19.05.2006",
    "dato_iso": "2006-05-19",
    "dokumentID": "2006/8545",
    "dokumenttype": "Saksframlegg",
    "avsender_mottaker": "",
    "journal_link": "https://www.strand.kommune.no/tjenester/politikk-innsyn-og-medvirkning/postliste-dokumenter-og-vedtak/sok-i-post-dokumenter-og-saker/#/details/a-6965376f__8677__47ea__a757__23e14c179149-2006001424!YNyZF7/d-6965376f__8677__47ea__a757__23e14c179149-2006008545!QifQF9",
    "filer": [
      {
        "tekst": "57/6/1 LOKAL GODKJENNING AV FORETAK - FRITIDSBOLIG, BOTNEHAGEN (pdf, 272KB)",
        "url": "https://www.strand.kommune.no/api/presentation/v2/nye-innsyn/filer/v-6965376f__8677__47ea__a757__23e14c179149-9455_1_A!d-2006008545!GzxAut?pid=29"
      }
    ],
    "status": "Publisert"
  },
  {
    "tittel": "58/33 TILLATELSE TIL TILTAK - FRITIDSBOLIG - ÅDNANES",
    "dato": "19.05.2006",
    "dato_iso": "2006-05-19",
    "dokumentID": "2006/8524",
    "dokumenttype": "Saksframlegg",
    "avsender_mottaker": "",
    "journal_link": "https://www.strand.kommune.no/tjenester/politikk-innsyn-og-medvirkning/postliste-dokumenter-og-vedtak/sok-i-post-dokumenter-og-saker/#/details/a-6965376f__8677__47ea__a757__23e14c179149-2006001421!pA3yZ7/d-6965376f__8677__47ea__a757__23e14c179149-2006008524!LdQBxT",
    "filer": [
      {
        "tekst": "58/33 TILLATELSE TIL TILTAK - FRITIDSBOLIG - ÅDNANES (pdf, 99KB)",
        "url": "https://www.strand.kommune.no/api/presentation/v2/nye-innsyn/filer/v-6965376f__8677__47ea__a757__23e14c179149-9441_1_A!d-2006008524!DXrw3d?pid=29"
      }
    ],
    "status": "Publisert"
  },
  {
    "tittel": "55/5 TILLATELSE TIL TILTAK - DRIVINGRANGEOVERBYGG",
    "dato": "19.05.2006",
    "dato_iso": "2006-05-19",
    "dokumentID": "2006/8519",
    "dokumenttype": "Saksframlegg",
    "avsender_mottaker": "",
    "journal_link": "https://www.strand.kommune.no/tjenester/politikk-innsyn-og-medvirkning/postliste-dokumenter-og-vedtak/sok-i-post-dokumenter-og-saker/#/details/a-6965376f__8677__47ea__a757__23e14c179149-2006001508!zyBRUM/d-6965376f__8677__47ea__a757__23e14c179149-2006008519!A8hkKx",
    "filer": [
      {
        "tekst": "55/5 TILLATELSE TIL TILTAK - DRIVINGRANGEOVERBYGG (pdf, 291KB)",
        "url": "https://www.strand.kommune.no/api/presentation/v2/nye-innsyn/filer/v-6965376f__8677__47ea__a757__23e14c179149-9421_1_A!d-2006008519!bYx4eN?pid=29"
      }
    ],
    "status": "Publisert"
  },
  {
    "tittel": "47/1,6,24 DELING AV GRUNNEIENDOM",
    "dato": "19.05.2006",
    "dato_iso": "2006-05-19",
    "dokumentID": "2006/8472",
    "dokumenttype": "Saksframlegg",
    "avsender_mottaker": "",
    "journal_link": "https://www.strand.kommune.no/tjenester/politikk-innsyn-og-medvirkning/postliste-dokumenter-og-vedtak/sok-i-post-dokumenter-og-saker/#/details/a-6965376f__8677__47ea__a757__23e14c179149-2006001663!lJqUAe/d-6965376f__8677__47ea__a757__23e14c179149-2006008472!OMS1kH",
    "filer": [
      {
        "tekst": "47/1,6,24 DELING AV GRUNNEIENDOM (pdf, 92KB)",
        "url": "https://www.strand.kommune.no/api/presentation/v2/nye-innsyn/filer/v-6965376f__8677__47ea__a757__23e14c179149-9378_1_A!d-2006008472!R7ZSSM?pid=29"
      }
    ],
    "status": "Publisert"
  },
  {
    "tittel": "9/9 SØKNAD OM JORDBRUKSVEG, VERVIK",
    "dato": "19.05.2006",
    "dato_iso": "2006-05-19",
    "dokumentID": "2006/8494",
    "dokumenttype": "Saksframlegg",
    "avsender_mottaker": "",
    "journal_link": "https://www.strand.kommune.no/tjenester/politikk-innsyn-og-medvirkning/postliste-dokumenter-og-vedtak/sok-i-post-dokumenter-og-saker/#/details/a-6965376f__8677__47ea__a757__23e14c179149-2006001025!akBKr0/d-6965376f__8677__47ea__a757__23e14c179149-2006008494!pY8ktU",
    "filer": [
      {
        "tekst": "9/9 SØKNAD OM JORDBRUKSVEG, VERVIK (pdf, 289KB)",
        "url": "https://www.strand.kommune.no/api/presentation/v2/nye-innsyn/filer/v-6965376f__8677__47ea__a757__23e14c179149-9408_1_A!d-2006008494!NFJSrq?pid=29"
      }
    ],
    "status": "Publisert"
  },
  {
    "tittel": "65/27 TILLATELSE TIL TILTAK - RIVING OG OPPSETTING AV FRITIDSBOLIG",
    "dato": "19.05.2006",
    "dato_iso": "2006-05-19",
    "dokumentID": "2006/8478",
    "dokumenttype": "Saksframlegg",
    "avsender_mottaker": "",
    "journal_link": "https://www.strand.kommune.no/tjenester/politikk-innsyn-og-medvirkning/postliste-dokumenter-og-vedtak/sok-i-post-dokumenter-og-saker/#/details/a-6965376f__8677__47ea__a757__23e14c179149-2006000970!MxZpfx/d-6965376f__8677__47ea__a757__23e14c179149-2006008478!Z1Xdio",
    "filer": [
      {
        "tekst": "65/27 TILLATELSE TIL TILTAK - RIVING OG OPPSETTING AV FRITIDSBOLIG (pdf, 294KB)",
        "url": "https://www.strand.kommune.no/api/presentation/v2/nye-innsyn/filer/v-6965376f__8677__47ea__a757__23e14c179149-9397_1_A!d-2006008478!4ijQWE?pid=29"
      }
    ],
    "status": "Publisert"
  },
  {
    "tittel": "KOM 31.05.2006",
    "dato": "19.05.2006",
    "dato_iso": "2006-05-19",
    "dokumentID": "2006/8515",
    "dokumenttype": "Sakskart",
    "avsender_mottaker": "",
    "journal_link": "https://www.strand.kommune.no/tjenester/politikk-innsyn-og-medvirkning/postliste-dokumenter-og-vedtak/sok-i-post-dokumenter-og-saker/#/details/a-6965376f__8677__47ea__a757__23e14c179149-2006001518!Cloevf/d-6965376f__8677__47ea__a757__23e14c179149-2006008515!GaswKd",
    "filer": [
      {
        "tekst": "KOM 31.05.2006 (pdf, 880KB)",
        "url": "https://www.strand.kommune.no/api/presentation/v2/nye-innsyn/filer/v-6965376f__8677__47ea__a757__23e14c179149-9420_1_A!d-2006008515!DJNW68?pid=29"
      }
    ],
    "status": "Publisert"
  },
  {
    "tittel": "KOM 31.05.2006",
    "dato": "19.05.2006",
    "dato_iso": "2006-05-19",
    "dokumentID": "2006/8532",
    "dokumenttype": "Møteprotokoll",
    "avsender_mottaker": "",
    "journal_link": "https://www.strand.kommune.no/tjenester/politikk-innsyn-og-medvirkning/postliste-dokumenter-og-vedtak/sok-i-post-dokumenter-og-saker/#/details/a-6965376f__8677__47ea__a757__23e14c179149-2006001518!Cloevf/d-6965376f__8677__47ea__a757__23e14c179149-2006008532!LEoezs",
    "filer": [
      {
        "tekst": "KOM 31.05.2006 (pdf, 545KB)",
        "url": "https://www.strand.kommune.no/api/presentation/v2/nye-innsyn/filer/v-6965376f__8677__47ea__a757__23e14c179149-9448_1_A!d-2006008532!h4tQ5v?pid=29"
      }
    ],
    "status": "Publisert"
  },
  {
    "tittel": "63/84 RAMMETILLATELSE - RIVING OG OPPSETTING AV FRITIDSBOLIG - IDSE",
    "dato": "18.05.2006",
    "dato_iso": "2006-05-18",
    "dokumentID": "2006/8362",
    "dokumenttype": "Saksframlegg",
    "avsender_mottaker": "",
    "journal_link": "https://www.strand.kommune.no/tjenester/politikk-innsyn-og-medvirkning/postliste-dokumenter-og-vedtak/sok-i-post-dokumenter-og-saker/#/details/a-6965376f__8677__47ea__a757__23e14c179149-2006000817!zblLDk/d-6965376f__8677__47ea__a757__23e14c179149-2006008362!dDrLTh",
    "filer": [
      {
        "tekst": "63/84 RAMMETILLATELSE - RIVING OG OPPSETTING AV FRITIDSBOLIG - IDSE (pdf, 374KB)",
        "url": "https://www.strand.kommune.no/api/presentation/v2/nye-innsyn/filer/v-6965376f__8677__47ea__a757__23e14c179149-9256_1_A!d-2006008362!xKIm5A?pid=29"
      }
    ],
    "status": "Publisert"
  },
  {
    "tittel": "31/614 MELDING OM TILTAK - GARASJE",
    "dato": "18.05.2006",
    "dato_iso": "2006-05-18",
    "dokumentID": "2006/8430",
    "dokumenttype": "Saksframlegg",
    "avsender_mottaker": "",
    "journal_link": "https://www.strand.kommune.no/tjenester/politikk-innsyn-og-medvirkning/postliste-dokumenter-og-vedtak/sok-i-post-dokumenter-og-saker/#/details/a-6965376f__8677__47ea__a757__23e14c179149-2006001163!Sftglw/d-6965376f__8677__47ea__a757__23e14c179149-2006008430!pTKA3L",
    "filer": [
      {
        "tekst": "31/614 MELDING OM TILTAK - GARASJE (pdf, 291KB)",
        "url": "https://www.strand.kommune.no/api/presentation/v2/nye-innsyn/filer/v-6965376f__8677__47ea__a757__23e14c179149-9330_1_A!d-2006008430!bXFOan?pid=29"
      }
    ],
    "status": "Publisert"
  },
  {
    "tittel": "59/2 TILLATELSE TIL TILTAK - MOLO",
    "dato": "18.05.2006",
    "dato_iso": "2006-05-18",
    "dokumentID": "2006/8442",
    "dokumenttype": "Saksframlegg",
    "avsender_mottaker": "",
    "journal_link": "https://www.strand.kommune.no/tjenester/politikk-innsyn-og-medvirkning/postliste-dokumenter-og-vedtak/sok-i-post-dokumenter-og-saker/#/details/a-6965376f__8677__47ea__a757__23e14c179149-2006000697!qhAIUX/d-6965376f__8677__47ea__a757__23e14c179149-2006008442!f4Rwtu",
    "filer": [
      {
        "tekst": "59/2 TILLATELSE TIL TILTAK - MOLO (pdf, 295KB)",
        "url": "https://www.strand.kommune.no/api/presentation/v2/nye-innsyn/filer/v-6965376f__8677__47ea__a757__23e14c179149-9348_1_A!d-2006008442!05nSDT?pid=29"
      }
    ],
    "status": "Publisert"
  },
  {
    "tittel": "31/210 TILLATELSE TIL TILTAK - OMBYGGING/TILBYGG BOLIG OG GARASJE",
    "dato": "18.05.2006",
    "dato_iso": "2006-05-18",
    "dokumentID": "2006/8438",
    "dokumenttype": "Saksframlegg",
    "avsender_mottaker": "",
    "journal_link": "https://www.strand.kommune.no/tjenester/politikk-innsyn-og-medvirkning/postliste-dokumenter-og-vedtak/sok-i-post-dokumenter-og-saker/#/details/a-6965376f__8677__47ea__a757__23e14c179149-2006001329!umtSAT/d-6965376f__8677__47ea__a757__23e14c179149-2006008438!sZecJS",
    "filer": [
      {
        "tekst": "31/210 TILLATELSE TIL TILTAK - OMBYGGING/TILBYGG BOLIG OG GARASJE (pdf, 293KB)",
        "url": "https://www.strand.kommune.no/api/presentation/v2/nye-innsyn/filer/v-6965376f__8677__47ea__a757__23e14c179149-9345_1_A!d-2006008438!ZORiy7?pid=29"
      }
    ],
    "status": "Publisert"
  },
  {
    "tittel": "9/9 DELING AV GRUNNEIENDOM",
    "dato": "18.05.2006",
    "dato_iso": "2006-05-18",
    "dokumentID": "2006/1129",
    "dokumenttype": "Saksframlegg",
    "avsender_mottaker": "",
    "journal_link": "https://www.strand.kommune.no/tjenester/politikk-innsyn-og-medvirkning/postliste-dokumenter-og-vedtak/sok-i-post-dokumenter-og-saker/#/details/a-6965376f__8677__47ea__a757__23e14c179149-2006000558!JShQWV/d-6965376f__8677__47ea__a757__23e14c179149-2006001129!NuISrn",
    "filer": [
      {
        "tekst": "9/9 DELING AV GRUNNEIENDOM (pdf, 82KB)",
        "url": "https://www.strand.kommune.no/api/presentation/v2/nye-innsyn/filer/v-6965376f__8677__47ea__a757__23e14c179149-1934_1_P!d-2006001129!IfrLOY?pid=29"
      }
    ],
    "status": "Publisert"
  },
  {
    "tittel": "49/667 TILLATELSE TIL TILTAK - FRITIDSBOLIG LIARVATNET",
    "dato": "16.05.2006",
    "dato_iso": "2006-05-16",
    "dokumentID": "2006/8170",
    "dokumenttype": "Saksframlegg",
    "avsender_mottaker": "",
    "journal_link": "https://www.strand.kommune.no/tjenester/politikk-innsyn-og-medvirkning/postliste-dokumenter-og-vedtak/sok-i-post-dokumenter-og-saker/#/details/a-6965376f__8677__47ea__a757__23e14c179149-2006001420!eyWjwJ/d-6965376f__8677__47ea__a757__23e14c179149-2006008170!rcEqlT",
    "filer": [
      {
        "tekst": "49/667 TILLATELSE TIL TILTAK - FRITIDSBOLIG LIARVATNET (pdf, 294KB)",
        "url": "https://www.strand.kommune.no/api/presentation/v2/nye-innsyn/filer/v-6965376f__8677__47ea__a757__23e14c179149-9061_1_A!d-2006008170!WJ90Mi?pid=29"
      }
    ],
    "status": "Publisert"
  },
  {
    "tittel": "KLA 23.05.2006",
    "dato": "15.05.2006",
    "dato_iso": "2006-05-15",
    "dokumentID": "2006/8059",
    "dokumenttype": "Sakskart",
    "avsender_mottaker": "",
    "journal_link": "https://www.strand.kommune.no/tjenester/politikk-innsyn-og-medvirkning/postliste-dokumenter-og-vedtak/sok-i-post-dokumenter-og-saker/#/details/a-6965376f__8677__47ea__a757__23e14c179149-2006001566!YPgIsG/d-6965376f__8677__47ea__a757__23e14c179149-2006008059!gW6oeo",
    "filer": [],
    "status": "Må bes om innsyn"
  },
  {
    "tittel": "Møtebok FOR 10.05.2006",
    "dato": "15.05.2006",
    "dato_iso": "2006-05-15",
    "dokumentID": "2006/8004",
    "dokumenttype": "Møtebok",
    "avsender_mottaker": "",
    "journal_link": "https://www.strand.kommune.no/tjenester/politikk-innsyn-og-medvirkning/postliste-dokumenter-og-vedtak/sok-i-post-dokumenter-og-saker/#/details/a-6965376f__8677__47ea__a757__23e14c179149-2006000383!g0uPn1/d-6965376f__8677__47ea__a757__23e14c179149-2006008004!izrc7V",
    "filer": [],
    "status": "Må bes om innsyn"
  },
  {
    "tittel": "Møtebok FVA 10.05.2006",
    "dato": "14.05.2006",
    "dato_iso": "2006-05-14",
    "dokumentID": "2006/7949",
    "dokumenttype": "Møtebok",
    "avsender_mottaker": "",
    "journal_link": "https://www.strand.kommune.no/tjenester/politikk-innsyn-og-medvirkning/postliste-dokumenter-og-vedtak/sok-i-post-dokumenter-og-saker/#/details/a-6965376f__8677__47ea__a757__23e14c179149-2006000400!El8S0G/d-6965376f__8677__47ea__a757__23e14c179149-2006007949!KuW0Tr",
    "filer": [],
    "status": "Må bes om innsyn"
  },
  {
    "tittel": "FVA 10.05.2006",
    "dato": "10.05.2006",
    "dato_iso": "2006-05-10",
    "dokumentID": "2006/7583",
    "dokumenttype": "Møteprotokoll",
    "avsender_mottaker": "",
    "journal_link": "https://www.strand.kommune.no/tjenester/politikk-innsyn-og-medvirkning/postliste-dokumenter-og-vedtak/sok-i-post-dokumenter-og-saker/#/details/a-6965376f__8677__47ea__a757__23e14c179149-2006000400!El8S0G/d-6965376f__8677__47ea__a757__23e14c179149-2006007583!06Xun8",
    "filer": [
      {
        "tekst": "FVA 10.05.2006 (pdf, 501KB)",
        "url": "https://www.strand.kommune.no/api/presentation/v2/nye-innsyn/filer/v-6965376f__8677__47ea__a757__23e14c179149-8409_1_A!d-2006007583!haHGrd?pid=29"
      }
    ],
    "status": "Publisert"
  },
  {
    "tittel": "53/4 LOKAL GODKJENNING AV FORETAK - STEINHAGEN, FELT B1",
    "dato": "09.05.2006",
    "dato_iso": "2006-05-09",
    "dokumentID": "2006/7287",
    "dokumenttype": "Saksframlegg",
    "avsender_mottaker": "",
    "journal_link": "https://www.strand.kommune.no/tjenester/politikk-innsyn-og-medvirkning/postliste-dokumenter-og-vedtak/sok-i-post-dokumenter-og-saker/#/details/a-6965376f__8677__47ea__a757__23e14c179149-2006000047!LggiRI/d-6965376f__8677__47ea__a757__23e14c179149-2006007287!CF3bIe",
    "filer": [
      {
        "tekst": "53/4 LOKAL GODKJENNING AV FORETAK - STEINHAGEN, FELT B1 (pdf, 289KB)",
        "url": "https://www.strand.kommune.no/api/presentation/v2/nye-innsyn/filer/v-6965376f__8677__47ea__a757__23e14c179149-8089_1_A!d-2006007287!4o8Yvi?pid=29"
      }
    ],
    "status": "Publisert"
  },
  {
    "tittel": "44/573 TILLATELSE TIL TILTAK - TILBYGG BOLIG",
    "dato": "09.05.2006",
    "dato_iso": "2006-05-09",
    "dokumentID": "2006/7003",
    "dokumenttype": "Saksframlegg",
    "avsender_mottaker": "",
    "journal_link": "https://www.strand.kommune.no/tjenester/politikk-innsyn-og-medvirkning/postliste-dokumenter-og-vedtak/sok-i-post-dokumenter-og-saker/#/details/a-6965376f__8677__47ea__a757__23e14c179149-2006000743!X3Plhb/d-6965376f__8677__47ea__a757__23e14c179149-2006007003!an32jU",
    "filer": [
      {
        "tekst": "44/573 TILLATELSE TIL TILTAK - TILBYGG BOLIG (pdf, 296KB)",
        "url": "https://www.strand.kommune.no/api/presentation/v2/nye-innsyn/filer/v-6965376f__8677__47ea__a757__23e14c179149-7797_1_A!d-2006007003!iDrMJu?pid=29"
      }
    ],
    "status": "Publisert"
  },
  {
    "tittel": "63/5 TILTAK - SJØBODER IDSE",
    "dato": "08.05.2006",
    "dato_iso": "2006-05-08",
    "dokumentID": "2006/7380",
    "dokumenttype": "Saksframlegg",
    "avsender_mottaker": "",
